root@lamp-s-1vcpu-1gb-nyc1-01:~# tcpdump -i eth0 port 22
tcpdump: verbose output suppressed, use -v or -vv for full protocol decode
listening on eth0, link-type EN10MB (Ethernet), capture size 262144 bytes
20:41:02.800448 IP lamp-s-1vcpu-1gb-nyc1-01.ssh > 198.96.85.163.26087: Flags [P.], seq 3985560211:3985560319, ack 643422394, win 313, length 108
20:41:02.800544 IP lamp-s-1vcpu-1gb-nyc1-01.ssh > 198.96.85.163.26087: Flags [P.], seq 108:144, ack 1, win 313, length 36
20:41:02.800624 IP lamp-s-1vcpu-1gb-nyc1-01.ssh > 198.96.85.163.26087: Flags [P.], seq 144:252, ack 1, win 313, length 108
20:41:02.800680 IP lamp-s-1vcpu-1gb-nyc1-01.ssh > 198.96.85.163.26087: Flags [P.], seq 252:288, ack 1, win 313, length 36
20:41:02.802267 IP lamp-s-1vcpu-1gb-nyc1-01.ssh > 198.96.85.163.26087: Flags [P.], seq 288:468, ack 1, win 313, length 180
20:41:02.802358 IP lamp-s-1vcpu-1gb-nyc1-01.ssh > 198.96.85.163.26087: Flags [P.], seq 468:504, ack 1, win 313, length 36
20:41:02.802443 IP lamp-s-1vcpu-1gb-nyc1-01.ssh > 198.96.85.163.26087: Flags [P.], seq 504:660, ack 1, win 313, length 156
20:41:02.802523 IP lamp-s-1vcpu-1gb-nyc1-01.ssh > 198.96.85.163.26087: Flags [P.], seq 660:696, ack 1, win 313, length 36
20:41:02.802661 IP lamp-s-1vcpu-1gb-nyc1-01.ssh > 198.96.85.163.26087: Flags [P.], seq 696:852, ack 1, win 313, length 156
20:41:02.819878 IP 198.96.85.163.26087 > lamp-s-1vcpu-1gb-nyc1-01.ssh: Flags [.], ack 288, win 2051, length 0
20:41:02.819941 IP lamp-s-1vcpu-1gb-nyc1-01.ssh > 198.96.85.163.26087: Flags [P.], seq 852:2040, ack 1, win 313, length 1188
20:41:02.820176 IP lamp-s-1vcpu-1gb-nyc1-01.ssh > 198.96.85.163.26087: Flags [P.], seq 2040:2188, ack 1, win 313, length 148
20:41:02.820258 IP lamp-s-1vcpu-1gb-nyc1-01.ssh > 198.96.85.163.26087: Flags [P.], seq 2188:2224, ack 1, win 313, length 36
20:41:02.820351 IP lamp-s-1vcpu-1gb-nyc1-01.ssh > 198.96.85.163.26087: Flags [P.], seq 2224:2388, ack 1, win 313, length 164
20:41:02.820415 IP lamp-s-1vcpu-1gb-nyc1-01.ssh > 198.96.85.163.26087: Flags [P.], seq 2388:2424, ack 1, win 313, length 36
20:41:02.820501 IP lamp-s-1vcpu-1gb-nyc1-01.ssh > 198.96.85.163.26087: Flags [P.], seq 2424:2588, ack 1, win 313, length 164
20:41:02.820570 IP lamp-s-1vcpu-1gb-nyc1-01.ssh > 198.96.85.163.26087: Flags [P.], seq 2588:2624, ack 1, win 313, length 36
20:41:02.820655 IP lamp-s-1vcpu-1gb-nyc1-01.ssh > 198.96.85.163.26087: Flags [P.], seq 2624:2788, ack 1, win 313, length 164
20:41:02.820726 IP lamp-s-1vcpu-1gb-nyc1-01.ssh > 198.96.85.163.26087: Flags [P.], seq 2788:2824, ack 1, win 313, length 36
20:41:02.820810 IP lamp-s-1vcpu-1gb-nyc1-01.ssh > 198.96.85.163.26087: Flags [P.], seq 2824:2988, ack 1, win 313, length 164
20:41:02.821919 IP 198.96.85.163.26087 > lamp-s-1vcpu-1gb-nyc1-01.ssh: Flags [.], ack 852, win 2049, length 0
20:41:02.821954 IP lamp-s-1vcpu-1gb-nyc1-01.ssh > 198.96.85.163.26087: Flags [P.], seq 2988:4224, ack 1, win 313, length 1236
20:41:02.822068 IP lamp-s-1vcpu-1gb-nyc1-01.ssh > 198.96.85.163.26087: Flags [P.], seq 4224:4372, ack 1, win 313, length 148
20:41:02.822169 IP lamp-s-1vcpu-1gb-nyc1-01.ssh > 198.96.85.163.26087: Flags [P.], seq 4372:4408, ack 1, win 313, length 36
20:41:02.822310 IP lamp-s-1vcpu-1gb-nyc1-01.ssh > 198.96.85.163.26087: Flags [P.], seq 4408:4572, ack 1, win 313, length 164
20:41:02.822372 IP lamp-s-1vcpu-1gb-nyc1-01.ssh > 198.96.85.163.26087: Flags [P.], seq 4572:4608, ack 1, win 313, length 36
20:41:02.822456 IP lamp-s-1vcpu-1gb-nyc1-01.ssh > 198.96.85.163.26087: Flags [P.], seq 4608:4772, ack 1, win 313, length 164
20:41:02.822548 IP lamp-s-1vcpu-1gb-nyc1-01.ssh > 198.96.85.163.26087: Flags [P.], seq 4772:4808, ack 1, win 313, length 36
20:41:02.822641 IP lamp-s-1vcpu-1gb-nyc1-01.ssh > 198.96.85.163.26087: Flags [P.], seq 4808:4972, ack 1, win 313, length 164
20:41:02.822698 IP lamp-s-1vcpu-1gb-nyc1-01.ssh > 198.96.85.163.26087: Flags [P.], seq 4972:5008, ack 1, win 313, length 36
20:41:02.822762 IP lamp-s-1vcpu-1gb-nyc1-01.ssh > 198.96.85.163.26087: Flags [P.], seq 5008:5172, ack 1, win 313, length 164
20:41:02.840492 IP 198.96.85.163.26087 > lamp-s-1vcpu-1gb-nyc1-01.ssh: Flags [.], ack 2988, win 2051, length 0
20:41:02.840587 IP lamp-s-1vcpu-1gb-nyc1-01.ssh > 198.96.85.163.26087: Flags [P.], seq 5172:6408, ack 1, win 313, length 1236
20:41:02.840850 IP lamp-s-1vcpu-1gb-nyc1-01.ssh > 198.96.85.163.26087: Flags [P.], seq 6408:6556, ack 1, win 313, length 148
20:41:02.840962 IP lamp-s-1vcpu-1gb-nyc1-01.ssh > 198.96.85.163.26087: Flags [P.], seq 6556:6592, ack 1, win 313, length 36
20:41:02.841099 IP lamp-s-1vcpu-1gb-nyc1-01.ssh > 198.96.85.163.26087: Flags [P.], seq 6592:6756, ack 1, win 313, length 164
20:41:02.841197 IP lamp-s-1vcpu-1gb-nyc1-01.ssh > 198.96.85.163.26087: Flags [P.], seq 6756:6792, ack 1, win 313, length 36
20:41:02.841364 IP lamp-s-1vcpu-1gb-nyc1-01.ssh > 198.96.85.163.26087: Flags [P.], seq 6792:6956, ack 1, win 313, length 164
20:41:02.841466 IP lamp-s-1vcpu-1gb-nyc1-01.ssh > 198.96.85.163.26087: Flags [P.], seq 6956:6992, ack 1, win 313, length 36
20:41:02.841616 IP lamp-s-1vcpu-1gb-nyc1-01.ssh > 198.96.85.163.26087: Flags [P.], seq 6992:7156, ack 1, win 313, length 164
20:41:02.841702 IP lamp-s-1vcpu-1gb-nyc1-01.ssh > 198.96.85.163.26087: Flags [P.], seq 7156:7192, ack 1, win 313, length 36
20:41:02.841828 IP lamp-s-1vcpu-1gb-nyc1-01.ssh > 198.96.85.163.26087: Flags [P.], seq 7192:7356, ack 1, win 313, length 164
20:41:02.842042 IP lamp-s-1vcpu-1gb-nyc1-01.ssh > 198.96.85.163.26087: Flags [P.], seq 7392:7556, ack 1, win 313, length 164
20:41:02.842302 IP lamp-s-1vcpu-1gb-nyc1-01.ssh > 198.96.85.163.26087: Flags [P.], seq 7592:7756, ack 1, win 313, length 164
20:41:02.842523 IP lamp-s-1vcpu-1gb-nyc1-01.ssh > 198.96.85.163.26087: Flags [P.], seq 7792:7956, ack 1, win 313, length 164
20:41:02.842739 IP lamp-s-1vcpu-1gb-nyc1-01.ssh > 198.96.85.163.26087: Flags [P.], seq 7992:8156, ack 1, win 313, length 164
20:41:02.842968 IP lamp-s-1vcpu-1gb-nyc1-01.ssh > 198.96.85.163.26087: Flags [P.], seq 8192:8356, ack 1, win 313, length 164
20:41:02.843437 IP 198.96.85.163.26087 > lamp-s-1vcpu-1gb-nyc1-01.ssh: Flags [.], ack 4808, win 2051, length 0
20:41:02.843470 IP lamp-s-1vcpu-1gb-nyc1-01.ssh > 198.96.85.163.26087: Flags [P.], seq 8356:8756, ack 1, win 313, length 400
20:41:02.843564 IP lamp-s-1vcpu-1gb-nyc1-01.ssh > 198.96.85.163.26087: Flags [P.], seq 8756:8920, ack 1, win 313, length 164
20:41:02.843898 IP lamp-s-1vcpu-1gb-nyc1-01.ssh > 198.96.85.163.26087: Flags [P.], seq 8920:9700, ack 1, win 313, length 780
20:41:02.844053 IP lamp-s-1vcpu-1gb-nyc1-01.ssh > 198.96.85.163.26087: Flags [P.], seq 9700:9864, ack 1, win 313, length 164
20:41:02.844180 IP lamp-s-1vcpu-1gb-nyc1-01.ssh > 198.96.85.163.26087: Flags [P.], seq 9864:10028, ack 1, win 313, length 164
20:41:02.844299 IP lamp-s-1vcpu-1gb-nyc1-01.ssh > 198.96.85.163.26087: Flags [P.], seq 10028:10192, ack 1, win 313, length 164
20:41:02.844419 IP lamp-s-1vcpu-1gb-nyc1-01.ssh > 198.96.85.163.26087: Flags [P.], seq 10192:10356, ack 1, win 313, length 164
20:41:02.844595 IP lamp-s-1vcpu-1gb-nyc1-01.ssh > 198.96.85.163.26087: Flags [P.], seq 10356:10520, ack 1, win 313, length 164
20:41:02.844775 IP lamp-s-1vcpu-1gb-nyc1-01.ssh > 198.96.85.163.26087: Flags [P.], seq 10520:10684, ack 1, win 313, length 164
20:41:02.844948 IP lamp-s-1vcpu-1gb-nyc1-01.ssh > 198.96.85.163.26087: Flags [P.], seq 10684:10848, ack 1, win 313, length 164
20:41:02.845081 IP lamp-s-1vcpu-1gb-nyc1-01.ssh > 198.96.85.163.26087: Flags [P.], seq 10848:11012, ack 1, win 313, length 164
20:41:02.845186 IP lamp-s-1vcpu-1gb-nyc1-01.ssh > 198.96.85.163.26087: Flags [P.], seq 11012:11176, ack 1, win 313, length 164
20:41:02.845307 IP lamp-s-1vcpu-1gb-nyc1-01.ssh > 198.96.85.163.26087: Flags [P.], seq 11176:11340, ack 1, win 313, length 164
20:41:02.845406 IP lamp-s-1vcpu-1gb-nyc1-01.ssh > 198.96.85.163.26087: Flags [P.], seq 11340:11504, ack 1, win 313, length 164
20:41:02.845885 IP 198.96.85.163.26087 > lamp-s-1vcpu-1gb-nyc1-01.ssh: Flags [.], ack 5172, win 2050, length 0
20:41:02.845912 IP lamp-s-1vcpu-1gb-nyc1-01.ssh > 198.96.85.163.26087: Flags [P.], seq 11504:11668, ack 1, win 313, length 164
20:41:02.846035 IP lamp-s-1vcpu-1gb-nyc1-01.ssh > 198.96.85.163.26087: Flags [P.], seq 11668:11944, ack 1, win 313, length 276
20:41:02.846175 IP lamp-s-1vcpu-1gb-nyc1-01.ssh > 198.96.85.163.26087: Flags [P.], seq 11944:12108, ack 1, win 313, length 164
20:41:02.846334 IP lamp-s-1vcpu-1gb-nyc1-01.ssh > 198.96.85.163.26087: Flags [P.], seq 12108:12272, ack 1, win 313, length 164
20:41:02.846425 IP lamp-s-1vcpu-1gb-nyc1-01.ssh > 198.96.85.163.26087: Flags [P.], seq 12272:12436, ack 1, win 313, length 164
20:41:02.846506 IP lamp-s-1vcpu-1gb-nyc1-01.ssh > 198.96.85.163.26087: Flags [P.], seq 12436:12600, ack 1, win 313, length 164
20:41:02.860614 IP 198.96.85.163.26087 > lamp-s-1vcpu-1gb-nyc1-01.ssh: Flags [.], ack 6756, win 2051, length 0
20:41:02.860683 IP lamp-s-1vcpu-1gb-nyc1-01.ssh > 198.96.85.163.26087: Flags [P.], seq 12600:12764, ack 1, win 313, length 164
20:41:02.860936 IP lamp-s-1vcpu-1gb-nyc1-01.ssh > 198.96.85.163.26087: Flags [P.], seq 12764:13040, ack 1, win 313, length 276
20:41:02.861073 IP lamp-s-1vcpu-1gb-nyc1-01.ssh > 198.96.85.163.26087: Flags [P.], seq 13040:13204, ack 1, win 313, length 164
20:41:02.861171 IP lamp-s-1vcpu-1gb-nyc1-01.ssh > 198.96.85.163.26087: Flags [P.], seq 13204:13368, ack 1, win 313, length 164
20:41:02.861301 IP lamp-s-1vcpu-1gb-nyc1-01.ssh > 198.96.85.163.26087: Flags [P.], seq 13368:13532, ack 1, win 313, length 164
20:41:02.861404 IP lamp-s-1vcpu-1gb-nyc1-01.ssh > 198.96.85.163.26087: Flags [P.], seq 13532:13696, ack 1, win 313, length 164
20:41:02.861501 IP lamp-s-1vcpu-1gb-nyc1-01.ssh > 198.96.85.163.26087: Flags [P.], seq 13696:13860, ack 1, win 313, length 164
20:41:02.861625 IP lamp-s-1vcpu-1gb-nyc1-01.ssh > 198.96.85.163.26087: Flags [P.], seq 13860:14024, ack 1, win 313, length 164
20:41:02.862193 IP 198.96.85.163.26087 > lamp-s-1vcpu-1gb-nyc1-01.ssh: Flags [.], ack 7992, win 2046, length 0
20:41:02.862231 IP lamp-s-1vcpu-1gb-nyc1-01.ssh > 198.96.85.163.26087: Flags [P.], seq 14024:14188, ack 1, win 313, length 164
20:41:02.862388 IP lamp-s-1vcpu-1gb-nyc1-01.ssh > 198.96.85.163.26087: Flags [P.], seq 14188:14464, ack 1, win 313, length 276
20:41:02.862494 IP lamp-s-1vcpu-1gb-nyc1-01.ssh > 198.96.85.163.26087: Flags [P.], seq 14464:14628, ack 1, win 313, length 164
20:41:02.862585 IP 198.96.85.163.26087 > lamp-s-1vcpu-1gb-nyc1-01.ssh: Flags [.], ack 8356, win 2051, length 0
20:41:02.862673 IP lamp-s-1vcpu-1gb-nyc1-01.ssh > 198.96.85.163.26087: Flags [P.], seq 14628:14792, ack 1, win 313, length 164
20:41:02.862765 IP lamp-s-1vcpu-1gb-nyc1-01.ssh > 198.96.85.163.26087: Flags [P.], seq 14792:14940, ack 1, win 313, length 148
20:41:02.862827 IP 198.96.85.163.26087 > lamp-s-1vcpu-1gb-nyc1-01.ssh: Flags [.], ack 8920, win 2049, length 0
20:41:02.862996 IP lamp-s-1vcpu-1gb-nyc1-01.ssh > 198.96.85.163.26087: Flags [P.], seq 14940:15104, ack 1, win 313, length 164
20:41:02.863071 IP lamp-s-1vcpu-1gb-nyc1-01.ssh > 198.96.85.163.26087: Flags [P.], seq 15104:15380, ack 1, win 313, length 276
20:41:02.863196 IP lamp-s-1vcpu-1gb-nyc1-01.ssh > 198.96.85.163.26087: Flags [P.], seq 15380:15672, ack 1, win 313, length 292
20:41:02.863309 IP lamp-s-1vcpu-1gb-nyc1-01.ssh > 198.96.85.163.26087: Flags [P.], seq 15672:15836, ack 1, win 313, length 164
20:41:02.863408 IP lamp-s-1vcpu-1gb-nyc1-01.ssh > 198.96.85.163.26087: Flags [P.], seq 15836:16000, ack 1, win 313, length 164
20:41:02.863504 IP lamp-s-1vcpu-1gb-nyc1-01.ssh > 198.96.85.163.26087: Flags [P.], seq 16000:16164, ack 1, win 313, length 164
20:41:02.863598 IP lamp-s-1vcpu-1gb-nyc1-01.ssh > 198.96.85.163.26087: Flags [P.], seq 16164:16328, ack 1, win 313, length 164
20:41:02.863693 IP lamp-s-1vcpu-1gb-nyc1-01.ssh > 198.96.85.163.26087: Flags [P.], seq 16328:16492, ack 1, win 313, length 164
20:41:02.863784 IP lamp-s-1vcpu-1gb-nyc1-01.ssh > 198.96.85.163.26087: Flags [P.], seq 16492:16656, ack 1, win 313, length 164
20:41:02.863875 IP lamp-s-1vcpu-1gb-nyc1-01.ssh > 198.96.85.163.26087: Flags [P.], seq 16656:16820, ack 1, win 313, length 164
20:41:02.863992 IP lamp-s-1vcpu-1gb-nyc1-01.ssh > 198.96.85.163.26087: Flags [P.], seq 16820:16984, ack 1, win 313, length 164
20:41:02.864118 IP lamp-s-1vcpu-1gb-nyc1-01.ssh > 198.96.85.163.26087: Flags [P.], seq 16984:17148, ack 1, win 313, length 164
20:41:02.864234 IP lamp-s-1vcpu-1gb-nyc1-01.ssh > 198.96.85.163.26087: Flags [P.], seq 17148:17312, ack 1, win 313, length 164
20:41:02.864342 IP lamp-s-1vcpu-1gb-nyc1-01.ssh > 198.96.85.163.26087: Flags [P.], seq 17312:17476, ack 1, win 313, length 164
20:41:02.864447 IP lamp-s-1vcpu-1gb-nyc1-01.ssh > 198.96.85.163.26087: Flags [P.], seq 17476:17640, ack 1, win 313, length 164
20:41:02.864542 IP lamp-s-1vcpu-1gb-nyc1-01.ssh > 198.96.85.163.26087: Flags [P.], seq 17640:17804, ack 1, win 313, length 164
20:41:02.864602 IP 198.96.85.163.26087 > lamp-s-1vcpu-1gb-nyc1-01.ssh: Flags [.], ack 11012, win 2051, length 0
20:41:02.864707 IP lamp-s-1vcpu-1gb-nyc1-01.ssh > 198.96.85.163.26087: Flags [P.], seq 17804:18080, ack 1, win 313, length 276
20:41:02.864811 IP lamp-s-1vcpu-1gb-nyc1-01.ssh > 198.96.85.163.26087: Flags [P.], seq 18080:18244, ack 1, win 313, length 164
20:41:02.864903 IP lamp-s-1vcpu-1gb-nyc1-01.ssh > 198.96.85.163.26087: Flags [P.], seq 18244:18408, ack 1, win 313, length 164
20:41:02.865011 IP lamp-s-1vcpu-1gb-nyc1-01.ssh > 198.96.85.163.26087: Flags [P.], seq 18408:18572, ack 1, win 313, length 164
20:41:02.865115 IP lamp-s-1vcpu-1gb-nyc1-01.ssh > 198.96.85.163.26087: Flags [P.], seq 18572:18736, ack 1, win 313, length 164
20:41:02.865147 IP 198.96.85.163.26087 > lamp-s-1vcpu-1gb-nyc1-01.ssh: Flags [.], ack 11504, win 2049, length 0
20:41:02.865306 IP lamp-s-1vcpu-1gb-nyc1-01.ssh > 198.96.85.163.26087: Flags [P.], seq 18736:19012, ack 1, win 313, length 276
20:41:02.865418 IP lamp-s-1vcpu-1gb-nyc1-01.ssh > 198.96.85.163.26087: Flags [P.], seq 19012:19176, ack 1, win 313, length 164
20:41:02.865512 IP lamp-s-1vcpu-1gb-nyc1-01.ssh > 198.96.85.163.26087: Flags [P.], seq 19176:19340, ack 1, win 313, length 164
20:41:02.865605 IP lamp-s-1vcpu-1gb-nyc1-01.ssh > 198.96.85.163.26087: Flags [P.], seq 19340:19504, ack 1, win 313, length 164
20:41:02.865689 IP 198.96.85.163.26087 > lamp-s-1vcpu-1gb-nyc1-01.ssh: Flags [.], ack 12600, win 2051, length 0
20:41:02.865778 IP lamp-s-1vcpu-1gb-nyc1-01.ssh > 198.96.85.163.26087: Flags [P.], seq 19504:19780, ack 1, win 313, length 276
20:41:02.865938 IP lamp-s-1vcpu-1gb-nyc1-01.ssh > 198.96.85.163.26087: Flags [P.], seq 19780:19944, ack 1, win 313, length 164
20:41:02.866086 IP lamp-s-1vcpu-1gb-nyc1-01.ssh > 198.96.85.163.26087: Flags [P.], seq 19944:20108, ack 1, win 313, length 164
20:41:02.866189 IP lamp-s-1vcpu-1gb-nyc1-01.ssh > 198.96.85.163.26087: Flags [P.], seq 20108:20272, ack 1, win 313, length 164
20:41:02.866320 IP lamp-s-1vcpu-1gb-nyc1-01.ssh > 198.96.85.163.26087: Flags [P.], seq 20272:20436, ack 1, win 313, length 164
20:41:02.866418 IP lamp-s-1vcpu-1gb-nyc1-01.ssh > 198.96.85.163.26087: Flags [P.], seq 20436:20600, ack 1, win 313, length 164
20:41:02.866591 IP lamp-s-1vcpu-1gb-nyc1-01.ssh > 198.96.85.163.26087: Flags [P.], seq 20600:20764, ack 1, win 313, length 164
20:41:02.866693 IP lamp-s-1vcpu-1gb-nyc1-01.ssh > 198.96.85.163.26087: Flags [P.], seq 20764:20928, ack 1, win 313, length 164
20:41:02.866793 IP lamp-s-1vcpu-1gb-nyc1-01.ssh > 198.96.85.163.26087: Flags [P.], seq 20928:21092, ack 1, win 313, length 164
20:41:02.866886 IP lamp-s-1vcpu-1gb-nyc1-01.ssh > 198.96.85.163.26087: Flags [P.], seq 21092:21256, ack 1, win 313, length 164
20:41:02.866978 IP lamp-s-1vcpu-1gb-nyc1-01.ssh > 198.96.85.163.26087: Flags [P.], seq 21256:21420, ack 1, win 313, length 164
20:41:02.867068 IP lamp-s-1vcpu-1gb-nyc1-01.ssh > 198.96.85.163.26087: Flags [P.], seq 21420:21584, ack 1, win 313, length 164
20:41:02.867159 IP lamp-s-1vcpu-1gb-nyc1-01.ssh > 198.96.85.163.26087: Flags [P.], seq 21584:21748, ack 1, win 313, length 164
20:41:02.867309 IP lamp-s-1vcpu-1gb-nyc1-01.ssh > 198.96.85.163.26087: Flags [P.], seq 21748:21912, ack 1, win 313, length 164
20:41:02.867437 IP lamp-s-1vcpu-1gb-nyc1-01.ssh > 198.96.85.163.26087: Flags [P.], seq 21912:22076, ack 1, win 313, length 164
20:41:02.867573 IP lamp-s-1vcpu-1gb-nyc1-01.ssh > 198.96.85.163.26087: Flags [P.], seq 22076:22240, ack 1, win 313, length 164
20:41:02.867676 IP lamp-s-1vcpu-1gb-nyc1-01.ssh > 198.96.85.163.26087: Flags [P.], seq 22240:22404, ack 1, win 313, length 164
20:41:02.867772 IP lamp-s-1vcpu-1gb-nyc1-01.ssh > 198.96.85.163.26087: Flags [P.], seq 22404:22568, ack 1, win 313, length 164
20:41:02.867864 IP lamp-s-1vcpu-1gb-nyc1-01.ssh > 198.96.85.163.26087: Flags [P.], seq 22568:22732, ack 1, win 313, length 164
20:41:02.867961 IP lamp-s-1vcpu-1gb-nyc1-01.ssh > 198.96.85.163.26087: Flags [P.], seq 22732:22896, ack 1, win 313, length 164
20:41:02.868053 IP lamp-s-1vcpu-1gb-nyc1-01.ssh > 198.96.85.163.26087: Flags [P.], seq 22896:23060, ack 1, win 313, length 164
20:41:02.868145 IP lamp-s-1vcpu-1gb-nyc1-01.ssh > 198.96.85.163.26087: Flags [P.], seq 23060:23224, ack 1, win 313, length 164
20:41:02.868236 IP lamp-s-1vcpu-1gb-nyc1-01.ssh > 198.96.85.163.26087: Flags [P.], seq 23224:23388, ack 1, win 313, length 164
20:41:02.868331 IP lamp-s-1vcpu-1gb-nyc1-01.ssh > 198.96.85.163.26087: Flags [P.], seq 23388:23552, ack 1, win 313, length 164
20:41:02.868427 IP lamp-s-1vcpu-1gb-nyc1-01.ssh > 198.96.85.163.26087: Flags [P.], seq 23552:23716, ack 1, win 313, length 164
20:41:02.868550 IP lamp-s-1vcpu-1gb-nyc1-01.ssh > 198.96.85.163.26087: Flags [P.], seq 23716:23880, ack 1, win 313, length 164
20:41:02.868648 IP lamp-s-1vcpu-1gb-nyc1-01.ssh > 198.96.85.163.26087: Flags [P.], seq 23880:24044, ack 1, win 313, length 164
20:41:02.868741 IP lamp-s-1vcpu-1gb-nyc1-01.ssh > 198.96.85.163.26087: Flags [P.], seq 24044:24208, ack 1, win 313, length 164
20:41:02.868833 IP lamp-s-1vcpu-1gb-nyc1-01.ssh > 198.96.85.163.26087: Flags [P.], seq 24208:24372, ack 1, win 313, length 164
20:41:02.868923 IP lamp-s-1vcpu-1gb-nyc1-01.ssh > 198.96.85.163.26087: Flags [P.], seq 24372:24536, ack 1, win 313, length 164
20:41:02.869014 IP lamp-s-1vcpu-1gb-nyc1-01.ssh > 198.96.85.163.26087: Flags [P.], seq 24536:24700, ack 1, win 313, length 164
20:41:02.869109 IP lamp-s-1vcpu-1gb-nyc1-01.ssh > 198.96.85.163.26087: Flags [P.], seq 24700:24864, ack 1, win 313, length 164
20:41:02.869221 IP lamp-s-1vcpu-1gb-nyc1-01.ssh > 198.96.85.163.26087: Flags [P.], seq 24864:25028, ack 1, win 313, length 164
20:41:02.869319 IP lamp-s-1vcpu-1gb-nyc1-01.ssh > 198.96.85.163.26087: Flags [P.], seq 25028:25192, ack 1, win 313, length 164
20:41:02.869416 IP lamp-s-1vcpu-1gb-nyc1-01.ssh > 198.96.85.163.26087: Flags [P.], seq 25192:25356, ack 1, win 313, length 164
20:41:02.869540 IP lamp-s-1vcpu-1gb-nyc1-01.ssh > 198.96.85.163.26087: Flags [P.], seq 25356:25520, ack 1, win 313, length 164
20:41:02.869642 IP lamp-s-1vcpu-1gb-nyc1-01.ssh > 198.96.85.163.26087: Flags [P.], seq 25520:25684, ack 1, win 313, length 164
20:41:02.869717 IP lamp-s-1vcpu-1gb-nyc1-01.ssh > 198.96.85.163.26087: Flags [P.], seq 25684:25848, ack 1, win 313, length 164
20:41:02.869789 IP lamp-s-1vcpu-1gb-nyc1-01.ssh > 198.96.85.163.26087: Flags [P.], seq 25848:26012, ack 1, win 313, length 164
20:41:02.869864 IP lamp-s-1vcpu-1gb-nyc1-01.ssh > 198.96.85.163.26087: Flags [P.], seq 26012:26176, ack 1, win 313, length 164
20:41:02.869938 IP lamp-s-1vcpu-1gb-nyc1-01.ssh > 198.96.85.163.26087: Flags [P.], seq 26176:26340, ack 1, win 313, length 164
20:41:02.870011 IP lamp-s-1vcpu-1gb-nyc1-01.ssh > 198.96.85.163.26087: Flags [P.], seq 26340:26504, ack 1, win 313, length 164
20:41:02.881173 IP 198.96.85.163.26087 > lamp-s-1vcpu-1gb-nyc1-01.ssh: Flags [.], ack 14024, win 2051, length 0
20:41:02.881291 IP lamp-s-1vcpu-1gb-nyc1-01.ssh > 198.96.85.163.26087: Flags [P.], seq 26504:26668, ack 1, win 313, length 164
20:41:02.881592 IP lamp-s-1vcpu-1gb-nyc1-01.ssh > 198.96.85.163.26087: Flags [P.], seq 26668:26944, ack 1, win 313, length 276
20:41:02.881727 IP lamp-s-1vcpu-1gb-nyc1-01.ssh > 198.96.85.163.26087: Flags [P.], seq 26944:27108, ack 1, win 313, length 164
20:41:02.881875 IP lamp-s-1vcpu-1gb-nyc1-01.ssh > 198.96.85.163.26087: Flags [P.], seq 27108:27272, ack 1, win 313, length 164
20:41:02.881992 IP lamp-s-1vcpu-1gb-nyc1-01.ssh > 198.96.85.163.26087: Flags [P.], seq 27272:27436, ack 1, win 313, length 164
20:41:02.882135 IP lamp-s-1vcpu-1gb-nyc1-01.ssh > 198.96.85.163.26087: Flags [P.], seq 27436:27600, ack 1, win 313, length 164
20:41:02.882321 IP lamp-s-1vcpu-1gb-nyc1-01.ssh > 198.96.85.163.26087: Flags [P.], seq 27600:27764, ack 1, win 313, length 164
20:41:02.882445 IP lamp-s-1vcpu-1gb-nyc1-01.ssh > 198.96.85.163.26087: Flags [P.], seq 27764:27928, ack 1, win 313, length 164
20:41:02.882592 IP lamp-s-1vcpu-1gb-nyc1-01.ssh > 198.96.85.163.26087: Flags [P.], seq 27928:28092, ack 1, win 313, length 164
20:41:02.882738 IP lamp-s-1vcpu-1gb-nyc1-01.ssh > 198.96.85.163.26087: Flags [P.], seq 28092:28256, ack 1, win 313, length 164
20:41:02.882886 IP lamp-s-1vcpu-1gb-nyc1-01.ssh > 198.96.85.163.26087: Flags [P.], seq 28256:28420, ack 1, win 313, length 164
20:41:02.883008 IP lamp-s-1vcpu-1gb-nyc1-01.ssh > 198.96.85.163.26087: Flags [P.], seq 28420:28584, ack 1, win 313, length 164
20:41:02.883127 IP lamp-s-1vcpu-1gb-nyc1-01.ssh > 198.96.85.163.26087: Flags [P.], seq 28584:28748, ack 1, win 313, length 164
20:41:02.883282 IP lamp-s-1vcpu-1gb-nyc1-01.ssh > 198.96.85.163.26087: Flags [P.], seq 28748:28912, ack 1, win 313, length 164
20:41:02.883443 IP lamp-s-1vcpu-1gb-nyc1-01.ssh > 198.96.85.163.26087: Flags [P.], seq 28912:29076, ack 1, win 313, length 164
20:41:02.883577 IP 198.96.85.163.26087 > lamp-s-1vcpu-1gb-nyc1-01.ssh: Flags [.], ack 16984, win 2051, length 0
20:41:02.883703 IP lamp-s-1vcpu-1gb-nyc1-01.ssh > 198.96.85.163.26087: Flags [P.], seq 29076:29240, ack 1, win 313, length 164
20:41:02.883846 IP lamp-s-1vcpu-1gb-nyc1-01.ssh > 198.96.85.163.26087: Flags [P.], seq 29240:29388, ack 1, win 313, length 148
20:41:02.883976 IP lamp-s-1vcpu-1gb-nyc1-01.ssh > 198.96.85.163.26087: Flags [P.], seq 29388:29552, ack 1, win 313, length 164
20:41:02.884028 IP lamp-s-1vcpu-1gb-nyc1-01.ssh > 198.96.85.163.26087: Flags [P.], seq 29552:29716, ack 1, win 313, length 164
20:41:02.884177 IP lamp-s-1vcpu-1gb-nyc1-01.ssh > 198.96.85.163.26087: Flags [P.], seq 29716:30008, ack 1, win 313, length 292
20:41:02.884302 IP lamp-s-1vcpu-1gb-nyc1-01.ssh > 198.96.85.163.26087: Flags [P.], seq 30008:30172, ack 1, win 313, length 164
20:41:02.884444 IP lamp-s-1vcpu-1gb-nyc1-01.ssh > 198.96.85.163.26087: Flags [P.], seq 30172:30336, ack 1, win 313, length 164
20:41:02.884590 IP lamp-s-1vcpu-1gb-nyc1-01.ssh > 198.96.85.163.26087: Flags [P.], seq 30336:30500, ack 1, win 313, length 164
20:41:02.884741 IP lamp-s-1vcpu-1gb-nyc1-01.ssh > 198.96.85.163.26087: Flags [P.], seq 30500:30664, ack 1, win 313, length 164
20:41:02.884863 IP lamp-s-1vcpu-1gb-nyc1-01.ssh > 198.96.85.163.26087: Flags [P.], seq 30664:30828, ack 1, win 313, length 164
20:41:02.884985 IP lamp-s-1vcpu-1gb-nyc1-01.ssh > 198.96.85.163.26087: Flags [P.], seq 30828:30992, ack 1, win 313, length 164
20:41:02.885097 IP lamp-s-1vcpu-1gb-nyc1-01.ssh > 198.96.85.163.26087: Flags [P.], seq 30992:31156, ack 1, win 313, length 164
20:41:02.885265 IP lamp-s-1vcpu-1gb-nyc1-01.ssh > 198.96.85.163.26087: Flags [P.], seq 31156:31320, ack 1, win 313, length 164
20:41:02.885419 IP lamp-s-1vcpu-1gb-nyc1-01.ssh > 198.96.85.163.26087: Flags [P.], seq 31320:31484, ack 1, win 313, length 164
20:41:02.885554 IP lamp-s-1vcpu-1gb-nyc1-01.ssh > 198.96.85.163.26087: Flags [P.], seq 31484:31648, ack 1, win 313, length 164
20:41:02.885595 IP 198.96.85.163.26087 > lamp-s-1vcpu-1gb-nyc1-01.ssh: Flags [.], ack 19944, win 2051, length 0
20:41:02.885749 IP lamp-s-1vcpu-1gb-nyc1-01.ssh > 198.96.85.163.26087: Flags [P.], seq 31648:31924, ack 1, win 313, length 276
20:41:02.885880 IP lamp-s-1vcpu-1gb-nyc1-01.ssh > 198.96.85.163.26087: Flags [P.], seq 31924:32088, ack 1, win 313, length 164
20:41:02.885993 IP lamp-s-1vcpu-1gb-nyc1-01.ssh > 198.96.85.163.26087: Flags [P.], seq 32088:32252, ack 1, win 313, length 164
20:41:02.886140 IP lamp-s-1vcpu-1gb-nyc1-01.ssh > 198.96.85.163.26087: Flags [P.], seq 32252:32416, ack 1, win 313, length 164
20:41:02.886316 IP lamp-s-1vcpu-1gb-nyc1-01.ssh > 198.96.85.163.26087: Flags [P.], seq 32416:32580, ack 1, win 313, length 164
20:41:02.886432 IP lamp-s-1vcpu-1gb-nyc1-01.ssh > 198.96.85.163.26087: Flags [P.], seq 32580:32744, ack 1, win 313, length 164
20:41:02.886551 IP lamp-s-1vcpu-1gb-nyc1-01.ssh > 198.96.85.163.26087: Flags [P.], seq 32744:32908, ack 1, win 313, length 164
20:41:02.886700 IP lamp-s-1vcpu-1gb-nyc1-01.ssh > 198.96.85.163.26087: Flags [P.], seq 32908:33072, ack 1, win 313, length 164
20:41:02.886848 IP lamp-s-1vcpu-1gb-nyc1-01.ssh > 198.96.85.163.26087: Flags [P.], seq 33072:33236, ack 1, win 313, length 164
20:41:02.886972 IP lamp-s-1vcpu-1gb-nyc1-01.ssh > 198.96.85.163.26087: Flags [P.], seq 33236:33400, ack 1, win 313, length 164
20:41:02.887090 IP lamp-s-1vcpu-1gb-nyc1-01.ssh > 198.96.85.163.26087: Flags [P.], seq 33400:33564, ack 1, win 313, length 164
20:41:02.887206 IP lamp-s-1vcpu-1gb-nyc1-01.ssh > 198.96.85.163.26087: Flags [P.], seq 33564:33728, ack 1, win 313, length 164
20:41:02.887316 IP lamp-s-1vcpu-1gb-nyc1-01.ssh > 198.96.85.163.26087: Flags [P.], seq 33728:33892, ack 1, win 313, length 164
20:41:02.887455 IP lamp-s-1vcpu-1gb-nyc1-01.ssh > 198.96.85.163.26087: Flags [P.], seq 33892:34056, ack 1, win 313, length 164
20:41:02.887600 IP lamp-s-1vcpu-1gb-nyc1-01.ssh > 198.96.85.163.26087: Flags [P.], seq 34056:34220, ack 1, win 313, length 164
20:41:02.887729 IP lamp-s-1vcpu-1gb-nyc1-01.ssh > 198.96.85.163.26087: Flags [P.], seq 34220:34384, ack 1, win 313, length 164
20:41:02.887852 IP lamp-s-1vcpu-1gb-nyc1-01.ssh > 198.96.85.163.26087: Flags [P.], seq 34384:34548, ack 1, win 313, length 164
20:41:02.887965 IP lamp-s-1vcpu-1gb-nyc1-01.ssh > 198.96.85.163.26087: Flags [P.], seq 34548:34712, ack 1, win 313, length 164
20:41:02.888109 IP lamp-s-1vcpu-1gb-nyc1-01.ssh > 198.96.85.163.26087: Flags [P.], seq 34712:34876, ack 1, win 313, length 164
20:41:02.888251 IP lamp-s-1vcpu-1gb-nyc1-01.ssh > 198.96.85.163.26087: Flags [P.], seq 34876:35040, ack 1, win 313, length 164
20:41:02.888370 IP lamp-s-1vcpu-1gb-nyc1-01.ssh > 198.96.85.163.26087: Flags [P.], seq 35040:35204, ack 1, win 313, length 164
20:41:02.888485 IP lamp-s-1vcpu-1gb-nyc1-01.ssh > 198.96.85.163.26087: Flags [P.], seq 35204:35368, ack 1, win 313, length 164
20:41:02.888619 IP lamp-s-1vcpu-1gb-nyc1-01.ssh > 198.96.85.163.26087: Flags [P.], seq 35368:35532, ack 1, win 313, length 164
20:41:02.888776 IP lamp-s-1vcpu-1gb-nyc1-01.ssh > 198.96.85.163.26087: Flags [P.], seq 35532:35696, ack 1, win 313, length 164
20:41:02.888916 IP lamp-s-1vcpu-1gb-nyc1-01.ssh > 198.96.85.163.26087: Flags [P.], seq 35696:35860, ack 1, win 313, length 164
20:41:02.889048 IP lamp-s-1vcpu-1gb-nyc1-01.ssh > 198.96.85.163.26087: Flags [P.], seq 35860:36024, ack 1, win 313, length 164
20:41:02.889182 IP lamp-s-1vcpu-1gb-nyc1-01.ssh > 198.96.85.163.26087: Flags [P.], seq 36024:36188, ack 1, win 313, length 164
20:41:02.889320 IP lamp-s-1vcpu-1gb-nyc1-01.ssh > 198.96.85.163.26087: Flags [P.], seq 36188:36352, ack 1, win 313, length 164
20:41:02.889467 IP lamp-s-1vcpu-1gb-nyc1-01.ssh > 198.96.85.163.26087: Flags [P.], seq 36352:36516, ack 1, win 313, length 164
20:41:02.889617 IP lamp-s-1vcpu-1gb-nyc1-01.ssh > 198.96.85.163.26087: Flags [P.], seq 36516:36680, ack 1, win 313, length 164
20:41:02.889756 IP lamp-s-1vcpu-1gb-nyc1-01.ssh > 198.96.85.163.26087: Flags [P.], seq 36680:36844, ack 1, win 313, length 164
20:41:02.889875 IP lamp-s-1vcpu-1gb-nyc1-01.ssh > 198.96.85.163.26087: Flags [P.], seq 36844:37008, ack 1, win 313, length 164
20:41:02.890006 IP 198.96.85.163.26087 > lamp-s-1vcpu-1gb-nyc1-01.ssh: Flags [.], ack 25192, win 2051, length 0
20:41:02.890030 IP lamp-s-1vcpu-1gb-nyc1-01.ssh > 198.96.85.163.26087: Flags [P.], seq 37008:37172, ack 1, win 313, length 164
20:41:02.890245 IP 198.96.85.163.26087 > lamp-s-1vcpu-1gb-nyc1-01.ssh: Flags [.], ack 26504, win 2051, length 0
20:41:02.890391 IP lamp-s-1vcpu-1gb-nyc1-01.ssh > 198.96.85.163.26087: Flags [P.], seq 37172:37560, ack 1, win 313, length 388
20:41:02.890527 IP lamp-s-1vcpu-1gb-nyc1-01.ssh > 198.96.85.163.26087: Flags [P.], seq 37560:37724, ack 1, win 313, length 164
20:41:02.890647 IP lamp-s-1vcpu-1gb-nyc1-01.ssh > 198.96.85.163.26087: Flags [P.], seq 37724:37888, ack 1, win 313, length 164
20:41:02.890762 IP lamp-s-1vcpu-1gb-nyc1-01.ssh > 198.96.85.163.26087: Flags [P.], seq 37888:38052, ack 1, win 313, length 164
20:41:02.890889 IP lamp-s-1vcpu-1gb-nyc1-01.ssh > 198.96.85.163.26087: Flags [P.], seq 38052:38216, ack 1, win 313, length 164
20:41:02.891036 IP lamp-s-1vcpu-1gb-nyc1-01.ssh > 198.96.85.163.26087: Flags [P.], seq 38216:38380, ack 1, win 313, length 164
20:41:02.891173 IP lamp-s-1vcpu-1gb-nyc1-01.ssh > 198.96.85.163.26087: Flags [P.], seq 38380:38544, ack 1, win 313, length 164
20:41:02.891297 IP lamp-s-1vcpu-1gb-nyc1-01.ssh > 198.96.85.163.26087: Flags [P.], seq 38544:38708, ack 1, win 313, length 164
20:41:02.891437 IP lamp-s-1vcpu-1gb-nyc1-01.ssh > 198.96.85.163.26087: Flags [P.], seq 38708:38872, ack 1, win 313, length 164
20:41:02.891574 IP lamp-s-1vcpu-1gb-nyc1-01.ssh > 198.96.85.163.26087: Flags [P.], seq 38872:39036, ack 1, win 313, length 164
20:41:02.891731 IP lamp-s-1vcpu-1gb-nyc1-01.ssh > 198.96.85.163.26087: Flags [P.], seq 39036:39200, ack 1, win 313, length 164
20:41:02.891884 IP lamp-s-1vcpu-1gb-nyc1-01.ssh > 198.96.85.163.26087: Flags [P.], seq 39200:39364, ack 1, win 313, length 164
20:41:02.892020 IP lamp-s-1vcpu-1gb-nyc1-01.ssh > 198.96.85.163.26087: Flags [P.], seq 39364:39528, ack 1, win 313, length 164
20:41:02.892135 IP lamp-s-1vcpu-1gb-nyc1-01.ssh > 198.96.85.163.26087: Flags [P.], seq 39528:39692, ack 1, win 313, length 164
20:41:02.892255 IP lamp-s-1vcpu-1gb-nyc1-01.ssh > 198.96.85.163.26087: Flags [P.], seq 39692:39856, ack 1, win 313, length 164
20:41:02.892393 IP lamp-s-1vcpu-1gb-nyc1-01.ssh > 198.96.85.163.26087: Flags [P.], seq 39856:40020, ack 1, win 313, length 164
20:41:02.892539 IP lamp-s-1vcpu-1gb-nyc1-01.ssh > 198.96.85.163.26087: Flags [P.], seq 40020:40184, ack 1, win 313, length 164
20:41:02.892660 IP lamp-s-1vcpu-1gb-nyc1-01.ssh > 198.96.85.163.26087: Flags [P.], seq 40184:40348, ack 1, win 313, length 164
20:41:02.892779 IP lamp-s-1vcpu-1gb-nyc1-01.ssh > 198.96.85.163.26087: Flags [P.], seq 40348:40512, ack 1, win 313, length 164
20:41:02.892922 IP lamp-s-1vcpu-1gb-nyc1-01.ssh > 198.96.85.163.26087: Flags [P.], seq 40512:40676, ack 1, win 313, length 164
20:41:02.893047 IP lamp-s-1vcpu-1gb-nyc1-01.ssh > 198.96.85.163.26087: Flags [P.], seq 40676:40840, ack 1, win 313, length 164
20:41:02.893189 IP lamp-s-1vcpu-1gb-nyc1-01.ssh > 198.96.85.163.26087: Flags [P.], seq 40840:41004, ack 1, win 313, length 164
20:41:02.893348 IP lamp-s-1vcpu-1gb-nyc1-01.ssh > 198.96.85.163.26087: Flags [P.], seq 41004:41168, ack 1, win 313, length 164
20:41:02.893469 IP lamp-s-1vcpu-1gb-nyc1-01.ssh > 198.96.85.163.26087: Flags [P.], seq 41168:41332, ack 1, win 313, length 164
20:41:02.893590 IP lamp-s-1vcpu-1gb-nyc1-01.ssh > 198.96.85.163.26087: Flags [P.], seq 41332:41496, ack 1, win 313, length 164
20:41:02.893723 IP lamp-s-1vcpu-1gb-nyc1-01.ssh > 198.96.85.163.26087: Flags [P.], seq 41496:41660, ack 1, win 313, length 164
20:41:02.893884 IP lamp-s-1vcpu-1gb-nyc1-01.ssh > 198.96.85.163.26087: Flags [P.], seq 41660:41824, ack 1, win 313, length 164
20:41:02.894037 IP lamp-s-1vcpu-1gb-nyc1-01.ssh > 198.96.85.163.26087: Flags [P.], seq 41824:41988, ack 1, win 313, length 164
20:41:02.894169 IP lamp-s-1vcpu-1gb-nyc1-01.ssh > 198.96.85.163.26087: Flags [P.], seq 41988:42152, ack 1, win 313, length 164
20:41:02.894324 IP lamp-s-1vcpu-1gb-nyc1-01.ssh > 198.96.85.163.26087: Flags [P.], seq 42152:42316, ack 1, win 313, length 164
20:41:02.894458 IP lamp-s-1vcpu-1gb-nyc1-01.ssh > 198.96.85.163.26087: Flags [P.], seq 42316:42480, ack 1, win 313, length 164
20:41:02.894609 IP lamp-s-1vcpu-1gb-nyc1-01.ssh > 198.96.85.163.26087: Flags [P.], seq 42480:42644, ack 1, win 313, length 164
20:41:02.894730 IP lamp-s-1vcpu-1gb-nyc1-01.ssh > 198.96.85.163.26087: Flags [P.], seq 42644:42808, ack 1, win 313, length 164
20:41:02.894842 IP lamp-s-1vcpu-1gb-nyc1-01.ssh > 198.96.85.163.26087: Flags [P.], seq 42808:42972, ack 1, win 313, length 164
20:41:02.894986 IP lamp-s-1vcpu-1gb-nyc1-01.ssh > 198.96.85.163.26087: Flags [P.], seq 42972:43136, ack 1, win 313, length 164
20:41:02.895114 IP lamp-s-1vcpu-1gb-nyc1-01.ssh > 198.96.85.163.26087: Flags [P.], seq 43136:43300, ack 1, win 313, length 164
20:41:02.895250 IP lamp-s-1vcpu-1gb-nyc1-01.ssh > 198.96.85.163.26087: Flags [P.], seq 43300:43464, ack 1, win 313, length 164
20:41:02.895402 IP lamp-s-1vcpu-1gb-nyc1-01.ssh > 198.96.85.163.26087: Flags [P.], seq 43464:43628, ack 1, win 313, length 164
20:41:02.895521 IP lamp-s-1vcpu-1gb-nyc1-01.ssh > 198.96.85.163.26087: Flags [P.], seq 43628:43792, ack 1, win 313, length 164
20:41:02.895637 IP lamp-s-1vcpu-1gb-nyc1-01.ssh > 198.96.85.163.26087: Flags [P.], seq 43792:43956, ack 1, win 313, length 164
20:41:02.895769 IP lamp-s-1vcpu-1gb-nyc1-01.ssh > 198.96.85.163.26087: Flags [P.], seq 43956:44120, ack 1, win 313, length 164
20:41:02.895919 IP lamp-s-1vcpu-1gb-nyc1-01.ssh > 198.96.85.163.26087: Flags [P.], seq 44120:44284, ack 1, win 313, length 164
20:41:02.896073 IP lamp-s-1vcpu-1gb-nyc1-01.ssh > 198.96.85.163.26087: Flags [P.], seq 44284:44448, ack 1, win 313, length 164
20:41:02.896207 IP lamp-s-1vcpu-1gb-nyc1-01.ssh > 198.96.85.163.26087: Flags [P.], seq 44448:44612, ack 1, win 313, length 164
20:41:02.896323 IP lamp-s-1vcpu-1gb-nyc1-01.ssh > 198.96.85.163.26087: Flags [P.], seq 44612:44776, ack 1, win 313, length 164
20:41:02.896437 IP lamp-s-1vcpu-1gb-nyc1-01.ssh > 198.96.85.163.26087: Flags [P.], seq 44776:44940, ack 1, win 313, length 164
20:41:02.896596 IP lamp-s-1vcpu-1gb-nyc1-01.ssh > 198.96.85.163.26087: Flags [P.], seq 44940:45104, ack 1, win 313, length 164
20:41:02.896740 IP lamp-s-1vcpu-1gb-nyc1-01.ssh > 198.96.85.163.26087: Flags [P.], seq 45104:45268, ack 1, win 313, length 164
20:41:02.896885 IP lamp-s-1vcpu-1gb-nyc1-01.ssh > 198.96.85.163.26087: Flags [P.], seq 45268:45432, ack 1, win 313, length 164
20:41:02.897008 IP lamp-s-1vcpu-1gb-nyc1-01.ssh > 198.96.85.163.26087: Flags [P.], seq 45432:45596, ack 1, win 313, length 164
20:41:02.897157 IP lamp-s-1vcpu-1gb-nyc1-01.ssh > 198.96.85.163.26087: Flags [P.], seq 45596:45760, ack 1, win 313, length 164
20:41:02.897335 IP lamp-s-1vcpu-1gb-nyc1-01.ssh > 198.96.85.163.26087: Flags [P.], seq 45760:45924, ack 1, win 313, length 164
20:41:02.897487 IP lamp-s-1vcpu-1gb-nyc1-01.ssh > 198.96.85.163.26087: Flags [P.], seq 45924:46088, ack 1, win 313, length 164
20:41:02.897612 IP lamp-s-1vcpu-1gb-nyc1-01.ssh > 198.96.85.163.26087: Flags [P.], seq 46088:46252, ack 1, win 313, length 164
20:41:02.897728 IP lamp-s-1vcpu-1gb-nyc1-01.ssh > 198.96.85.163.26087: Flags [P.], seq 46252:46416, ack 1, win 313, length 164
20:41:02.897854 IP lamp-s-1vcpu-1gb-nyc1-01.ssh > 198.96.85.163.26087: Flags [P.], seq 46416:46580, ack 1, win 313, length 164
20:41:02.898001 IP lamp-s-1vcpu-1gb-nyc1-01.ssh > 198.96.85.163.26087: Flags [P.], seq 46580:46744, ack 1, win 313, length 164
20:41:02.901949 IP 198.96.85.163.26087 > lamp-s-1vcpu-1gb-nyc1-01.ssh: Flags [.], ack 27928, win 2051, length 0
20:41:02.902030 IP lamp-s-1vcpu-1gb-nyc1-01.ssh > 198.96.85.163.26087: Flags [P.], seq 46744:46908, ack 1, win 313, length 164
20:41:02.902343 IP lamp-s-1vcpu-1gb-nyc1-01.ssh > 198.96.85.163.26087: Flags [P.], seq 46908:47184, ack 1, win 313, length 276
20:41:02.902532 IP lamp-s-1vcpu-1gb-nyc1-01.ssh > 198.96.85.163.26087: Flags [P.], seq 47184:47348, ack 1, win 313, length 164
20:41:02.902667 IP lamp-s-1vcpu-1gb-nyc1-01.ssh > 198.96.85.163.26087: Flags [P.], seq 47348:47512, ack 1, win 313, length 164
20:41:02.902776 IP lamp-s-1vcpu-1gb-nyc1-01.ssh > 198.96.85.163.26087: Flags [P.], seq 47512:47676, ack 1, win 313, length 164
20:41:02.902877 IP lamp-s-1vcpu-1gb-nyc1-01.ssh > 198.96.85.163.26087: Flags [P.], seq 47676:47840, ack 1, win 313, length 164
20:41:02.902978 IP lamp-s-1vcpu-1gb-nyc1-01.ssh > 198.96.85.163.26087: Flags [P.], seq 47840:48004, ack 1, win 313, length 164
20:41:02.903073 IP lamp-s-1vcpu-1gb-nyc1-01.ssh > 198.96.85.163.26087: Flags [P.], seq 48004:48168, ack 1, win 313, length 164
20:41:02.903186 IP 198.96.85.163.26087 > lamp-s-1vcpu-1gb-nyc1-01.ssh: Flags [.], ack 28912, win 2047, length 0
20:41:02.903276 IP lamp-s-1vcpu-1gb-nyc1-01.ssh > 198.96.85.163.26087: Flags [P.], seq 48168:48332, ack 1, win 313, length 164
20:41:02.903460 IP lamp-s-1vcpu-1gb-nyc1-01.ssh > 198.96.85.163.26087: Flags [P.], seq 48332:48608, ack 1, win 313, length 276
20:41:02.903574 IP lamp-s-1vcpu-1gb-nyc1-01.ssh > 198.96.85.163.26087: Flags [P.], seq 48608:48772, ack 1, win 313, length 164
20:41:02.903708 IP lamp-s-1vcpu-1gb-nyc1-01.ssh > 198.96.85.163.26087: Flags [P.], seq 48772:48936, ack 1, win 313, length 164
20:41:02.903821 IP lamp-s-1vcpu-1gb-nyc1-01.ssh > 198.96.85.163.26087: Flags [P.], seq 48936:49100, ack 1, win 313, length 164
20:41:02.903916 IP lamp-s-1vcpu-1gb-nyc1-01.ssh > 198.96.85.163.26087: Flags [P.], seq 49100:49264, ack 1, win 313, length 164
20:41:02.904015 IP lamp-s-1vcpu-1gb-nyc1-01.ssh > 198.96.85.163.26087: Flags [P.], seq 49264:49428, ack 1, win 313, length 164
20:41:02.904173 IP lamp-s-1vcpu-1gb-nyc1-01.ssh > 198.96.85.163.26087: Flags [P.], seq 49428:49592, ack 1, win 313, length 164
20:41:02.904308 IP lamp-s-1vcpu-1gb-nyc1-01.ssh > 198.96.85.163.26087: Flags [P.], seq 49592:49756, ack 1, win 313, length 164
20:41:02.904409 IP lamp-s-1vcpu-1gb-nyc1-01.ssh > 198.96.85.163.26087: Flags [P.], seq 49756:49920, ack 1, win 313, length 164
20:41:02.904506 IP lamp-s-1vcpu-1gb-nyc1-01.ssh > 198.96.85.163.26087: Flags [P.], seq 49920:50084, ack 1, win 313, length 164
20:41:02.904607 IP lamp-s-1vcpu-1gb-nyc1-01.ssh > 198.96.85.163.26087: Flags [P.], seq 50084:50248, ack 1, win 313, length 164
20:41:02.904713 IP lamp-s-1vcpu-1gb-nyc1-01.ssh > 198.96.85.163.26087: Flags [P.], seq 50248:50412, ack 1, win 313, length 164
20:41:02.905369 IP 198.96.85.163.26087 > lamp-s-1vcpu-1gb-nyc1-01.ssh: Flags [.], ack 29388, win 2051, length 0
20:41:02.905412 IP lamp-s-1vcpu-1gb-nyc1-01.ssh > 198.96.85.163.26087: Flags [P.], seq 50412:50576, ack 1, win 313, length 164
20:41:02.905616 IP lamp-s-1vcpu-1gb-nyc1-01.ssh > 198.96.85.163.26087: Flags [P.], seq 50576:50852, ack 1, win 313, length 276
20:41:02.905774 IP lamp-s-1vcpu-1gb-nyc1-01.ssh > 198.96.85.163.26087: Flags [P.], seq 50852:51016, ack 1, win 313, length 164
20:41:02.905881 IP lamp-s-1vcpu-1gb-nyc1-01.ssh > 198.96.85.163.26087: Flags [P.], seq 51016:51180, ack 1, win 313, length 164
20:41:02.910318 IP 198.96.85.163.26087 > lamp-s-1vcpu-1gb-nyc1-01.ssh: Flags [.], ack 34876, win 2051, length 0
20:41:02.910374 IP lamp-s-1vcpu-1gb-nyc1-01.ssh > 198.96.85.163.26087: Flags [P.], seq 51180:51344, ack 1, win 313, length 164
20:41:02.910532 IP lamp-s-1vcpu-1gb-nyc1-01.ssh > 198.96.85.163.26087: Flags [P.], seq 51344:51620, ack 1, win 313, length 276
20:41:02.910650 IP lamp-s-1vcpu-1gb-nyc1-01.ssh > 198.96.85.163.26087: Flags [P.], seq 51620:51784, ack 1, win 313, length 164
20:41:02.910738 IP lamp-s-1vcpu-1gb-nyc1-01.ssh > 198.96.85.163.26087: Flags [P.], seq 51784:51948, ack 1, win 313, length 164
20:41:02.910822 IP lamp-s-1vcpu-1gb-nyc1-01.ssh > 198.96.85.163.26087: Flags [P.], seq 51948:52112, ack 1, win 313, length 164
20:41:02.910852 IP 198.96.85.163.26087 > lamp-s-1vcpu-1gb-nyc1-01.ssh: Flags [.], ack 37172, win 2051, length 0
