root@lamp-s-1vcpu-1gb-nyc1-01:~# tcpdump -i eth0 tcp
tcpdump: verbose output suppressed, use -v or -vv for full protocol decode
listening on eth0, link-type EN10MB (Ethernet), capture size 262144 bytes
20:39:16.891217 IP lamp-s-1vcpu-1gb-nyc1-01.ssh > 198.96.85.163.26087: Flags [P.], seq 3983993215:3983993323, ack 643419406, win 313, length 108
20:39:16.891337 IP lamp-s-1vcpu-1gb-nyc1-01.ssh > 198.96.85.163.26087: Flags [P.], seq 108:144, ack 1, win 313, length 36
20:39:16.891451 IP lamp-s-1vcpu-1gb-nyc1-01.ssh > 198.96.85.163.26087: Flags [P.], seq 144:252, ack 1, win 313, length 108
20:39:16.891546 IP lamp-s-1vcpu-1gb-nyc1-01.ssh > 198.96.85.163.26087: Flags [P.], seq 252:288, ack 1, win 313, length 36
20:39:16.893109 IP lamp-s-1vcpu-1gb-nyc1-01.ssh > 198.96.85.163.26087: Flags [P.], seq 288:468, ack 1, win 313, length 180
20:39:16.893264 IP lamp-s-1vcpu-1gb-nyc1-01.ssh > 198.96.85.163.26087: Flags [P.], seq 468:504, ack 1, win 313, length 36
20:39:16.893422 IP lamp-s-1vcpu-1gb-nyc1-01.ssh > 198.96.85.163.26087: Flags [P.], seq 504:660, ack 1, win 313, length 156
20:39:16.893539 IP lamp-s-1vcpu-1gb-nyc1-01.ssh > 198.96.85.163.26087: Flags [P.], seq 660:696, ack 1, win 313, length 36
20:39:16.893667 IP lamp-s-1vcpu-1gb-nyc1-01.ssh > 198.96.85.163.26087: Flags [P.], seq 696:852, ack 1, win 313, length 156
20:39:16.911227 IP 198.96.85.163.26087 > lamp-s-1vcpu-1gb-nyc1-01.ssh: Flags [.], ack 288, win 2050, length 0
20:39:16.911322 IP lamp-s-1vcpu-1gb-nyc1-01.ssh > 198.96.85.163.26087: Flags [P.], seq 852:2040, ack 1, win 313, length 1188
20:39:16.911609 IP lamp-s-1vcpu-1gb-nyc1-01.ssh > 198.96.85.163.26087: Flags [P.], seq 2040:2188, ack 1, win 313, length 148
20:39:16.911695 IP lamp-s-1vcpu-1gb-nyc1-01.ssh > 198.96.85.163.26087: Flags [P.], seq 2188:2224, ack 1, win 313, length 36
20:39:16.911797 IP lamp-s-1vcpu-1gb-nyc1-01.ssh > 198.96.85.163.26087: Flags [P.], seq 2224:2388, ack 1, win 313, length 164
20:39:16.911876 IP lamp-s-1vcpu-1gb-nyc1-01.ssh > 198.96.85.163.26087: Flags [P.], seq 2388:2424, ack 1, win 313, length 36
20:39:16.912032 IP lamp-s-1vcpu-1gb-nyc1-01.ssh > 198.96.85.163.26087: Flags [P.], seq 2424:2588, ack 1, win 313, length 164
20:39:16.912160 IP lamp-s-1vcpu-1gb-nyc1-01.ssh > 198.96.85.163.26087: Flags [P.], seq 2588:2624, ack 1, win 313, length 36
20:39:16.912300 IP lamp-s-1vcpu-1gb-nyc1-01.ssh > 198.96.85.163.26087: Flags [P.], seq 2624:2788, ack 1, win 313, length 164
20:39:16.912384 IP lamp-s-1vcpu-1gb-nyc1-01.ssh > 198.96.85.163.26087: Flags [P.], seq 2788:2824, ack 1, win 313, length 36
20:39:16.912507 IP lamp-s-1vcpu-1gb-nyc1-01.ssh > 198.96.85.163.26087: Flags [P.], seq 2824:2988, ack 1, win 313, length 164
20:39:16.913032 IP 198.96.85.163.26087 > lamp-s-1vcpu-1gb-nyc1-01.ssh: Flags [.], ack 852, win 2048, length 0
20:39:16.913070 IP lamp-s-1vcpu-1gb-nyc1-01.ssh > 198.96.85.163.26087: Flags [P.], seq 2988:3824, ack 1, win 313, length 836
20:39:16.913132 IP lamp-s-1vcpu-1gb-nyc1-01.ssh > 198.96.85.163.26087: Flags [P.], seq 3824:3988, ack 1, win 313, length 164
20:39:16.913293 IP lamp-s-1vcpu-1gb-nyc1-01.ssh > 198.96.85.163.26087: Flags [P.], seq 3988:4024, ack 1, win 313, length 36
20:39:16.913453 IP lamp-s-1vcpu-1gb-nyc1-01.ssh > 198.96.85.163.26087: Flags [P.], seq 4024:4188, ack 1, win 313, length 164
20:39:16.913571 IP lamp-s-1vcpu-1gb-nyc1-01.ssh > 198.96.85.163.26087: Flags [P.], seq 4188:4224, ack 1, win 313, length 36
20:39:16.913701 IP lamp-s-1vcpu-1gb-nyc1-01.ssh > 198.96.85.163.26087: Flags [P.], seq 4224:4372, ack 1, win 313, length 148
20:39:16.913868 IP lamp-s-1vcpu-1gb-nyc1-01.ssh > 198.96.85.163.26087: Flags [P.], seq 4408:4572, ack 1, win 313, length 164
20:39:16.914016 IP lamp-s-1vcpu-1gb-nyc1-01.ssh > 198.96.85.163.26087: Flags [P.], seq 4608:4772, ack 1, win 313, length 164
20:39:16.932048 IP 198.96.85.163.26087 > lamp-s-1vcpu-1gb-nyc1-01.ssh: Flags [.], ack 2988, win 2051, length 0
20:39:16.932185 IP lamp-s-1vcpu-1gb-nyc1-01.ssh > 198.96.85.163.26087: Flags [P.], seq 4772:6008, ack 1, win 313, length 1236
20:39:16.932324 IP 198.96.85.163.26087 > lamp-s-1vcpu-1gb-nyc1-01.ssh: Flags [.], ack 4024, win 2047, length 0
20:39:16.932541 IP lamp-s-1vcpu-1gb-nyc1-01.ssh > 198.96.85.163.26087: Flags [P.], seq 6008:6156, ack 1, win 313, length 148
20:39:16.932672 IP lamp-s-1vcpu-1gb-nyc1-01.ssh > 198.96.85.163.26087: Flags [P.], seq 6156:6192, ack 1, win 313, length 36
20:39:16.932785 IP lamp-s-1vcpu-1gb-nyc1-01.ssh > 198.96.85.163.26087: Flags [P.], seq 6192:6356, ack 1, win 313, length 164
20:39:16.932860 IP lamp-s-1vcpu-1gb-nyc1-01.ssh > 198.96.85.163.26087: Flags [P.], seq 6356:6392, ack 1, win 313, length 36
20:39:16.932961 IP lamp-s-1vcpu-1gb-nyc1-01.ssh > 198.96.85.163.26087: Flags [P.], seq 6392:6540, ack 1, win 313, length 148
20:39:16.933032 IP lamp-s-1vcpu-1gb-nyc1-01.ssh > 198.96.85.163.26087: Flags [P.], seq 6540:6576, ack 1, win 313, length 36
20:39:16.933123 IP lamp-s-1vcpu-1gb-nyc1-01.ssh > 198.96.85.163.26087: Flags [P.], seq 6576:6740, ack 1, win 313, length 164
20:39:16.933322 IP 198.96.85.163.26087 > lamp-s-1vcpu-1gb-nyc1-01.ssh: Flags [.], ack 4772, win 2051, length 0
20:39:16.933538 IP lamp-s-1vcpu-1gb-nyc1-01.ssh > 198.96.85.163.26087: Flags [P.], seq 6976:7140, ack 1, win 313, length 164
20:39:16.933792 IP lamp-s-1vcpu-1gb-nyc1-01.ssh > 198.96.85.163.26087: Flags [P.], seq 7176:7460, ack 1, win 313, length 284
20:39:16.934004 IP lamp-s-1vcpu-1gb-nyc1-01.ssh > 198.96.85.163.26087: Flags [P.], seq 7460:8112, ack 1, win 313, length 652
20:39:16.934159 IP lamp-s-1vcpu-1gb-nyc1-01.ssh > 198.96.85.163.26087: Flags [P.], seq 8112:8276, ack 1, win 313, length 164
20:39:16.934307 IP lamp-s-1vcpu-1gb-nyc1-01.ssh > 198.96.85.163.26087: Flags [P.], seq 8276:8440, ack 1, win 313, length 164
20:39:16.934413 IP lamp-s-1vcpu-1gb-nyc1-01.ssh > 198.96.85.163.26087: Flags [P.], seq 8440:8604, ack 1, win 313, length 164
20:39:16.934522 IP lamp-s-1vcpu-1gb-nyc1-01.ssh > 198.96.85.163.26087: Flags [P.], seq 8604:8768, ack 1, win 313, length 164
20:39:16.934678 IP lamp-s-1vcpu-1gb-nyc1-01.ssh > 198.96.85.163.26087: Flags [P.], seq 8768:8932, ack 1, win 313, length 164
20:39:16.934829 IP lamp-s-1vcpu-1gb-nyc1-01.ssh > 198.96.85.163.26087: Flags [P.], seq 8932:9096, ack 1, win 313, length 164
20:39:16.934954 IP lamp-s-1vcpu-1gb-nyc1-01.ssh > 198.96.85.163.26087: Flags [P.], seq 9096:9260, ack 1, win 313, length 164
20:39:16.935077 IP lamp-s-1vcpu-1gb-nyc1-01.ssh > 198.96.85.163.26087: Flags [P.], seq 9260:9424, ack 1, win 313, length 164
20:39:16.935217 IP lamp-s-1vcpu-1gb-nyc1-01.ssh > 198.96.85.163.26087: Flags [P.], seq 9424:9588, ack 1, win 313, length 164
20:39:16.935334 IP lamp-s-1vcpu-1gb-nyc1-01.ssh > 198.96.85.163.26087: Flags [P.], seq 9588:9752, ack 1, win 313, length 164
20:39:16.935479 IP lamp-s-1vcpu-1gb-nyc1-01.ssh > 198.96.85.163.26087: Flags [P.], seq 9752:9916, ack 1, win 313, length 164
20:39:16.935673 IP lamp-s-1vcpu-1gb-nyc1-01.ssh > 198.96.85.163.26087: Flags [P.], seq 9916:10080, ack 1, win 313, length 164
20:39:16.935858 IP lamp-s-1vcpu-1gb-nyc1-01.ssh > 198.96.85.163.26087: Flags [P.], seq 10080:10244, ack 1, win 313, length 164
20:39:16.935980 IP lamp-s-1vcpu-1gb-nyc1-01.ssh > 198.96.85.163.26087: Flags [P.], seq 10244:10408, ack 1, win 313, length 164
20:39:16.936085 IP lamp-s-1vcpu-1gb-nyc1-01.ssh > 198.96.85.163.26087: Flags [P.], seq 10408:10572, ack 1, win 313, length 164
20:39:16.936195 IP lamp-s-1vcpu-1gb-nyc1-01.ssh > 198.96.85.163.26087: Flags [P.], seq 10572:10736, ack 1, win 313, length 164
20:39:16.936299 IP lamp-s-1vcpu-1gb-nyc1-01.ssh > 198.96.85.163.26087: Flags [P.], seq 10736:10900, ack 1, win 313, length 164
20:39:16.936443 IP lamp-s-1vcpu-1gb-nyc1-01.ssh > 198.96.85.163.26087: Flags [P.], seq 10900:11064, ack 1, win 313, length 164
20:39:16.936580 IP lamp-s-1vcpu-1gb-nyc1-01.ssh > 198.96.85.163.26087: Flags [P.], seq 11064:11228, ack 1, win 313, length 164
20:39:16.936735 IP lamp-s-1vcpu-1gb-nyc1-01.ssh > 198.96.85.163.26087: Flags [P.], seq 11228:11392, ack 1, win 313, length 164
20:39:16.936940 IP lamp-s-1vcpu-1gb-nyc1-01.ssh > 198.96.85.163.26087: Flags [P.], seq 11392:11556, ack 1, win 313, length 164
20:39:16.937120 IP lamp-s-1vcpu-1gb-nyc1-01.ssh > 198.96.85.163.26087: Flags [P.], seq 11556:11720, ack 1, win 313, length 164
20:39:16.937312 IP lamp-s-1vcpu-1gb-nyc1-01.ssh > 198.96.85.163.26087: Flags [P.], seq 11720:11884, ack 1, win 313, length 164
20:39:16.937506 IP lamp-s-1vcpu-1gb-nyc1-01.ssh > 198.96.85.163.26087: Flags [P.], seq 11884:12048, ack 1, win 313, length 164
20:39:16.937638 IP lamp-s-1vcpu-1gb-nyc1-01.ssh > 198.96.85.163.26087: Flags [P.], seq 12048:12212, ack 1, win 313, length 164
20:39:16.952464 IP 198.96.85.163.26087 > lamp-s-1vcpu-1gb-nyc1-01.ssh: Flags [.], ack 6776, win 2051, length 0
20:39:16.952542 IP lamp-s-1vcpu-1gb-nyc1-01.ssh > 198.96.85.163.26087: Flags [P.], seq 12212:12376, ack 1, win 313, length 164
20:39:16.952801 IP lamp-s-1vcpu-1gb-nyc1-01.ssh > 198.96.85.163.26087: Flags [P.], seq 12376:12652, ack 1, win 313, length 276
20:39:16.952928 IP lamp-s-1vcpu-1gb-nyc1-01.ssh > 198.96.85.163.26087: Flags [P.], seq 12652:12816, ack 1, win 313, length 164
20:39:16.953119 IP lamp-s-1vcpu-1gb-nyc1-01.ssh > 198.96.85.163.26087: Flags [P.], seq 12816:12980, ack 1, win 313, length 164
20:39:16.953304 IP lamp-s-1vcpu-1gb-nyc1-01.ssh > 198.96.85.163.26087: Flags [P.], seq 12980:13144, ack 1, win 313, length 164
20:39:16.953460 IP lamp-s-1vcpu-1gb-nyc1-01.ssh > 198.96.85.163.26087: Flags [P.], seq 13144:13308, ack 1, win 313, length 164
20:39:16.953614 IP lamp-s-1vcpu-1gb-nyc1-01.ssh > 198.96.85.163.26087: Flags [P.], seq 13308:13472, ack 1, win 313, length 164
20:39:16.953786 IP lamp-s-1vcpu-1gb-nyc1-01.ssh > 198.96.85.163.26087: Flags [P.], seq 13472:13636, ack 1, win 313, length 164
20:39:16.953954 IP lamp-s-1vcpu-1gb-nyc1-01.ssh > 198.96.85.163.26087: Flags [P.], seq 13636:13800, ack 1, win 313, length 164
20:39:16.954118 IP lamp-s-1vcpu-1gb-nyc1-01.ssh > 198.96.85.163.26087: Flags [P.], seq 13800:13964, ack 1, win 313, length 164
20:39:16.954316 IP lamp-s-1vcpu-1gb-nyc1-01.ssh > 198.96.85.163.26087: Flags [P.], seq 13964:14128, ack 1, win 313, length 164
20:39:16.954476 IP lamp-s-1vcpu-1gb-nyc1-01.ssh > 198.96.85.163.26087: Flags [P.], seq 14128:14292, ack 1, win 313, length 164
20:39:16.954621 IP lamp-s-1vcpu-1gb-nyc1-01.ssh > 198.96.85.163.26087: Flags [P.], seq 14292:14456, ack 1, win 313, length 164
20:39:16.954762 IP lamp-s-1vcpu-1gb-nyc1-01.ssh > 198.96.85.163.26087: Flags [P.], seq 14456:14620, ack 1, win 313, length 164
20:39:16.954916 IP lamp-s-1vcpu-1gb-nyc1-01.ssh > 198.96.85.163.26087: Flags [P.], seq 14620:14784, ack 1, win 313, length 164
20:39:16.955063 IP lamp-s-1vcpu-1gb-nyc1-01.ssh > 198.96.85.163.26087: Flags [P.], seq 14784:14948, ack 1, win 313, length 164
20:39:16.955207 IP lamp-s-1vcpu-1gb-nyc1-01.ssh > 198.96.85.163.26087: Flags [P.], seq 14948:15112, ack 1, win 313, length 164
20:39:16.955361 IP lamp-s-1vcpu-1gb-nyc1-01.ssh > 198.96.85.163.26087: Flags [P.], seq 15112:15276, ack 1, win 313, length 164
20:39:16.956788 IP 198.96.85.163.26087 > lamp-s-1vcpu-1gb-nyc1-01.ssh: Flags [.], ack 11556, win 2051, length 0
20:39:16.956869 IP lamp-s-1vcpu-1gb-nyc1-01.ssh > 198.96.85.163.26087: Flags [P.], seq 15276:15440, ack 1, win 313, length 164
20:39:16.957146 IP lamp-s-1vcpu-1gb-nyc1-01.ssh > 198.96.85.163.26087: Flags [P.], seq 15440:15716, ack 1, win 313, length 276
20:39:16.957237 IP 198.96.85.163.26087 > lamp-s-1vcpu-1gb-nyc1-01.ssh: Flags [.], ack 12212, win 2049, length 0
20:39:16.957404 IP lamp-s-1vcpu-1gb-nyc1-01.ssh > 198.96.85.163.26087: Flags [P.], seq 15716:15992, ack 1, win 313, length 276
20:39:16.957582 IP lamp-s-1vcpu-1gb-nyc1-01.ssh > 198.96.85.163.26087: Flags [P.], seq 15992:16156, ack 1, win 313, length 164
20:39:16.957737 IP lamp-s-1vcpu-1gb-nyc1-01.ssh > 198.96.85.163.26087: Flags [P.], seq 16156:16320, ack 1, win 313, length 164
20:39:16.957882 IP lamp-s-1vcpu-1gb-nyc1-01.ssh > 198.96.85.163.26087: Flags [P.], seq 16320:16484, ack 1, win 313, length 164
20:39:16.957990 IP lamp-s-1vcpu-1gb-nyc1-01.ssh > 198.96.85.163.26087: Flags [P.], seq 16484:16648, ack 1, win 313, length 164
20:39:16.958101 IP lamp-s-1vcpu-1gb-nyc1-01.ssh > 198.96.85.163.26087: Flags [P.], seq 16648:16812, ack 1, win 313, length 164
20:39:16.958258 IP lamp-s-1vcpu-1gb-nyc1-01.ssh > 198.96.85.163.26087: Flags [P.], seq 16812:16976, ack 1, win 313, length 164
20:39:16.958364 IP lamp-s-1vcpu-1gb-nyc1-01.ssh > 198.96.85.163.26087: Flags [P.], seq 16976:17140, ack 1, win 313, length 164
20:39:16.958494 IP lamp-s-1vcpu-1gb-nyc1-01.ssh > 198.96.85.163.26087: Flags [P.], seq 17140:17304, ack 1, win 313, length 164
20:39:16.958624 IP lamp-s-1vcpu-1gb-nyc1-01.ssh > 198.96.85.163.26087: Flags [P.], seq 17304:17468, ack 1, win 313, length 164
20:39:16.958726 IP lamp-s-1vcpu-1gb-nyc1-01.ssh > 198.96.85.163.26087: Flags [P.], seq 17468:17632, ack 1, win 313, length 164
20:39:16.958824 IP lamp-s-1vcpu-1gb-nyc1-01.ssh > 198.96.85.163.26087: Flags [P.], seq 17632:17796, ack 1, win 313, length 164
20:39:16.958920 IP lamp-s-1vcpu-1gb-nyc1-01.ssh > 198.96.85.163.26087: Flags [P.], seq 17796:17960, ack 1, win 313, length 164
20:39:16.959016 IP lamp-s-1vcpu-1gb-nyc1-01.ssh > 198.96.85.163.26087: Flags [P.], seq 17960:18124, ack 1, win 313, length 164
20:39:16.959111 IP lamp-s-1vcpu-1gb-nyc1-01.ssh > 198.96.85.163.26087: Flags [P.], seq 18124:18288, ack 1, win 313, length 164
20:39:16.959232 IP lamp-s-1vcpu-1gb-nyc1-01.ssh > 198.96.85.163.26087: Flags [P.], seq 18288:18452, ack 1, win 313, length 164
20:39:16.959366 IP lamp-s-1vcpu-1gb-nyc1-01.ssh > 198.96.85.163.26087: Flags [P.], seq 18452:18616, ack 1, win 313, length 164
20:39:16.959519 IP lamp-s-1vcpu-1gb-nyc1-01.ssh > 198.96.85.163.26087: Flags [P.], seq 18616:18780, ack 1, win 313, length 164
20:39:16.959638 IP lamp-s-1vcpu-1gb-nyc1-01.ssh > 198.96.85.163.26087: Flags [P.], seq 18780:18944, ack 1, win 313, length 164
20:39:16.959737 IP lamp-s-1vcpu-1gb-nyc1-01.ssh > 198.96.85.163.26087: Flags [P.], seq 18944:19108, ack 1, win 313, length 164
20:39:16.959841 IP lamp-s-1vcpu-1gb-nyc1-01.ssh > 198.96.85.163.26087: Flags [P.], seq 19108:19272, ack 1, win 313, length 164
20:39:16.959939 IP lamp-s-1vcpu-1gb-nyc1-01.ssh > 198.96.85.163.26087: Flags [P.], seq 19272:19436, ack 1, win 313, length 164
20:39:16.960036 IP lamp-s-1vcpu-1gb-nyc1-01.ssh > 198.96.85.163.26087: Flags [P.], seq 19436:19600, ack 1, win 313, length 164
20:39:16.960131 IP lamp-s-1vcpu-1gb-nyc1-01.ssh > 198.96.85.163.26087: Flags [P.], seq 19600:19764, ack 1, win 313, length 164
20:39:16.960225 IP lamp-s-1vcpu-1gb-nyc1-01.ssh > 198.96.85.163.26087: Flags [P.], seq 19764:19928, ack 1, win 313, length 164
20:39:16.960326 IP lamp-s-1vcpu-1gb-nyc1-01.ssh > 198.96.85.163.26087: Flags [P.], seq 19928:20092, ack 1, win 313, length 164
20:39:16.960421 IP lamp-s-1vcpu-1gb-nyc1-01.ssh > 198.96.85.163.26087: Flags [P.], seq 20092:20256, ack 1, win 313, length 164
20:39:16.960553 IP lamp-s-1vcpu-1gb-nyc1-01.ssh > 198.96.85.163.26087: Flags [P.], seq 20256:20420, ack 1, win 313, length 164
20:39:16.960658 IP lamp-s-1vcpu-1gb-nyc1-01.ssh > 198.96.85.163.26087: Flags [P.], seq 20420:20584, ack 1, win 313, length 164
20:39:16.960756 IP lamp-s-1vcpu-1gb-nyc1-01.ssh > 198.96.85.163.26087: Flags [P.], seq 20584:20748, ack 1, win 313, length 164
20:39:16.960892 IP lamp-s-1vcpu-1gb-nyc1-01.ssh > 198.96.85.163.26087: Flags [P.], seq 20748:20912, ack 1, win 313, length 164
20:39:16.960999 IP lamp-s-1vcpu-1gb-nyc1-01.ssh > 198.96.85.163.26087: Flags [P.], seq 20912:21076, ack 1, win 313, length 164
20:39:16.961131 IP lamp-s-1vcpu-1gb-nyc1-01.ssh > 198.96.85.163.26087: Flags [P.], seq 21076:21240, ack 1, win 313, length 164
20:39:16.961279 IP lamp-s-1vcpu-1gb-nyc1-01.ssh > 198.96.85.163.26087: Flags [P.], seq 21240:21404, ack 1, win 313, length 164
20:39:16.961380 IP lamp-s-1vcpu-1gb-nyc1-01.ssh > 198.96.85.163.26087: Flags [P.], seq 21404:21568, ack 1, win 313, length 164
20:39:16.961524 IP lamp-s-1vcpu-1gb-nyc1-01.ssh > 198.96.85.163.26087: Flags [P.], seq 21568:21732, ack 1, win 313, length 164
20:39:16.961652 IP lamp-s-1vcpu-1gb-nyc1-01.ssh > 198.96.85.163.26087: Flags [P.], seq 21732:21896, ack 1, win 313, length 164
20:39:16.961728 IP lamp-s-1vcpu-1gb-nyc1-01.ssh > 198.96.85.163.26087: Flags [P.], seq 21896:22060, ack 1, win 313, length 164
20:39:16.961811 IP lamp-s-1vcpu-1gb-nyc1-01.ssh > 198.96.85.163.26087: Flags [P.], seq 22060:22224, ack 1, win 313, length 164
20:39:16.961912 IP lamp-s-1vcpu-1gb-nyc1-01.ssh > 198.96.85.163.26087: Flags [P.], seq 22224:22388, ack 1, win 313, length 164
20:39:16.961991 IP lamp-s-1vcpu-1gb-nyc1-01.ssh > 198.96.85.163.26087: Flags [P.], seq 22388:22552, ack 1, win 313, length 164
20:39:16.962089 IP lamp-s-1vcpu-1gb-nyc1-01.ssh > 198.96.85.163.26087: Flags [P.], seq 22552:22716, ack 1, win 313, length 164
20:39:16.962186 IP lamp-s-1vcpu-1gb-nyc1-01.ssh > 198.96.85.163.26087: Flags [P.], seq 22716:22880, ack 1, win 313, length 164
20:39:16.962290 IP lamp-s-1vcpu-1gb-nyc1-01.ssh > 198.96.85.163.26087: Flags [P.], seq 22880:23044, ack 1, win 313, length 164
20:39:16.962370 IP lamp-s-1vcpu-1gb-nyc1-01.ssh > 198.96.85.163.26087: Flags [P.], seq 23044:23208, ack 1, win 313, length 164
20:39:16.962462 IP lamp-s-1vcpu-1gb-nyc1-01.ssh > 198.96.85.163.26087: Flags [P.], seq 23208:23372, ack 1, win 313, length 164
20:39:16.962561 IP lamp-s-1vcpu-1gb-nyc1-01.ssh > 198.96.85.163.26087: Flags [P.], seq 23372:23536, ack 1, win 313, length 164
20:39:16.962638 IP lamp-s-1vcpu-1gb-nyc1-01.ssh > 198.96.85.163.26087: Flags [P.], seq 23536:23700, ack 1, win 313, length 164
20:39:16.962710 IP lamp-s-1vcpu-1gb-nyc1-01.ssh > 198.96.85.163.26087: Flags [P.], seq 23700:23864, ack 1, win 313, length 164
20:39:16.962786 IP lamp-s-1vcpu-1gb-nyc1-01.ssh > 198.96.85.163.26087: Flags [P.], seq 23864:24028, ack 1, win 313, length 164
20:39:16.962859 IP lamp-s-1vcpu-1gb-nyc1-01.ssh > 198.96.85.163.26087: Flags [P.], seq 24028:24192, ack 1, win 313, length 164
20:39:16.962948 IP lamp-s-1vcpu-1gb-nyc1-01.ssh > 198.96.85.163.26087: Flags [P.], seq 24192:24356, ack 1, win 313, length 164
20:39:16.963023 IP lamp-s-1vcpu-1gb-nyc1-01.ssh > 198.96.85.163.26087: Flags [P.], seq 24356:24520, ack 1, win 313, length 164
20:39:16.963095 IP lamp-s-1vcpu-1gb-nyc1-01.ssh > 198.96.85.163.26087: Flags [P.], seq 24520:24684, ack 1, win 313, length 164
20:39:16.963167 IP lamp-s-1vcpu-1gb-nyc1-01.ssh > 198.96.85.163.26087: Flags [P.], seq 24684:24848, ack 1, win 313, length 164
20:39:16.963237 IP lamp-s-1vcpu-1gb-nyc1-01.ssh > 198.96.85.163.26087: Flags [P.], seq 24848:25012, ack 1, win 313, length 164
20:39:16.963313 IP lamp-s-1vcpu-1gb-nyc1-01.ssh > 198.96.85.163.26087: Flags [P.], seq 25012:25176, ack 1, win 313, length 164
20:39:16.963385 IP lamp-s-1vcpu-1gb-nyc1-01.ssh > 198.96.85.163.26087: Flags [P.], seq 25176:25340, ack 1, win 313, length 164
20:39:16.963475 IP lamp-s-1vcpu-1gb-nyc1-01.ssh > 198.96.85.163.26087: Flags [P.], seq 25340:25504, ack 1, win 313, length 164
20:39:16.963565 IP lamp-s-1vcpu-1gb-nyc1-01.ssh > 198.96.85.163.26087: Flags [P.], seq 25504:25668, ack 1, win 313, length 164
20:39:16.975242 IP 198.96.85.163.26087 > lamp-s-1vcpu-1gb-nyc1-01.ssh: Flags [.], ack 15276, win 2051, length 0
20:39:16.975363 IP lamp-s-1vcpu-1gb-nyc1-01.ssh > 198.96.85.163.26087: Flags [P.], seq 25668:25832, ack 1, win 313, length 164
20:39:16.975614 IP lamp-s-1vcpu-1gb-nyc1-01.ssh > 198.96.85.163.26087: Flags [P.], seq 25832:26108, ack 1, win 313, length 276
20:39:16.975730 IP lamp-s-1vcpu-1gb-nyc1-01.ssh > 198.96.85.163.26087: Flags [P.], seq 26108:26272, ack 1, win 313, length 164
20:39:16.975827 IP lamp-s-1vcpu-1gb-nyc1-01.ssh > 198.96.85.163.26087: Flags [P.], seq 26272:26436, ack 1, win 313, length 164
20:39:16.975949 IP lamp-s-1vcpu-1gb-nyc1-01.ssh > 198.96.85.163.26087: Flags [P.], seq 26436:26600, ack 1, win 313, length 164
20:39:16.976053 IP lamp-s-1vcpu-1gb-nyc1-01.ssh > 198.96.85.163.26087: Flags [P.], seq 26600:26764, ack 1, win 313, length 164
20:39:16.976207 IP lamp-s-1vcpu-1gb-nyc1-01.ssh > 198.96.85.163.26087: Flags [P.], seq 26764:26928, ack 1, win 313, length 164
20:39:16.976321 IP lamp-s-1vcpu-1gb-nyc1-01.ssh > 198.96.85.163.26087: Flags [P.], seq 26928:27092, ack 1, win 313, length 164
20:39:16.976469 IP lamp-s-1vcpu-1gb-nyc1-01.ssh > 198.96.85.163.26087: Flags [P.], seq 27092:27256, ack 1, win 313, length 164
20:39:16.976589 IP lamp-s-1vcpu-1gb-nyc1-01.ssh > 198.96.85.163.26087: Flags [P.], seq 27256:27420, ack 1, win 313, length 164
20:39:16.976699 IP lamp-s-1vcpu-1gb-nyc1-01.ssh > 198.96.85.163.26087: Flags [P.], seq 27420:27584, ack 1, win 313, length 164
20:39:16.976854 IP lamp-s-1vcpu-1gb-nyc1-01.ssh > 198.96.85.163.26087: Flags [P.], seq 27584:27748, ack 1, win 313, length 164
20:39:16.976965 IP lamp-s-1vcpu-1gb-nyc1-01.ssh > 198.96.85.163.26087: Flags [P.], seq 27748:27912, ack 1, win 313, length 164
20:39:16.977028 IP 198.96.85.163.26087 > lamp-s-1vcpu-1gb-nyc1-01.ssh: Flags [.], ack 16320, win 2047, length 0
20:39:16.977239 IP lamp-s-1vcpu-1gb-nyc1-01.ssh > 198.96.85.163.26087: Flags [P.], seq 27912:28188, ack 1, win 313, length 276
20:39:16.977382 IP lamp-s-1vcpu-1gb-nyc1-01.ssh > 198.96.85.163.26087: Flags [P.], seq 28188:28352, ack 1, win 313, length 164
20:39:16.977553 IP lamp-s-1vcpu-1gb-nyc1-01.ssh > 198.96.85.163.26087: Flags [P.], seq 28352:28516, ack 1, win 313, length 164
20:39:16.977657 IP lamp-s-1vcpu-1gb-nyc1-01.ssh > 198.96.85.163.26087: Flags [P.], seq 28516:28680, ack 1, win 313, length 164
20:39:16.977753 IP lamp-s-1vcpu-1gb-nyc1-01.ssh > 198.96.85.163.26087: Flags [P.], seq 28680:28844, ack 1, win 313, length 164
20:39:16.977926 IP lamp-s-1vcpu-1gb-nyc1-01.ssh > 198.96.85.163.26087: Flags [P.], seq 28844:29008, ack 1, win 313, length 164
20:39:16.978075 IP lamp-s-1vcpu-1gb-nyc1-01.ssh > 198.96.85.163.26087: Flags [P.], seq 29008:29172, ack 1, win 313, length 164
20:39:16.978185 IP lamp-s-1vcpu-1gb-nyc1-01.ssh > 198.96.85.163.26087: Flags [P.], seq 29172:29336, ack 1, win 313, length 164
20:39:16.978351 IP lamp-s-1vcpu-1gb-nyc1-01.ssh > 198.96.85.163.26087: Flags [P.], seq 29336:29500, ack 1, win 313, length 164
20:39:16.978522 IP lamp-s-1vcpu-1gb-nyc1-01.ssh > 198.96.85.163.26087: Flags [P.], seq 29500:29664, ack 1, win 313, length 164
20:39:16.978692 IP lamp-s-1vcpu-1gb-nyc1-01.ssh > 198.96.85.163.26087: Flags [P.], seq 29664:29828, ack 1, win 313, length 164
20:39:16.978855 IP lamp-s-1vcpu-1gb-nyc1-01.ssh > 198.96.85.163.26087: Flags [P.], seq 29828:29992, ack 1, win 313, length 164
20:39:16.979022 IP lamp-s-1vcpu-1gb-nyc1-01.ssh > 198.96.85.163.26087: Flags [P.], seq 29992:30156, ack 1, win 313, length 164
20:39:16.979168 IP lamp-s-1vcpu-1gb-nyc1-01.ssh > 198.96.85.163.26087: Flags [P.], seq 30156:30320, ack 1, win 313, length 164
20:39:16.979300 IP lamp-s-1vcpu-1gb-nyc1-01.ssh > 198.96.85.163.26087: Flags [P.], seq 30320:30484, ack 1, win 313, length 164
20:39:16.979431 IP lamp-s-1vcpu-1gb-nyc1-01.ssh > 198.96.85.163.26087: Flags [P.], seq 30484:30648, ack 1, win 313, length 164
20:39:16.979536 IP lamp-s-1vcpu-1gb-nyc1-01.ssh > 198.96.85.163.26087: Flags [P.], seq 30648:30812, ack 1, win 313, length 164
20:39:16.979652 IP lamp-s-1vcpu-1gb-nyc1-01.ssh > 198.96.85.163.26087: Flags [P.], seq 30812:30976, ack 1, win 313, length 164
20:39:16.979750 IP lamp-s-1vcpu-1gb-nyc1-01.ssh > 198.96.85.163.26087: Flags [P.], seq 30976:31140, ack 1, win 313, length 164
20:39:16.979842 IP lamp-s-1vcpu-1gb-nyc1-01.ssh > 198.96.85.163.26087: Flags [P.], seq 31140:31304, ack 1, win 313, length 164
20:39:16.979934 IP lamp-s-1vcpu-1gb-nyc1-01.ssh > 198.96.85.163.26087: Flags [P.], seq 31304:31468, ack 1, win 313, length 164
20:39:16.980024 IP lamp-s-1vcpu-1gb-nyc1-01.ssh > 198.96.85.163.26087: Flags [P.], seq 31468:31632, ack 1, win 313, length 164
20:39:16.980117 IP lamp-s-1vcpu-1gb-nyc1-01.ssh > 198.96.85.163.26087: Flags [P.], seq 31632:31796, ack 1, win 313, length 164
20:39:16.980208 IP lamp-s-1vcpu-1gb-nyc1-01.ssh > 198.96.85.163.26087: Flags [P.], seq 31796:31960, ack 1, win 313, length 164
20:39:16.980297 IP lamp-s-1vcpu-1gb-nyc1-01.ssh > 198.96.85.163.26087: Flags [P.], seq 31960:32124, ack 1, win 313, length 164
20:39:16.980427 IP lamp-s-1vcpu-1gb-nyc1-01.ssh > 198.96.85.163.26087: Flags [P.], seq 32124:32288, ack 1, win 313, length 164
20:39:16.980569 IP lamp-s-1vcpu-1gb-nyc1-01.ssh > 198.96.85.163.26087: Flags [P.], seq 32288:32452, ack 1, win 313, length 164
20:39:16.980672 IP lamp-s-1vcpu-1gb-nyc1-01.ssh > 198.96.85.163.26087: Flags [P.], seq 32452:32616, ack 1, win 313, length 164
20:39:16.980805 IP lamp-s-1vcpu-1gb-nyc1-01.ssh > 198.96.85.163.26087: Flags [P.], seq 32616:32780, ack 1, win 313, length 164
20:39:16.980961 IP lamp-s-1vcpu-1gb-nyc1-01.ssh > 198.96.85.163.26087: Flags [P.], seq 32780:32944, ack 1, win 313, length 164
20:39:16.981092 IP lamp-s-1vcpu-1gb-nyc1-01.ssh > 198.96.85.163.26087: Flags [P.], seq 32944:33108, ack 1, win 313, length 164
20:39:16.983730 IP 198.96.85.163.26087 > lamp-s-1vcpu-1gb-nyc1-01.ssh: Flags [.], ack 21568, win 2051, length 0
20:39:16.983792 IP lamp-s-1vcpu-1gb-nyc1-01.ssh > 198.96.85.163.26087: Flags [P.], seq 33108:33272, ack 1, win 313, length 164
20:39:16.983859 IP 198.96.85.163.26087 > lamp-s-1vcpu-1gb-nyc1-01.ssh: Flags [.], ack 21732, win 2050, length 0
20:39:16.984082 IP lamp-s-1vcpu-1gb-nyc1-01.ssh > 198.96.85.163.26087: Flags [P.], seq 33272:33660, ack 1, win 313, length 388
20:39:16.984234 IP lamp-s-1vcpu-1gb-nyc1-01.ssh > 198.96.85.163.26087: Flags [P.], seq 33660:33824, ack 1, win 313, length 164
20:39:16.984334 IP lamp-s-1vcpu-1gb-nyc1-01.ssh > 198.96.85.163.26087: Flags [P.], seq 33824:33988, ack 1, win 313, length 164
20:39:16.984445 IP lamp-s-1vcpu-1gb-nyc1-01.ssh > 198.96.85.163.26087: Flags [P.], seq 33988:34152, ack 1, win 313, length 164
20:39:16.984477 IP 198.96.85.163.26087 > lamp-s-1vcpu-1gb-nyc1-01.ssh: Flags [.], ack 25668, win 2051, length 0
20:39:16.984611 IP lamp-s-1vcpu-1gb-nyc1-01.ssh > 198.96.85.163.26087: Flags [P.], seq 34152:34428, ack 1, win 313, length 276
20:39:16.984727 IP lamp-s-1vcpu-1gb-nyc1-01.ssh > 198.96.85.163.26087: Flags [P.], seq 34428:34592, ack 1, win 313, length 164
20:39:16.984818 IP lamp-s-1vcpu-1gb-nyc1-01.ssh > 198.96.85.163.26087: Flags [P.], seq 34592:34756, ack 1, win 313, length 164
20:39:16.984908 IP lamp-s-1vcpu-1gb-nyc1-01.ssh > 198.96.85.163.26087: Flags [P.], seq 34756:34920, ack 1, win 313, length 164
20:39:16.984997 IP lamp-s-1vcpu-1gb-nyc1-01.ssh > 198.96.85.163.26087: Flags [P.], seq 34920:35084, ack 1, win 313, length 164
20:39:16.985085 IP lamp-s-1vcpu-1gb-nyc1-01.ssh > 198.96.85.163.26087: Flags [P.], seq 35084:35248, ack 1, win 313, length 164
20:39:16.985181 IP lamp-s-1vcpu-1gb-nyc1-01.ssh > 198.96.85.163.26087: Flags [P.], seq 35248:35412, ack 1, win 313, length 164
20:39:16.985375 IP lamp-s-1vcpu-1gb-nyc1-01.ssh > 198.96.85.163.26087: Flags [P.], seq 35412:35576, ack 1, win 313, length 164
20:39:16.985472 IP lamp-s-1vcpu-1gb-nyc1-01.ssh > 198.96.85.163.26087: Flags [P.], seq 35576:35740, ack 1, win 313, length 164
20:39:16.985546 IP lamp-s-1vcpu-1gb-nyc1-01.ssh > 198.96.85.163.26087: Flags [P.], seq 35740:35904, ack 1, win 313, length 164
20:39:16.985617 IP lamp-s-1vcpu-1gb-nyc1-01.ssh > 198.96.85.163.26087: Flags [P.], seq 35904:36068, ack 1, win 313, length 164
20:39:16.985692 IP lamp-s-1vcpu-1gb-nyc1-01.ssh > 198.96.85.163.26087: Flags [P.], seq 36068:36232, ack 1, win 313, length 164
20:39:16.985764 IP lamp-s-1vcpu-1gb-nyc1-01.ssh > 198.96.85.163.26087: Flags [P.], seq 36232:36396, ack 1, win 313, length 164
20:39:16.985857 IP lamp-s-1vcpu-1gb-nyc1-01.ssh > 198.96.85.163.26087: Flags [P.], seq 36396:36560, ack 1, win 313, length 164
20:39:16.985990 IP lamp-s-1vcpu-1gb-nyc1-01.ssh > 198.96.85.163.26087: Flags [P.], seq 36560:36724, ack 1, win 313, length 164
20:39:16.986135 IP lamp-s-1vcpu-1gb-nyc1-01.ssh > 198.96.85.163.26087: Flags [P.], seq 36724:36888, ack 1, win 313, length 164
20:39:16.986267 IP lamp-s-1vcpu-1gb-nyc1-01.ssh > 198.96.85.163.26087: Flags [P.], seq 36888:37052, ack 1, win 313, length 164
20:39:16.986362 IP lamp-s-1vcpu-1gb-nyc1-01.ssh > 198.96.85.163.26087: Flags [P.], seq 37052:37216, ack 1, win 313, length 164
20:39:16.986454 IP lamp-s-1vcpu-1gb-nyc1-01.ssh > 198.96.85.163.26087: Flags [P.], seq 37216:37380, ack 1, win 313, length 164
20:39:16.986546 IP lamp-s-1vcpu-1gb-nyc1-01.ssh > 198.96.85.163.26087: Flags [P.], seq 37380:37544, ack 1, win 313, length 164
20:39:16.986638 IP lamp-s-1vcpu-1gb-nyc1-01.ssh > 198.96.85.163.26087: Flags [P.], seq 37544:37708, ack 1, win 313, length 164
20:39:16.986730 IP lamp-s-1vcpu-1gb-nyc1-01.ssh > 198.96.85.163.26087: Flags [P.], seq 37708:37872, ack 1, win 313, length 164
20:39:16.986820 IP lamp-s-1vcpu-1gb-nyc1-01.ssh > 198.96.85.163.26087: Flags [P.], seq 37872:38036, ack 1, win 313, length 164
20:39:16.986913 IP lamp-s-1vcpu-1gb-nyc1-01.ssh > 198.96.85.163.26087: Flags [P.], seq 38036:38200, ack 1, win 313, length 164
20:39:16.987013 IP lamp-s-1vcpu-1gb-nyc1-01.ssh > 198.96.85.163.26087: Flags [P.], seq 38200:38364, ack 1, win 313, length 164
20:39:16.987148 IP lamp-s-1vcpu-1gb-nyc1-01.ssh > 198.96.85.163.26087: Flags [P.], seq 38364:38528, ack 1, win 313, length 164
20:39:16.987238 IP lamp-s-1vcpu-1gb-nyc1-01.ssh > 198.96.85.163.26087: Flags [P.], seq 38528:38692, ack 1, win 313, length 164
20:39:16.987313 IP lamp-s-1vcpu-1gb-nyc1-01.ssh > 198.96.85.163.26087: Flags [P.], seq 38692:38856, ack 1, win 313, length 164
20:39:16.987385 IP lamp-s-1vcpu-1gb-nyc1-01.ssh > 198.96.85.163.26087: Flags [P.], seq 38856:39020, ack 1, win 313, length 164
20:39:16.987456 IP lamp-s-1vcpu-1gb-nyc1-01.ssh > 198.96.85.163.26087: Flags [P.], seq 39020:39184, ack 1, win 313, length 164
20:39:16.987559 IP lamp-s-1vcpu-1gb-nyc1-01.ssh > 198.96.85.163.26087: Flags [P.], seq 39184:39348, ack 1, win 313, length 164
20:39:16.987640 IP lamp-s-1vcpu-1gb-nyc1-01.ssh > 198.96.85.163.26087: Flags [P.], seq 39348:39512, ack 1, win 313, length 164
20:39:16.987715 IP lamp-s-1vcpu-1gb-nyc1-01.ssh > 198.96.85.163.26087: Flags [P.], seq 39512:39676, ack 1, win 313, length 164
20:39:16.987787 IP lamp-s-1vcpu-1gb-nyc1-01.ssh > 198.96.85.163.26087: Flags [P.], seq 39676:39840, ack 1, win 313, length 164
20:39:16.987858 IP lamp-s-1vcpu-1gb-nyc1-01.ssh > 198.96.85.163.26087: Flags [P.], seq 39840:40004, ack 1, win 313, length 164
20:39:16.987932 IP lamp-s-1vcpu-1gb-nyc1-01.ssh > 198.96.85.163.26087: Flags [P.], seq 40004:40168, ack 1, win 313, length 164
20:39:16.988033 IP lamp-s-1vcpu-1gb-nyc1-01.ssh > 198.96.85.163.26087: Flags [P.], seq 40168:40332, ack 1, win 313, length 164
20:39:16.988147 IP lamp-s-1vcpu-1gb-nyc1-01.ssh > 198.96.85.163.26087: Flags [P.], seq 40332:40496, ack 1, win 313, length 164
20:39:16.988231 IP lamp-s-1vcpu-1gb-nyc1-01.ssh > 198.96.85.163.26087: Flags [P.], seq 40496:40660, ack 1, win 313, length 164
20:39:16.988304 IP lamp-s-1vcpu-1gb-nyc1-01.ssh > 198.96.85.163.26087: Flags [P.], seq 40660:40824, ack 1, win 313, length 164
20:39:16.988379 IP lamp-s-1vcpu-1gb-nyc1-01.ssh > 198.96.85.163.26087: Flags [P.], seq 40824:40988, ack 1, win 313, length 164
20:39:16.988453 IP lamp-s-1vcpu-1gb-nyc1-01.ssh > 198.96.85.163.26087: Flags [P.], seq 40988:41152, ack 1, win 313, length 164
20:39:16.988526 IP lamp-s-1vcpu-1gb-nyc1-01.ssh > 198.96.85.163.26087: Flags [P.], seq 41152:41316, ack 1, win 313, length 164
20:39:16.988598 IP lamp-s-1vcpu-1gb-nyc1-01.ssh > 198.96.85.163.26087: Flags [P.], seq 41316:41480, ack 1, win 313, length 164
20:39:16.988670 IP lamp-s-1vcpu-1gb-nyc1-01.ssh > 198.96.85.163.26087: Flags [P.], seq 41480:41644, ack 1, win 313, length 164
20:39:16.988741 IP lamp-s-1vcpu-1gb-nyc1-01.ssh > 198.96.85.163.26087: Flags [P.], seq 41644:41808, ack 1, win 313, length 164
20:39:16.988811 IP lamp-s-1vcpu-1gb-nyc1-01.ssh > 198.96.85.163.26087: Flags [P.], seq 41808:41972, ack 1, win 313, length 164
20:39:16.988882 IP lamp-s-1vcpu-1gb-nyc1-01.ssh > 198.96.85.163.26087: Flags [P.], seq 41972:42136, ack 1, win 313, length 164
20:39:16.988957 IP lamp-s-1vcpu-1gb-nyc1-01.ssh > 198.96.85.163.26087: Flags [P.], seq 42136:42300, ack 1, win 313, length 164
20:39:16.989059 IP lamp-s-1vcpu-1gb-nyc1-01.ssh > 198.96.85.163.26087: Flags [P.], seq 42300:42464, ack 1, win 313, length 164
20:39:16.989183 IP lamp-s-1vcpu-1gb-nyc1-01.ssh > 198.96.85.163.26087: Flags [P.], seq 42464:42628, ack 1, win 313, length 164
20:39:16.989332 IP lamp-s-1vcpu-1gb-nyc1-01.ssh > 198.96.85.163.26087: Flags [P.], seq 42628:42792, ack 1, win 313, length 164
20:39:16.989464 IP lamp-s-1vcpu-1gb-nyc1-01.ssh > 198.96.85.163.26087: Flags [P.], seq 42792:42956, ack 1, win 313, length 164
20:39:16.989556 IP lamp-s-1vcpu-1gb-nyc1-01.ssh > 198.96.85.163.26087: Flags [P.], seq 42956:43120, ack 1, win 313, length 164
20:39:16.989650 IP lamp-s-1vcpu-1gb-nyc1-01.ssh > 198.96.85.163.26087: Flags [P.], seq 43120:43284, ack 1, win 313, length 164
20:39:16.989751 IP lamp-s-1vcpu-1gb-nyc1-01.ssh > 198.96.85.163.26087: Flags [P.], seq 43284:43448, ack 1, win 313, length 164
20:39:16.989826 IP lamp-s-1vcpu-1gb-nyc1-01.ssh > 198.96.85.163.26087: Flags [P.], seq 43448:43612, ack 1, win 313, length 164
20:39:16.989934 IP lamp-s-1vcpu-1gb-nyc1-01.ssh > 198.96.85.163.26087: Flags [P.], seq 43612:43776, ack 1, win 313, length 164
20:39:16.990047 IP lamp-s-1vcpu-1gb-nyc1-01.ssh > 198.96.85.163.26087: Flags [P.], seq 43776:43940, ack 1, win 313, length 164
20:39:16.990160 IP lamp-s-1vcpu-1gb-nyc1-01.ssh > 198.96.85.163.26087: Flags [P.], seq 43940:44104, ack 1, win 313, length 164
20:39:16.990275 IP lamp-s-1vcpu-1gb-nyc1-01.ssh > 198.96.85.163.26087: Flags [P.], seq 44104:44268, ack 1, win 313, length 164
20:39:16.990358 IP lamp-s-1vcpu-1gb-nyc1-01.ssh > 198.96.85.163.26087: Flags [P.], seq 44268:44432, ack 1, win 313, length 164
20:39:16.990433 IP lamp-s-1vcpu-1gb-nyc1-01.ssh > 198.96.85.163.26087: Flags [P.], seq 44432:44596, ack 1, win 313, length 164
20:39:16.990512 IP lamp-s-1vcpu-1gb-nyc1-01.ssh > 198.96.85.163.26087: Flags [P.], seq 44596:44760, ack 1, win 313, length 164
20:39:16.990585 IP lamp-s-1vcpu-1gb-nyc1-01.ssh > 198.96.85.163.26087: Flags [P.], seq 44760:44924, ack 1, win 313, length 164
20:39:16.990660 IP lamp-s-1vcpu-1gb-nyc1-01.ssh > 198.96.85.163.26087: Flags [P.], seq 44924:45088, ack 1, win 313, length 164
20:39:16.990733 IP lamp-s-1vcpu-1gb-nyc1-01.ssh > 198.96.85.163.26087: Flags [P.], seq 45088:45252, ack 1, win 313, length 164
20:39:16.990811 IP lamp-s-1vcpu-1gb-nyc1-01.ssh > 198.96.85.163.26087: Flags [P.], seq 45252:45416, ack 1, win 313, length 164
20:39:16.990892 IP lamp-s-1vcpu-1gb-nyc1-01.ssh > 198.96.85.163.26087: Flags [P.], seq 45416:45580, ack 1, win 313, length 164
20:39:16.991072 IP lamp-s-1vcpu-1gb-nyc1-01.ssh > 198.96.85.163.26087: Flags [P.], seq 45580:45744, ack 1, win 313, length 164
20:39:16.991209 IP lamp-s-1vcpu-1gb-nyc1-01.ssh > 198.96.85.163.26087: Flags [P.], seq 45744:45908, ack 1, win 313, length 164
20:39:17.000937 IP 198.96.85.163.26087 > lamp-s-1vcpu-1gb-nyc1-01.ssh: Flags [.], ack 30812, win 2051, length 0
20:39:17.001052 IP lamp-s-1vcpu-1gb-nyc1-01.ssh > 198.96.85.163.26087: Flags [P.], seq 45908:46072, ack 1, win 313, length 164
20:39:17.001083 IP 198.96.85.163.26087 > lamp-s-1vcpu-1gb-nyc1-01.ssh: Flags [.], ack 33108, win 2051, length 0
20:39:17.001442 IP lamp-s-1vcpu-1gb-nyc1-01.ssh > 198.96.85.163.26087: Flags [P.], seq 46072:46460, ack 1, win 313, length 388
20:39:17.001633 IP lamp-s-1vcpu-1gb-nyc1-01.ssh > 198.96.85.163.26087: Flags [P.], seq 46460:46624, ack 1, win 313, length 164
20:39:17.001745 IP lamp-s-1vcpu-1gb-nyc1-01.ssh > 198.96.85.163.26087: Flags [P.], seq 46624:46788, ack 1, win 313, length 164
20:39:17.001854 IP lamp-s-1vcpu-1gb-nyc1-01.ssh > 198.96.85.163.26087: Flags [P.], seq 46788:46952, ack 1, win 313, length 164
20:39:17.001970 IP lamp-s-1vcpu-1gb-nyc1-01.ssh > 198.96.85.163.26087: Flags [P.], seq 46952:47116, ack 1, win 313, length 164
20:39:17.002094 IP lamp-s-1vcpu-1gb-nyc1-01.ssh > 198.96.85.163.26087: Flags [P.], seq 47116:47280, ack 1, win 313, length 164
20:39:17.002195 IP lamp-s-1vcpu-1gb-nyc1-01.ssh > 198.96.85.163.26087: Flags [P.], seq 47280:47444, ack 1, win 313, length 164
20:39:17.002321 IP lamp-s-1vcpu-1gb-nyc1-01.ssh > 198.96.85.163.26087: Flags [P.], seq 47444:47608, ack 1, win 313, length 164
20:39:17.002399 IP lamp-s-1vcpu-1gb-nyc1-01.ssh > 198.96.85.163.26087: Flags [P.], seq 47608:47772, ack 1, win 313, length 164
20:39:17.002472 IP lamp-s-1vcpu-1gb-nyc1-01.ssh > 198.96.85.163.26087: Flags [P.], seq 47772:47936, ack 1, win 313, length 164
20:39:17.002545 IP lamp-s-1vcpu-1gb-nyc1-01.ssh > 198.96.85.163.26087: Flags [P.], seq 47936:48100, ack 1, win 313, length 164
20:39:17.002620 IP lamp-s-1vcpu-1gb-nyc1-01.ssh > 198.96.85.163.26087: Flags [P.], seq 48100:48264, ack 1, win 313, length 164
20:39:17.002713 IP lamp-s-1vcpu-1gb-nyc1-01.ssh > 198.96.85.163.26087: Flags [P.], seq 48264:48428, ack 1, win 313, length 164
20:39:17.002843 IP lamp-s-1vcpu-1gb-nyc1-01.ssh > 198.96.85.163.26087: Flags [P.], seq 48428:48592, ack 1, win 313, length 164
20:39:17.002953 IP lamp-s-1vcpu-1gb-nyc1-01.ssh > 198.96.85.163.26087: Flags [P.], seq 48592:48756, ack 1, win 313, length 164
20:39:17.003057 IP lamp-s-1vcpu-1gb-nyc1-01.ssh > 198.96.85.163.26087: Flags [P.], seq 48756:48920, ack 1, win 313, length 164
20:39:17.003166 IP lamp-s-1vcpu-1gb-nyc1-01.ssh > 198.96.85.163.26087: Flags [P.], seq 48920:49084, ack 1, win 313, length 164
20:39:17.003249 IP lamp-s-1vcpu-1gb-nyc1-01.ssh > 198.96.85.163.26087: Flags [P.], seq 49084:49248, ack 1, win 313, length 164
20:39:17.003325 IP lamp-s-1vcpu-1gb-nyc1-01.ssh > 198.96.85.163.26087: Flags [P.], seq 49248:49412, ack 1, win 313, length 164
20:39:17.003401 IP lamp-s-1vcpu-1gb-nyc1-01.ssh > 198.96.85.163.26087: Flags [P.], seq 49412:49576, ack 1, win 313, length 164
20:39:17.003473 IP lamp-s-1vcpu-1gb-nyc1-01.ssh > 198.96.85.163.26087: Flags [P.], seq 49576:49740, ack 1, win 313, length 164
20:39:17.003545 IP lamp-s-1vcpu-1gb-nyc1-01.ssh > 198.96.85.163.26087: Flags [P.], seq 49740:49904, ack 1, win 313, length 164
20:39:17.003621 IP lamp-s-1vcpu-1gb-nyc1-01.ssh > 198.96.85.163.26087: Flags [P.], seq 49904:50068, ack 1, win 313, length 164
20:39:17.003694 IP lamp-s-1vcpu-1gb-nyc1-01.ssh > 198.96.85.163.26087: Flags [P.], seq 50068:50232, ack 1, win 313, length 164
20:39:17.003750 IP 198.96.85.163.26087 > lamp-s-1vcpu-1gb-nyc1-01.ssh: Flags [.], ack 34152, win 2047, length 0
20:39:17.003836 IP lamp-s-1vcpu-1gb-nyc1-01.ssh > 198.96.85.163.26087: Flags [P.], seq 50232:50508, ack 1, win 313, length 276
20:39:17.003916 IP lamp-s-1vcpu-1gb-nyc1-01.ssh > 198.96.85.163.26087: Flags [P.], seq 50508:50672, ack 1, win 313, length 164
20:39:17.003988 IP lamp-s-1vcpu-1gb-nyc1-01.ssh > 198.96.85.163.26087: Flags [P.], seq 50672:50836, ack 1, win 313, length 164
20:39:17.004063 IP lamp-s-1vcpu-1gb-nyc1-01.ssh > 198.96.85.163.26087: Flags [P.], seq 50836:51000, ack 1, win 313, length 164
20:39:17.004136 IP lamp-s-1vcpu-1gb-nyc1-01.ssh > 198.96.85.163.26087: Flags [P.], seq 51000:51164, ack 1, win 313, length 164
20:39:17.004207 IP lamp-s-1vcpu-1gb-nyc1-01.ssh > 198.96.85.163.26087: Flags [P.], seq 51164:51328, ack 1, win 313, length 164
20:39:17.004279 IP lamp-s-1vcpu-1gb-nyc1-01.ssh > 198.96.85.163.26087: Flags [P.], seq 51328:51492, ack 1, win 313, length 164
20:39:17.004350 IP lamp-s-1vcpu-1gb-nyc1-01.ssh > 198.96.85.163.26087: Flags [P.], seq 51492:51656, ack 1, win 313, length 164
20:39:17.004428 IP lamp-s-1vcpu-1gb-nyc1-01.ssh > 198.96.85.163.26087: Flags [P.], seq 51656:51820, ack 1, win 313, length 164
20:39:17.004501 IP lamp-s-1vcpu-1gb-nyc1-01.ssh > 198.96.85.163.26087: Flags [P.], seq 51820:51984, ack 1, win 313, length 164
20:39:17.004573 IP lamp-s-1vcpu-1gb-nyc1-01.ssh > 198.96.85.163.26087: Flags [P.], seq 51984:52148, ack 1, win 313, length 164
20:39:17.004645 IP lamp-s-1vcpu-1gb-nyc1-01.ssh > 198.96.85.163.26087: Flags [P.], seq 52148:52312, ack 1, win 313, length 164
20:39:17.004718 IP lamp-s-1vcpu-1gb-nyc1-01.ssh > 198.96.85.163.26087: Flags [P.], seq 52312:52476, ack 1, win 313, length 164
20:39:17.004795 IP lamp-s-1vcpu-1gb-nyc1-01.ssh > 198.96.85.163.26087: Flags [P.], seq 52476:52640, ack 1, win 313, length 164
20:39:17.004868 IP lamp-s-1vcpu-1gb-nyc1-01.ssh > 198.96.85.163.26087: Flags [P.], seq 52640:52804, ack 1, win 313, length 164
20:39:17.004944 IP lamp-s-1vcpu-1gb-nyc1-01.ssh > 198.96.85.163.26087: Flags [P.], seq 52804:52968, ack 1, win 313, length 164
20:39:17.005050 IP lamp-s-1vcpu-1gb-nyc1-01.ssh > 198.96.85.163.26087: Flags [P.], seq 52968:53132, ack 1, win 313, length 164
20:39:17.005131 IP lamp-s-1vcpu-1gb-nyc1-01.ssh > 198.96.85.163.26087: Flags [P.], seq 53132:53296, ack 1, win 313, length 164
20:39:17.005220 IP lamp-s-1vcpu-1gb-nyc1-01.ssh > 198.96.85.163.26087: Flags [P.], seq 53296:53460, ack 1, win 313, length 164
20:39:17.005298 IP lamp-s-1vcpu-1gb-nyc1-01.ssh > 198.96.85.163.26087: Flags [P.], seq 53460:53624, ack 1, win 313, length 164
20:39:17.005444 IP lamp-s-1vcpu-1gb-nyc1-01.ssh > 198.96.85.163.26087: Flags [P.], seq 53624:53788, ack 1, win 313, length 164
20:39:17.005577 IP lamp-s-1vcpu-1gb-nyc1-01.ssh > 198.96.85.163.26087: Flags [P.], seq 53788:53952, ack 1, win 313, length 164
20:39:17.005652 IP 198.96.85.163.26087 > lamp-s-1vcpu-1gb-nyc1-01.ssh: Flags [.], ack 35904, win 2051, length 0
20:39:17.005762 IP lamp-s-1vcpu-1gb-nyc1-01.ssh > 198.96.85.163.26087: Flags [P.], seq 53952:54228, ack 1, win 313, length 276
20:39:17.005850 IP lamp-s-1vcpu-1gb-nyc1-01.ssh > 198.96.85.163.26087: Flags [P.], seq 54228:54392, ack 1, win 313, length 164
20:39:17.005925 IP lamp-s-1vcpu-1gb-nyc1-01.ssh > 198.96.85.163.26087: Flags [P.], seq 54392:54556, ack 1, win 313, length 164
20:39:17.006006 IP lamp-s-1vcpu-1gb-nyc1-01.ssh > 198.96.85.163.26087: Flags [P.], seq 54556:54720, ack 1, win 313, length 164
20:39:17.006083 IP lamp-s-1vcpu-1gb-nyc1-01.ssh > 198.96.85.163.26087: Flags [P.], seq 54720:54884, ack 1, win 313, length 164
20:39:17.006160 IP lamp-s-1vcpu-1gb-nyc1-01.ssh > 198.96.85.163.26087: Flags [P.], seq 54884:55048, ack 1, win 313, length 164
20:39:17.006265 IP lamp-s-1vcpu-1gb-nyc1-01.ssh > 198.96.85.163.26087: Flags [P.], seq 55048:55212, ack 1, win 313, length 164
20:39:17.006340 IP lamp-s-1vcpu-1gb-nyc1-01.ssh > 198.96.85.163.26087: Flags [P.], seq 55212:55376, ack 1, win 313, length 164
20:39:17.006427 IP 198.96.85.163.26087 > lamp-s-1vcpu-1gb-nyc1-01.ssh: Flags [.], ack 38200, win 2051, length 0
20:39:17.006503 IP lamp-s-1vcpu-1gb-nyc1-01.ssh > 198.96.85.163.26087: Flags [P.], seq 55376:55540, ack 1, win 313, length 164
20:39:17.006608 IP lamp-s-1vcpu-1gb-nyc1-01.ssh > 198.96.85.163.26087: Flags [P.], seq 55540:55816, ack 1, win 313, length 276
20:39:17.006689 IP lamp-s-1vcpu-1gb-nyc1-01.ssh > 198.96.85.163.26087: Flags [P.], seq 55816:55980, ack 1, win 313, length 164
20:39:17.006764 IP lamp-s-1vcpu-1gb-nyc1-01.ssh > 198.96.85.163.26087: Flags [P.], seq 55980:56144, ack 1, win 313, length 164
20:39:17.006842 IP lamp-s-1vcpu-1gb-nyc1-01.ssh > 198.96.85.163.26087: Flags [P.], seq 56144:56308, ack 1, win 313, length 164
20:39:17.006937 IP lamp-s-1vcpu-1gb-nyc1-01.ssh > 198.96.85.163.26087: Flags [P.], seq 56308:56472, ack 1, win 313, length 164
20:39:17.007030 IP lamp-s-1vcpu-1gb-nyc1-01.ssh > 198.96.85.163.26087: Flags [P.], seq 56472:56636, ack 1, win 313, length 164
20:39:17.007111 IP lamp-s-1vcpu-1gb-nyc1-01.ssh > 198.96.85.163.26087: Flags [P.], seq 56636:56800, ack 1, win 313, length 164
20:39:17.007188 IP lamp-s-1vcpu-1gb-nyc1-01.ssh > 198.96.85.163.26087: Flags [P.], seq 56800:56964, ack 1, win 313, length 164
20:39:17.007261 IP lamp-s-1vcpu-1gb-nyc1-01.ssh > 198.96.85.163.26087: Flags [P.], seq 56964:57128, ack 1, win 313, length 164
20:39:17.007382 IP lamp-s-1vcpu-1gb-nyc1-01.ssh > 198.96.85.163.26087: Flags [P.], seq 57128:57292, ack 1, win 313, length 164
20:39:17.007513 IP lamp-s-1vcpu-1gb-nyc1-01.ssh > 198.96.85.163.26087: Flags [P.], seq 57292:57456, ack 1, win 313, length 164
20:39:17.007617 IP lamp-s-1vcpu-1gb-nyc1-01.ssh > 198.96.85.163.26087: Flags [P.], seq 57456:57620, ack 1, win 313, length 164
20:39:17.007696 IP lamp-s-1vcpu-1gb-nyc1-01.ssh > 198.96.85.163.26087: Flags [P.], seq 57620:57784, ack 1, win 313, length 164
20:39:17.007773 IP lamp-s-1vcpu-1gb-nyc1-01.ssh > 198.96.85.163.26087: Flags [P.], seq 57784:57948, ack 1, win 313, length 164
20:39:17.007847 IP lamp-s-1vcpu-1gb-nyc1-01.ssh > 198.96.85.163.26087: Flags [P.], seq 57948:58112, ack 1, win 313, length 164
20:39:17.007926 IP lamp-s-1vcpu-1gb-nyc1-01.ssh > 198.96.85.163.26087: Flags [P.], seq 58112:58276, ack 1, win 313, length 164
20:39:17.007999 IP lamp-s-1vcpu-1gb-nyc1-01.ssh > 198.96.85.163.26087: Flags [P.], seq 58276:58440, ack 1, win 313, length 164
20:39:17.008077 IP lamp-s-1vcpu-1gb-nyc1-01.ssh > 198.96.85.163.26087: Flags [P.], seq 58440:58604, ack 1, win 313, length 164
20:39:17.008153 IP lamp-s-1vcpu-1gb-nyc1-01.ssh > 198.96.85.163.26087: Flags [P.], seq 58604:58768, ack 1, win 313, length 164
20:39:17.008235 IP lamp-s-1vcpu-1gb-nyc1-01.ssh > 198.96.85.163.26087: Flags [P.], seq 58768:58932, ack 1, win 313, length 164
20:39:17.008314 IP lamp-s-1vcpu-1gb-nyc1-01.ssh > 198.96.85.163.26087: Flags [P.], seq 58932:59096, ack 1, win 313, length 164
20:39:17.008394 IP lamp-s-1vcpu-1gb-nyc1-01.ssh > 198.96.85.163.26087: Flags [P.], seq 59096:59260, ack 1, win 313, length 164
20:39:17.008508 IP lamp-s-1vcpu-1gb-nyc1-01.ssh > 198.96.85.163.26087: Flags [P.], seq 59260:59424, ack 1, win 313, length 164
20:39:17.011821 IP 198.96.85.163.26087 > lamp-s-1vcpu-1gb-nyc1-01.ssh: Flags [.], ack 43448, win 2051, length 0
20:39:17.011884 IP lamp-s-1vcpu-1gb-nyc1-01.ssh > 198.96.85.163.26087: Flags [P.], seq 59424:59588, ack 1, win 313, length 164
20:39:17.012056 IP lamp-s-1vcpu-1gb-nyc1-01.ssh > 198.96.85.163.26087: Flags [P.], seq 59588:59864, ack 1, win 313, length 276
20:39:17.012107 IP 198.96.85.163.26087 > lamp-s-1vcpu-1gb-nyc1-01.ssh: Flags [.], ack 45908, win 2051, length 0
20:39:17.012224 IP lamp-s-1vcpu-1gb-nyc1-01.ssh > 198.96.85.163.26087: Flags [P.], seq 59864:60140, ack 1, win 313, length 276
20:39:17.012393 IP lamp-s-1vcpu-1gb-nyc1-01.ssh > 198.96.85.163.26087: Flags [P.], seq 60140:60304, ack 1, win 313, length 164
20:39:17.012505 IP lamp-s-1vcpu-1gb-nyc1-01.ssh > 198.96.85.163.26087: Flags [P.], seq 60304:60468, ack 1, win 313, length 164
20:39:17.012584 IP lamp-s-1vcpu-1gb-nyc1-01.ssh > 198.96.85.163.26087: Flags [P.], seq 60468:60632, ack 1, win 313, length 164
20:39:17.012657 IP lamp-s-1vcpu-1gb-nyc1-01.ssh > 198.96.85.163.26087: Flags [P.], seq 60632:60796, ack 1, win 313, length 164
20:39:17.012777 IP lamp-s-1vcpu-1gb-nyc1-01.ssh > 198.96.85.163.26087: Flags [P.], seq 60796:60960, ack 1, win 313, length 164
20:39:17.012909 IP lamp-s-1vcpu-1gb-nyc1-01.ssh > 198.96.85.163.26087: Flags [P.], seq 60960:61124, ack 1, win 313, length 164
20:39:17.013042 IP lamp-s-1vcpu-1gb-nyc1-01.ssh > 198.96.85.163.26087: Flags [P.], seq 61124:61288, ack 1, win 313, length 164
20:39:17.013158 IP lamp-s-1vcpu-1gb-nyc1-01.ssh > 198.96.85.163.26087: Flags [P.], seq 61288:61452, ack 1, win 313, length 164
20:39:17.013333 IP lamp-s-1vcpu-1gb-nyc1-01.ssh > 198.96.85.163.26087: Flags [P.], seq 61452:61616, ack 1, win 313, length 164
20:39:17.013467 IP lamp-s-1vcpu-1gb-nyc1-01.ssh > 198.96.85.163.26087: Flags [P.], seq 61616:61780, ack 1, win 313, length 164
20:39:17.013553 IP lamp-s-1vcpu-1gb-nyc1-01.ssh > 198.96.85.163.26087: Flags [P.], seq 61780:61944, ack 1, win 313, length 164
20:39:17.013632 IP lamp-s-1vcpu-1gb-nyc1-01.ssh > 198.96.85.163.26087: Flags [P.], seq 61944:62108, ack 1, win 313, length 164
20:39:17.013709 IP lamp-s-1vcpu-1gb-nyc1-01.ssh > 198.96.85.163.26087: Flags [P.], seq 62108:62272, ack 1, win 313, length 164
20:39:17.013780 IP lamp-s-1vcpu-1gb-nyc1-01.ssh > 198.96.85.163.26087: Flags [P.], seq 62272:62436, ack 1, win 313, length 164
20:39:17.013851 IP lamp-s-1vcpu-1gb-nyc1-01.ssh > 198.96.85.163.26087: Flags [P.], seq 62436:62600, ack 1, win 313, length 164
20:39:17.013922 IP lamp-s-1vcpu-1gb-nyc1-01.ssh > 198.96.85.163.26087: Flags [P.], seq 62600:62764, ack 1, win 313, length 164
20:39:17.013994 IP lamp-s-1vcpu-1gb-nyc1-01.ssh > 198.96.85.163.26087: Flags [P.], seq 62764:62928, ack 1, win 313, length 164
20:39:17.014066 IP lamp-s-1vcpu-1gb-nyc1-01.ssh > 198.96.85.163.26087: Flags [P.], seq 62928:63092, ack 1, win 313, length 164
20:39:17.014141 IP lamp-s-1vcpu-1gb-nyc1-01.ssh > 198.96.85.163.26087: Flags [P.], seq 63092:63256, ack 1, win 313, length 164
20:39:17.014275 IP lamp-s-1vcpu-1gb-nyc1-01.ssh > 198.96.85.163.26087: Flags [P.], seq 63256:63420, ack 1, win 313, length 164
20:39:17.014402 IP lamp-s-1vcpu-1gb-nyc1-01.ssh > 198.96.85.163.26087: Flags [P.], seq 63420:63584, ack 1, win 313, length 164
20:39:17.014487 IP lamp-s-1vcpu-1gb-nyc1-01.ssh > 198.96.85.163.26087: Flags [P.], seq 63584:63748, ack 1, win 313, length 164
20:39:17.014560 IP lamp-s-1vcpu-1gb-nyc1-01.ssh > 198.96.85.163.26087: Flags [P.], seq 63748:63912, ack 1, win 313, length 164
20:39:17.014633 IP lamp-s-1vcpu-1gb-nyc1-01.ssh > 198.96.85.163.26087: Flags [P.], seq 63912:64076, ack 1, win 313, length 164
20:39:17.014705 IP lamp-s-1vcpu-1gb-nyc1-01.ssh > 198.96.85.163.26087: Flags [P.], seq 64076:64240, ack 1, win 313, length 164
20:39:17.014784 IP lamp-s-1vcpu-1gb-nyc1-01.ssh > 198.96.85.163.26087: Flags [P.], seq 64240:64404, ack 1, win 313, length 164
20:39:17.014860 IP lamp-s-1vcpu-1gb-nyc1-01.ssh > 198.96.85.163.26087: Flags [P.], seq 64404:64568, ack 1, win 313, length 164
20:39:17.014932 IP lamp-s-1vcpu-1gb-nyc1-01.ssh > 198.96.85.163.26087: Flags [P.], seq 64568:64732, ack 1, win 313, length 164
20:39:17.015004 IP lamp-s-1vcpu-1gb-nyc1-01.ssh > 198.96.85.163.26087: Flags [P.], seq 64732:64896, ack 1, win 313, length 164
20:39:17.015076 IP lamp-s-1vcpu-1gb-nyc1-01.ssh > 198.96.85.163.26087: Flags [P.], seq 64896:65060, ack 1, win 313, length 164
20:39:17.015148 IP lamp-s-1vcpu-1gb-nyc1-01.ssh > 198.96.85.163.26087: Flags [P.], seq 65060:65224, ack 1, win 313, length 164
20:39:17.015221 IP lamp-s-1vcpu-1gb-nyc1-01.ssh > 198.96.85.163.26087: Flags [P.], seq 65224:65388, ack 1, win 313, length 164
20:39:17.015301 IP lamp-s-1vcpu-1gb-nyc1-01.ssh > 198.96.85.163.26087: Flags [P.], seq 65388:65552, ack 1, win 313, length 164
20:39:17.015367 IP lamp-s-1vcpu-1gb-nyc1-01.ssh > 198.96.85.163.26087: Flags [P.], seq 65552:65716, ack 1, win 313, length 164
20:39:17.015440 IP lamp-s-1vcpu-1gb-nyc1-01.ssh > 198.96.85.163.26087: Flags [P.], seq 65716:65880, ack 1, win 313, length 164
20:39:17.015515 IP lamp-s-1vcpu-1gb-nyc1-01.ssh > 198.96.85.163.26087: Flags [P.], seq 65880:66044, ack 1, win 313, length 164
20:39:17.015587 IP lamp-s-1vcpu-1gb-nyc1-01.ssh > 198.96.85.163.26087: Flags [P.], seq 66044:66208, ack 1, win 313, length 164
20:39:17.015658 IP lamp-s-1vcpu-1gb-nyc1-01.ssh > 198.96.85.163.26087: Flags [P.], seq 66208:66372, ack 1, win 313, length 164
20:39:17.015730 IP lamp-s-1vcpu-1gb-nyc1-01.ssh > 198.96.85.163.26087: Flags [P.], seq 66372:66536, ack 1, win 313, length 164
20:39:17.015802 IP lamp-s-1vcpu-1gb-nyc1-01.ssh > 198.96.85.163.26087: Flags [P.], seq 66536:66700, ack 1, win 313, length 164
20:39:17.015881 IP lamp-s-1vcpu-1gb-nyc1-01.ssh > 198.96.85.163.26087: Flags [P.], seq 66700:66864, ack 1, win 313, length 164
20:39:17.016003 IP lamp-s-1vcpu-1gb-nyc1-01.ssh > 198.96.85.163.26087: Flags [P.], seq 66864:67028, ack 1, win 313, length 164
20:39:17.016120 IP lamp-s-1vcpu-1gb-nyc1-01.ssh > 198.96.85.163.26087: Flags [P.], seq 67028:67192, ack 1, win 313, length 164
20:39:17.016201 IP lamp-s-1vcpu-1gb-nyc1-01.ssh > 198.96.85.163.26087: Flags [P.], seq 67192:67356, ack 1, win 313, length 164
20:39:17.016306 IP lamp-s-1vcpu-1gb-nyc1-01.ssh > 198.96.85.163.26087: Flags [P.], seq 67356:67520, ack 1, win 313, length 164
20:39:17.016418 IP lamp-s-1vcpu-1gb-nyc1-01.ssh > 198.96.85.163.26087: Flags [P.], seq 67520:67684, ack 1, win 313, length 164
20:39:17.020857 IP 198.96.85.163.26087 > lamp-s-1vcpu-1gb-nyc1-01.ssh: Flags [P.], seq 1:37, ack 46072, win 2050, length 36
20:39:17.020908 IP lamp-s-1vcpu-1gb-nyc1-01.ssh > 198.96.85.163.26087: Flags [P.], seq 67684:67848, ack 37, win 313, length 164
^C
413 packets captured
419 packets received by filter
6 packets dropped by kernel