root@lamp-s-1vcpu-1gb-nyc1-01:~# tcpdump -i eth0
tcpdump: verbose output suppressed, use -v or -vv for full protocol decode
listening on eth0, link-type EN10MB (Ethernet), capture size 262144 bytes
20:25:56.613842 IP lamp-s-1vcpu-1gb-nyc1-01.ssh > 198.96.85.163.26087: Flags [P.], seq 3964021783:3964021891, ack 643401746, win 313, length 108
20:25:56.613949 IP lamp-s-1vcpu-1gb-nyc1-01.ssh > 198.96.85.163.26087: Flags [P.], seq 108:144, ack 1, win 313, length 36
20:25:56.614045 IP lamp-s-1vcpu-1gb-nyc1-01.ssh > 198.96.85.163.26087: Flags [P.], seq 144:252, ack 1, win 313, length 108
20:25:56.614118 IP lamp-s-1vcpu-1gb-nyc1-01.ssh > 198.96.85.163.26087: Flags [P.], seq 252:288, ack 1, win 313, length 36
20:25:56.615987 IP lamp-s-1vcpu-1gb-nyc1-01.ssh > 198.96.85.163.26087: Flags [P.], seq 288:468, ack 1, win 313, length 180
20:25:56.616081 IP lamp-s-1vcpu-1gb-nyc1-01.ssh > 198.96.85.163.26087: Flags [P.], seq 468:504, ack 1, win 313, length 36
20:25:56.616211 IP lamp-s-1vcpu-1gb-nyc1-01.ssh > 198.96.85.163.26087: Flags [P.], seq 504:660, ack 1, win 313, length 156
20:25:56.616296 IP lamp-s-1vcpu-1gb-nyc1-01.ssh > 198.96.85.163.26087: Flags [P.], seq 660:696, ack 1, win 313, length 36
20:25:56.616408 IP lamp-s-1vcpu-1gb-nyc1-01.ssh > 198.96.85.163.26087: Flags [P.], seq 696:852, ack 1, win 313, length 156
20:25:56.633400 IP 198.96.85.163.26087 > lamp-s-1vcpu-1gb-nyc1-01.ssh: Flags [.], ack 288, win 2047, length 0
20:25:56.633474 IP lamp-s-1vcpu-1gb-nyc1-01.ssh > 198.96.85.163.26087: Flags [P.], seq 852:2040, ack 1, win 313, length 1188
20:25:56.633709 IP lamp-s-1vcpu-1gb-nyc1-01.ssh > 198.96.85.163.26087: Flags [P.], seq 2040:2188, ack 1, win 313, length 148
20:25:56.633801 IP lamp-s-1vcpu-1gb-nyc1-01.ssh > 198.96.85.163.26087: Flags [P.], seq 2188:2224, ack 1, win 313, length 36
20:25:56.633914 IP lamp-s-1vcpu-1gb-nyc1-01.ssh > 198.96.85.163.26087: Flags [P.], seq 2224:2388, ack 1, win 313, length 164
20:25:56.634004 IP lamp-s-1vcpu-1gb-nyc1-01.ssh > 198.96.85.163.26087: Flags [P.], seq 2388:2424, ack 1, win 313, length 36
20:25:56.634115 IP lamp-s-1vcpu-1gb-nyc1-01.ssh > 198.96.85.163.26087: Flags [P.], seq 2424:2588, ack 1, win 313, length 164
20:25:56.634189 IP lamp-s-1vcpu-1gb-nyc1-01.ssh > 198.96.85.163.26087: Flags [P.], seq 2588:2624, ack 1, win 313, length 36
20:25:56.634327 IP lamp-s-1vcpu-1gb-nyc1-01.ssh > 198.96.85.163.26087: Flags [P.], seq 2624:2788, ack 1, win 313, length 164
20:25:56.634406 IP lamp-s-1vcpu-1gb-nyc1-01.ssh > 198.96.85.163.26087: Flags [P.], seq 2788:2824, ack 1, win 313, length 36
20:25:56.634506 IP lamp-s-1vcpu-1gb-nyc1-01.ssh > 198.96.85.163.26087: Flags [P.], seq 2824:2988, ack 1, win 313, length 164
20:25:56.635584 IP 198.96.85.163.26087 > lamp-s-1vcpu-1gb-nyc1-01.ssh: Flags [.], ack 852, win 2051, length 0
20:25:56.635620 IP lamp-s-1vcpu-1gb-nyc1-01.ssh > 198.96.85.163.26087: Flags [P.], seq 2988:4224, ack 1, win 313, length 1236
20:25:56.635757 IP lamp-s-1vcpu-1gb-nyc1-01.ssh > 198.96.85.163.26087: Flags [P.], seq 4224:4372, ack 1, win 313, length 148
20:25:56.635851 IP lamp-s-1vcpu-1gb-nyc1-01.ssh > 198.96.85.163.26087: Flags [P.], seq 4372:4408, ack 1, win 313, length 36
20:25:56.635966 IP lamp-s-1vcpu-1gb-nyc1-01.ssh > 198.96.85.163.26087: Flags [P.], seq 4408:4572, ack 1, win 313, length 164
20:25:56.636050 IP lamp-s-1vcpu-1gb-nyc1-01.ssh > 198.96.85.163.26087: Flags [P.], seq 4572:4608, ack 1, win 313, length 36
20:25:56.636163 IP lamp-s-1vcpu-1gb-nyc1-01.ssh > 198.96.85.163.26087: Flags [P.], seq 4608:4772, ack 1, win 313, length 164
20:25:56.636245 IP lamp-s-1vcpu-1gb-nyc1-01.ssh > 198.96.85.163.26087: Flags [P.], seq 4772:4808, ack 1, win 313, length 36
20:25:56.636356 IP lamp-s-1vcpu-1gb-nyc1-01.ssh > 198.96.85.163.26087: Flags [P.], seq 4808:4972, ack 1, win 313, length 164
20:25:56.636446 IP lamp-s-1vcpu-1gb-nyc1-01.ssh > 198.96.85.163.26087: Flags [P.], seq 4972:5008, ack 1, win 313, length 36
20:25:56.636564 IP lamp-s-1vcpu-1gb-nyc1-01.ssh > 198.96.85.163.26087: Flags [P.], seq 5008:5172, ack 1, win 313, length 164
20:25:56.654138 IP 198.96.85.163.26087 > lamp-s-1vcpu-1gb-nyc1-01.ssh: Flags [.], ack 2988, win 2051, length 0
20:25:56.654219 IP lamp-s-1vcpu-1gb-nyc1-01.ssh > 198.96.85.163.26087: Flags [P.], seq 5172:6408, ack 1, win 313, length 1236
20:25:56.654461 IP lamp-s-1vcpu-1gb-nyc1-01.ssh > 198.96.85.163.26087: Flags [P.], seq 6408:6556, ack 1, win 313, length 148
20:25:56.654558 IP lamp-s-1vcpu-1gb-nyc1-01.ssh > 198.96.85.163.26087: Flags [P.], seq 6556:6592, ack 1, win 313, length 36
20:25:56.654671 IP lamp-s-1vcpu-1gb-nyc1-01.ssh > 198.96.85.163.26087: Flags [P.], seq 6592:6756, ack 1, win 313, length 164
20:25:56.654758 IP lamp-s-1vcpu-1gb-nyc1-01.ssh > 198.96.85.163.26087: Flags [P.], seq 6756:6792, ack 1, win 313, length 36
20:25:56.654884 IP lamp-s-1vcpu-1gb-nyc1-01.ssh > 198.96.85.163.26087: Flags [P.], seq 6792:6956, ack 1, win 313, length 164
20:25:56.654969 IP lamp-s-1vcpu-1gb-nyc1-01.ssh > 198.96.85.163.26087: Flags [P.], seq 6956:6992, ack 1, win 313, length 36
20:25:56.655085 IP lamp-s-1vcpu-1gb-nyc1-01.ssh > 198.96.85.163.26087: Flags [P.], seq 6992:7156, ack 1, win 313, length 164
20:25:56.655170 IP lamp-s-1vcpu-1gb-nyc1-01.ssh > 198.96.85.163.26087: Flags [P.], seq 7156:7192, ack 1, win 313, length 36
20:25:56.655268 IP lamp-s-1vcpu-1gb-nyc1-01.ssh > 198.96.85.163.26087: Flags [P.], seq 7192:7356, ack 1, win 313, length 164
20:25:56.655448 IP lamp-s-1vcpu-1gb-nyc1-01.ssh > 198.96.85.163.26087: Flags [P.], seq 7392:7556, ack 1, win 313, length 164
20:25:56.655642 IP lamp-s-1vcpu-1gb-nyc1-01.ssh > 198.96.85.163.26087: Flags [P.], seq 7592:7756, ack 1, win 313, length 164
20:25:56.655880 IP lamp-s-1vcpu-1gb-nyc1-01.ssh > 198.96.85.163.26087: Flags [P.], seq 7792:7956, ack 1, win 313, length 164
20:25:56.656082 IP lamp-s-1vcpu-1gb-nyc1-01.ssh > 198.96.85.163.26087: Flags [P.], seq 7992:8156, ack 1, win 313, length 164
20:25:56.656207 IP lamp-s-1vcpu-1gb-nyc1-01.ssh > 198.96.85.163.26087: Flags [P.], seq 8156:8320, ack 1, win 313, length 164
20:25:56.656380 IP lamp-s-1vcpu-1gb-nyc1-01.ssh > 198.96.85.163.26087: Flags [P.], seq 8320:8732, ack 1, win 313, length 412
20:25:56.656486 IP 198.96.85.163.26087 > lamp-s-1vcpu-1gb-nyc1-01.ssh: Flags [.], ack 5172, win 2050, length 0
20:25:56.656585 IP lamp-s-1vcpu-1gb-nyc1-01.ssh > 198.96.85.163.26087: Flags [P.], seq 8732:8896, ack 1, win 313, length 164
20:25:56.656793 IP lamp-s-1vcpu-1gb-nyc1-01.ssh > 198.96.85.163.26087: Flags [P.], seq 8896:9428, ack 1, win 313, length 532
20:25:56.656953 IP lamp-s-1vcpu-1gb-nyc1-01.ssh > 198.96.85.163.26087: Flags [P.], seq 9428:9720, ack 1, win 313, length 292
20:25:56.657114 IP lamp-s-1vcpu-1gb-nyc1-01.ssh > 198.96.85.163.26087: Flags [P.], seq 9720:9884, ack 1, win 313, length 164
20:25:56.657252 IP lamp-s-1vcpu-1gb-nyc1-01.ssh > 198.96.85.163.26087: Flags [P.], seq 9884:10048, ack 1, win 313, length 164
20:25:56.657380 IP lamp-s-1vcpu-1gb-nyc1-01.ssh > 198.96.85.163.26087: Flags [P.], seq 10048:10212, ack 1, win 313, length 164
20:25:56.657501 IP lamp-s-1vcpu-1gb-nyc1-01.ssh > 198.96.85.163.26087: Flags [P.], seq 10212:10376, ack 1, win 313, length 164
20:25:56.657629 IP lamp-s-1vcpu-1gb-nyc1-01.ssh > 198.96.85.163.26087: Flags [P.], seq 10376:10540, ack 1, win 313, length 164
20:25:56.657758 IP lamp-s-1vcpu-1gb-nyc1-01.ssh > 198.96.85.163.26087: Flags [P.], seq 10540:10704, ack 1, win 313, length 164
20:25:56.657881 IP lamp-s-1vcpu-1gb-nyc1-01.ssh > 198.96.85.163.26087: Flags [P.], seq 10704:10868, ack 1, win 313, length 164
20:25:56.658003 IP lamp-s-1vcpu-1gb-nyc1-01.ssh > 198.96.85.163.26087: Flags [P.], seq 10868:11032, ack 1, win 313, length 164
20:25:56.658114 IP lamp-s-1vcpu-1gb-nyc1-01.ssh > 198.96.85.163.26087: Flags [P.], seq 11032:11196, ack 1, win 313, length 164
20:25:56.658261 IP lamp-s-1vcpu-1gb-nyc1-01.ssh > 198.96.85.163.26087: Flags [P.], seq 11196:11360, ack 1, win 313, length 164
20:25:56.658376 IP lamp-s-1vcpu-1gb-nyc1-01.ssh > 198.96.85.163.26087: Flags [P.], seq 11360:11524, ack 1, win 313, length 164
20:25:56.658496 IP lamp-s-1vcpu-1gb-nyc1-01.ssh > 198.96.85.163.26087: Flags [P.], seq 11524:11688, ack 1, win 313, length 164
20:25:56.658607 IP lamp-s-1vcpu-1gb-nyc1-01.ssh > 198.96.85.163.26087: Flags [P.], seq 11688:11852, ack 1, win 313, length 164
20:25:56.658716 IP lamp-s-1vcpu-1gb-nyc1-01.ssh > 198.96.85.163.26087: Flags [P.], seq 11852:12016, ack 1, win 313, length 164
20:25:56.658828 IP lamp-s-1vcpu-1gb-nyc1-01.ssh > 198.96.85.163.26087: Flags [P.], seq 12016:12180, ack 1, win 313, length 164
20:25:56.658943 IP lamp-s-1vcpu-1gb-nyc1-01.ssh > 198.96.85.163.26087: Flags [P.], seq 12180:12344, ack 1, win 313, length 164
20:25:56.659062 IP lamp-s-1vcpu-1gb-nyc1-01.ssh > 198.96.85.163.26087: Flags [P.], seq 12344:12508, ack 1, win 313, length 164
20:25:56.674414 IP 198.96.85.163.26087 > lamp-s-1vcpu-1gb-nyc1-01.ssh: Flags [.], ack 6992, win 2051, length 0
20:25:56.674480 IP lamp-s-1vcpu-1gb-nyc1-01.ssh > 198.96.85.163.26087: Flags [P.], seq 12508:12672, ack 1, win 313, length 164
20:25:56.674717 IP lamp-s-1vcpu-1gb-nyc1-01.ssh > 198.96.85.163.26087: Flags [P.], seq 12672:12948, ack 1, win 313, length 276
20:25:56.674819 IP lamp-s-1vcpu-1gb-nyc1-01.ssh > 198.96.85.163.26087: Flags [P.], seq 12948:13112, ack 1, win 313, length 164
20:25:56.674927 IP lamp-s-1vcpu-1gb-nyc1-01.ssh > 198.96.85.163.26087: Flags [P.], seq 13112:13276, ack 1, win 313, length 164
20:25:56.675017 IP lamp-s-1vcpu-1gb-nyc1-01.ssh > 198.96.85.163.26087: Flags [P.], seq 13276:13440, ack 1, win 313, length 164
20:25:56.675135 IP lamp-s-1vcpu-1gb-nyc1-01.ssh > 198.96.85.163.26087: Flags [P.], seq 13440:13604, ack 1, win 313, length 164
20:25:56.675220 IP lamp-s-1vcpu-1gb-nyc1-01.ssh > 198.96.85.163.26087: Flags [P.], seq 13604:13768, ack 1, win 313, length 164
20:25:56.675328 IP lamp-s-1vcpu-1gb-nyc1-01.ssh > 198.96.85.163.26087: Flags [P.], seq 13768:13932, ack 1, win 313, length 164
20:25:56.675408 IP lamp-s-1vcpu-1gb-nyc1-01.ssh > 198.96.85.163.26087: Flags [P.], seq 13932:14096, ack 1, win 313, length 164
20:25:56.675482 IP lamp-s-1vcpu-1gb-nyc1-01.ssh > 198.96.85.163.26087: Flags [P.], seq 14096:14260, ack 1, win 313, length 164
20:25:56.675619 IP lamp-s-1vcpu-1gb-nyc1-01.ssh > 198.96.85.163.26087: Flags [P.], seq 14260:14424, ack 1, win 313, length 164
20:25:56.675718 IP lamp-s-1vcpu-1gb-nyc1-01.ssh > 198.96.85.163.26087: Flags [P.], seq 14424:14588, ack 1, win 313, length 164
20:25:56.675776 IP 198.96.85.163.26087 > lamp-s-1vcpu-1gb-nyc1-01.ssh: Flags [.], ack 8732, win 2051, length 0
20:25:56.675866 IP lamp-s-1vcpu-1gb-nyc1-01.ssh > 198.96.85.163.26087: Flags [P.], seq 14588:14864, ack 1, win 313, length 276
20:25:56.675952 IP lamp-s-1vcpu-1gb-nyc1-01.ssh > 198.96.85.163.26087: Flags [P.], seq 14864:15028, ack 1, win 313, length 164
20:25:56.676028 IP lamp-s-1vcpu-1gb-nyc1-01.ssh > 198.96.85.163.26087: Flags [P.], seq 15028:15192, ack 1, win 313, length 164
20:25:56.676108 IP lamp-s-1vcpu-1gb-nyc1-01.ssh > 198.96.85.163.26087: Flags [P.], seq 15192:15356, ack 1, win 313, length 164
20:25:56.676213 IP lamp-s-1vcpu-1gb-nyc1-01.ssh > 198.96.85.163.26087: Flags [P.], seq 15356:15520, ack 1, win 313, length 164
20:25:56.676321 IP lamp-s-1vcpu-1gb-nyc1-01.ssh > 198.96.85.163.26087: Flags [P.], seq 15520:15684, ack 1, win 313, length 164
20:25:56.676441 IP lamp-s-1vcpu-1gb-nyc1-01.ssh > 198.96.85.163.26087: Flags [P.], seq 15684:15848, ack 1, win 313, length 164
20:25:56.676521 IP lamp-s-1vcpu-1gb-nyc1-01.ssh > 198.96.85.163.26087: Flags [P.], seq 15848:16012, ack 1, win 313, length 164
20:25:56.676596 IP lamp-s-1vcpu-1gb-nyc1-01.ssh > 198.96.85.163.26087: Flags [P.], seq 16012:16176, ack 1, win 313, length 164
20:25:56.676672 IP lamp-s-1vcpu-1gb-nyc1-01.ssh > 198.96.85.163.26087: Flags [P.], seq 16176:16340, ack 1, win 313, length 164
20:25:56.676746 IP lamp-s-1vcpu-1gb-nyc1-01.ssh > 198.96.85.163.26087: Flags [P.], seq 16340:16504, ack 1, win 313, length 164
20:25:56.676819 IP lamp-s-1vcpu-1gb-nyc1-01.ssh > 198.96.85.163.26087: Flags [P.], seq 16504:16668, ack 1, win 313, length 164
20:25:56.676894 IP lamp-s-1vcpu-1gb-nyc1-01.ssh > 198.96.85.163.26087: Flags [P.], seq 16668:16832, ack 1, win 313, length 164
20:25:56.676979 IP lamp-s-1vcpu-1gb-nyc1-01.ssh > 198.96.85.163.26087: Flags [P.], seq 16832:16996, ack 1, win 313, length 164
20:25:56.677064 IP lamp-s-1vcpu-1gb-nyc1-01.ssh > 198.96.85.163.26087: Flags [P.], seq 16996:17160, ack 1, win 313, length 164
20:25:56.677231 IP lamp-s-1vcpu-1gb-nyc1-01.ssh > 198.96.85.163.26087: Flags [P.], seq 17160:17324, ack 1, win 313, length 164
20:25:56.677328 IP lamp-s-1vcpu-1gb-nyc1-01.ssh > 198.96.85.163.26087: Flags [P.], seq 17324:17488, ack 1, win 313, length 164
20:25:56.677418 IP lamp-s-1vcpu-1gb-nyc1-01.ssh > 198.96.85.163.26087: Flags [P.], seq 17488:17652, ack 1, win 313, length 164
20:25:56.677528 IP lamp-s-1vcpu-1gb-nyc1-01.ssh > 198.96.85.163.26087: Flags [P.], seq 17652:17816, ack 1, win 313, length 164
20:25:56.677640 IP lamp-s-1vcpu-1gb-nyc1-01.ssh > 198.96.85.163.26087: Flags [P.], seq 17816:17980, ack 1, win 313, length 164
20:25:56.677731 IP lamp-s-1vcpu-1gb-nyc1-01.ssh > 198.96.85.163.26087: Flags [P.], seq 17980:18144, ack 1, win 313, length 164
20:25:56.677834 IP lamp-s-1vcpu-1gb-nyc1-01.ssh > 198.96.85.163.26087: Flags [P.], seq 18144:18308, ack 1, win 313, length 164
20:25:56.677917 IP lamp-s-1vcpu-1gb-nyc1-01.ssh > 198.96.85.163.26087: Flags [P.], seq 18308:18472, ack 1, win 313, length 164
20:25:56.678044 IP lamp-s-1vcpu-1gb-nyc1-01.ssh > 198.96.85.163.26087: Flags [P.], seq 18472:18636, ack 1, win 313, length 164
20:25:56.678130 IP lamp-s-1vcpu-1gb-nyc1-01.ssh > 198.96.85.163.26087: Flags [P.], seq 18636:18800, ack 1, win 313, length 164
20:25:56.678270 IP lamp-s-1vcpu-1gb-nyc1-01.ssh > 198.96.85.163.26087: Flags [P.], seq 18800:18964, ack 1, win 313, length 164
20:25:56.678369 IP lamp-s-1vcpu-1gb-nyc1-01.ssh > 198.96.85.163.26087: Flags [P.], seq 18964:19128, ack 1, win 313, length 164
20:25:56.678455 IP lamp-s-1vcpu-1gb-nyc1-01.ssh > 198.96.85.163.26087: Flags [P.], seq 19128:19292, ack 1, win 313, length 164
20:25:56.679905 IP 198.96.85.163.26087 > lamp-s-1vcpu-1gb-nyc1-01.ssh: Flags [.], ack 12508, win 2051, length 0
20:25:56.679942 IP lamp-s-1vcpu-1gb-nyc1-01.ssh > 198.96.85.163.26087: Flags [P.], seq 19292:19456, ack 1, win 313, length 164
20:25:56.680079 IP lamp-s-1vcpu-1gb-nyc1-01.ssh > 198.96.85.163.26087: Flags [P.], seq 19456:19732, ack 1, win 313, length 276
20:25:56.680170 IP lamp-s-1vcpu-1gb-nyc1-01.ssh > 198.96.85.163.26087: Flags [P.], seq 19732:19896, ack 1, win 313, length 164
20:25:56.680246 IP lamp-s-1vcpu-1gb-nyc1-01.ssh > 198.96.85.163.26087: Flags [P.], seq 19896:20060, ack 1, win 313, length 164
20:25:56.680324 IP lamp-s-1vcpu-1gb-nyc1-01.ssh > 198.96.85.163.26087: Flags [P.], seq 20060:20224, ack 1, win 313, length 164
20:25:56.680422 IP lamp-s-1vcpu-1gb-nyc1-01.ssh > 198.96.85.163.26087: Flags [P.], seq 20224:20388, ack 1, win 313, length 164
20:25:56.680513 IP lamp-s-1vcpu-1gb-nyc1-01.ssh > 198.96.85.163.26087: Flags [P.], seq 20388:20552, ack 1, win 313, length 164
20:25:56.680593 IP lamp-s-1vcpu-1gb-nyc1-01.ssh > 198.96.85.163.26087: Flags [P.], seq 20552:20716, ack 1, win 313, length 164
20:25:56.680668 IP lamp-s-1vcpu-1gb-nyc1-01.ssh > 198.96.85.163.26087: Flags [P.], seq 20716:20880, ack 1, win 313, length 164
20:25:56.680746 IP lamp-s-1vcpu-1gb-nyc1-01.ssh > 198.96.85.163.26087: Flags [P.], seq 20880:21044, ack 1, win 313, length 164
20:25:56.680839 IP lamp-s-1vcpu-1gb-nyc1-01.ssh > 198.96.85.163.26087: Flags [P.], seq 21044:21208, ack 1, win 313, length 164
20:25:56.680916 IP lamp-s-1vcpu-1gb-nyc1-01.ssh > 198.96.85.163.26087: Flags [P.], seq 21208:21372, ack 1, win 313, length 164
20:25:56.681003 IP lamp-s-1vcpu-1gb-nyc1-01.ssh > 198.96.85.163.26087: Flags [P.], seq 21372:21536, ack 1, win 313, length 164
20:25:56.681104 IP lamp-s-1vcpu-1gb-nyc1-01.ssh > 198.96.85.163.26087: Flags [P.], seq 21536:21700, ack 1, win 313, length 164
20:25:56.681189 IP lamp-s-1vcpu-1gb-nyc1-01.ssh > 198.96.85.163.26087: Flags [P.], seq 21700:21864, ack 1, win 313, length 164
20:25:56.681257 IP lamp-s-1vcpu-1gb-nyc1-01.ssh > 198.96.85.163.26087: Flags [P.], seq 21864:22028, ack 1, win 313, length 164
20:25:56.681367 IP lamp-s-1vcpu-1gb-nyc1-01.ssh > 198.96.85.163.26087: Flags [P.], seq 22028:22192, ack 1, win 313, length 164
20:25:56.681470 IP lamp-s-1vcpu-1gb-nyc1-01.ssh > 198.96.85.163.26087: Flags [P.], seq 22192:22356, ack 1, win 313, length 164
20:25:56.681550 IP lamp-s-1vcpu-1gb-nyc1-01.ssh > 198.96.85.163.26087: Flags [P.], seq 22356:22520, ack 1, win 313, length 164
20:25:56.681627 IP lamp-s-1vcpu-1gb-nyc1-01.ssh > 198.96.85.163.26087: Flags [P.], seq 22520:22684, ack 1, win 313, length 164
20:25:56.681702 IP lamp-s-1vcpu-1gb-nyc1-01.ssh > 198.96.85.163.26087: Flags [P.], seq 22684:22848, ack 1, win 313, length 164
20:25:56.681788 IP lamp-s-1vcpu-1gb-nyc1-01.ssh > 198.96.85.163.26087: Flags [P.], seq 22848:23012, ack 1, win 313, length 164
20:25:56.681871 IP lamp-s-1vcpu-1gb-nyc1-01.ssh > 198.96.85.163.26087: Flags [P.], seq 23012:23176, ack 1, win 313, length 164
20:25:56.681949 IP lamp-s-1vcpu-1gb-nyc1-01.ssh > 198.96.85.163.26087: Flags [P.], seq 23176:23340, ack 1, win 313, length 164
20:25:56.682024 IP lamp-s-1vcpu-1gb-nyc1-01.ssh > 198.96.85.163.26087: Flags [P.], seq 23340:23504, ack 1, win 313, length 164
20:25:56.682142 IP lamp-s-1vcpu-1gb-nyc1-01.ssh > 198.96.85.163.26087: Flags [P.], seq 23504:23668, ack 1, win 313, length 164
20:25:56.682320 IP lamp-s-1vcpu-1gb-nyc1-01.ssh > 198.96.85.163.26087: Flags [P.], seq 23668:23832, ack 1, win 313, length 164
20:25:56.682420 IP lamp-s-1vcpu-1gb-nyc1-01.ssh > 198.96.85.163.26087: Flags [P.], seq 23832:23996, ack 1, win 313, length 164
20:25:56.682498 IP lamp-s-1vcpu-1gb-nyc1-01.ssh > 198.96.85.163.26087: Flags [P.], seq 23996:24160, ack 1, win 313, length 164
20:25:56.682575 IP lamp-s-1vcpu-1gb-nyc1-01.ssh > 198.96.85.163.26087: Flags [P.], seq 24160:24324, ack 1, win 313, length 164
20:25:56.682651 IP lamp-s-1vcpu-1gb-nyc1-01.ssh > 198.96.85.163.26087: Flags [P.], seq 24324:24488, ack 1, win 313, length 164
20:25:56.682725 IP lamp-s-1vcpu-1gb-nyc1-01.ssh > 198.96.85.163.26087: Flags [P.], seq 24488:24652, ack 1, win 313, length 164
20:25:56.682799 IP lamp-s-1vcpu-1gb-nyc1-01.ssh > 198.96.85.163.26087: Flags [P.], seq 24652:24816, ack 1, win 313, length 164
20:25:56.682872 IP lamp-s-1vcpu-1gb-nyc1-01.ssh > 198.96.85.163.26087: Flags [P.], seq 24816:24980, ack 1, win 313, length 164
20:25:56.682946 IP lamp-s-1vcpu-1gb-nyc1-01.ssh > 198.96.85.163.26087: Flags [P.], seq 24980:25144, ack 1, win 313, length 164
20:25:56.683027 IP lamp-s-1vcpu-1gb-nyc1-01.ssh > 198.96.85.163.26087: Flags [P.], seq 25144:25308, ack 1, win 313, length 164
20:25:56.683102 IP lamp-s-1vcpu-1gb-nyc1-01.ssh > 198.96.85.163.26087: Flags [P.], seq 25308:25472, ack 1, win 313, length 164
20:25:56.683178 IP lamp-s-1vcpu-1gb-nyc1-01.ssh > 198.96.85.163.26087: Flags [P.], seq 25472:25636, ack 1, win 313, length 164
20:25:56.683272 IP lamp-s-1vcpu-1gb-nyc1-01.ssh > 198.96.85.163.26087: Flags [P.], seq 25636:25800, ack 1, win 313, length 164
20:25:56.683346 IP lamp-s-1vcpu-1gb-nyc1-01.ssh > 198.96.85.163.26087: Flags [P.], seq 25800:25964, ack 1, win 313, length 164
20:25:56.702224 IP 198.96.85.163.26087 > lamp-s-1vcpu-1gb-nyc1-01.ssh: Flags [.], ack 17980, win 2051, length 0
20:25:56.702350 IP lamp-s-1vcpu-1gb-nyc1-01.ssh > 198.96.85.163.26087: Flags [P.], seq 25964:26128, ack 1, win 313, length 164
20:25:56.702453 IP 198.96.85.163.26087 > lamp-s-1vcpu-1gb-nyc1-01.ssh: Flags [.], ack 22848, win 2051, length 0
20:25:56.702710 IP lamp-s-1vcpu-1gb-nyc1-01.ssh > 198.96.85.163.26087: Flags [P.], seq 26128:26516, ack 1, win 313, length 388
20:25:56.702859 IP lamp-s-1vcpu-1gb-nyc1-01.ssh > 198.96.85.163.26087: Flags [P.], seq 26516:26680, ack 1, win 313, length 164
20:25:56.703026 IP lamp-s-1vcpu-1gb-nyc1-01.ssh > 198.96.85.163.26087: Flags [P.], seq 26680:26844, ack 1, win 313, length 164
20:25:56.703147 IP lamp-s-1vcpu-1gb-nyc1-01.ssh > 198.96.85.163.26087: Flags [P.], seq 26844:27008, ack 1, win 313, length 164
20:25:56.703189 IP 198.96.85.163.26087 > lamp-s-1vcpu-1gb-nyc1-01.ssh: Flags [.], ack 25964, win 2051, length 0
20:25:56.703340 IP lamp-s-1vcpu-1gb-nyc1-01.ssh > 198.96.85.163.26087: Flags [P.], seq 27008:27284, ack 1, win 313, length 276
20:25:56.703467 IP lamp-s-1vcpu-1gb-nyc1-01.ssh > 198.96.85.163.26087: Flags [P.], seq 27284:27448, ack 1, win 313, length 164
20:25:56.703580 IP lamp-s-1vcpu-1gb-nyc1-01.ssh > 198.96.85.163.26087: Flags [P.], seq 27448:27612, ack 1, win 313, length 164
20:25:56.703692 IP lamp-s-1vcpu-1gb-nyc1-01.ssh > 198.96.85.163.26087: Flags [P.], seq 27612:27776, ack 1, win 313, length 164
20:25:56.703800 IP lamp-s-1vcpu-1gb-nyc1-01.ssh > 198.96.85.163.26087: Flags [P.], seq 27776:27940, ack 1, win 313, length 164
20:25:56.703942 IP lamp-s-1vcpu-1gb-nyc1-01.ssh > 198.96.85.163.26087: Flags [P.], seq 27940:28104, ack 1, win 313, length 164
20:25:56.704074 IP lamp-s-1vcpu-1gb-nyc1-01.ssh > 198.96.85.163.26087: Flags [P.], seq 28104:28268, ack 1, win 313, length 164
20:25:56.704242 IP lamp-s-1vcpu-1gb-nyc1-01.ssh > 198.96.85.163.26087: Flags [P.], seq 28268:28432, ack 1, win 313, length 164
20:25:56.704364 IP lamp-s-1vcpu-1gb-nyc1-01.ssh > 198.96.85.163.26087: Flags [P.], seq 28432:28596, ack 1, win 313, length 164
20:25:56.704466 IP lamp-s-1vcpu-1gb-nyc1-01.ssh > 198.96.85.163.26087: Flags [P.], seq 28596:28760, ack 1, win 313, length 164
20:25:56.704565 IP lamp-s-1vcpu-1gb-nyc1-01.ssh > 198.96.85.163.26087: Flags [P.], seq 28760:28924, ack 1, win 313, length 164
20:25:56.704670 IP lamp-s-1vcpu-1gb-nyc1-01.ssh > 198.96.85.163.26087: Flags [P.], seq 28924:29088, ack 1, win 313, length 164
20:25:56.704772 IP lamp-s-1vcpu-1gb-nyc1-01.ssh > 198.96.85.163.26087: Flags [P.], seq 29088:29252, ack 1, win 313, length 164
20:25:56.704902 IP lamp-s-1vcpu-1gb-nyc1-01.ssh > 198.96.85.163.26087: Flags [P.], seq 29252:29416, ack 1, win 313, length 164
20:25:56.705032 IP lamp-s-1vcpu-1gb-nyc1-01.ssh > 198.96.85.163.26087: Flags [P.], seq 29416:29580, ack 1, win 313, length 164
20:25:56.705180 IP lamp-s-1vcpu-1gb-nyc1-01.ssh > 198.96.85.163.26087: Flags [P.], seq 29580:29744, ack 1, win 313, length 164
20:25:56.705286 IP lamp-s-1vcpu-1gb-nyc1-01.ssh > 198.96.85.163.26087: Flags [P.], seq 29744:29908, ack 1, win 313, length 164
20:25:56.705386 IP lamp-s-1vcpu-1gb-nyc1-01.ssh > 198.96.85.163.26087: Flags [P.], seq 29908:30072, ack 1, win 313, length 164
20:25:56.705488 IP lamp-s-1vcpu-1gb-nyc1-01.ssh > 198.96.85.163.26087: Flags [P.], seq 30072:30236, ack 1, win 313, length 164
20:25:56.705588 IP lamp-s-1vcpu-1gb-nyc1-01.ssh > 198.96.85.163.26087: Flags [P.], seq 30236:30400, ack 1, win 313, length 164
20:25:56.705692 IP lamp-s-1vcpu-1gb-nyc1-01.ssh > 198.96.85.163.26087: Flags [P.], seq 30400:30564, ack 1, win 313, length 164
20:25:56.705792 IP lamp-s-1vcpu-1gb-nyc1-01.ssh > 198.96.85.163.26087: Flags [P.], seq 30564:30728, ack 1, win 313, length 164
20:25:56.705955 IP lamp-s-1vcpu-1gb-nyc1-01.ssh > 198.96.85.163.26087: Flags [P.], seq 30728:30892, ack 1, win 313, length 164
20:25:56.706136 IP lamp-s-1vcpu-1gb-nyc1-01.ssh > 198.96.85.163.26087: Flags [P.], seq 30892:31056, ack 1, win 313, length 164
20:25:56.706308 IP lamp-s-1vcpu-1gb-nyc1-01.ssh > 198.96.85.163.26087: Flags [P.], seq 31056:31220, ack 1, win 313, length 164
20:25:56.706450 IP lamp-s-1vcpu-1gb-nyc1-01.ssh > 198.96.85.163.26087: Flags [P.], seq 31220:31384, ack 1, win 313, length 164
20:25:56.706626 IP lamp-s-1vcpu-1gb-nyc1-01.ssh > 198.96.85.163.26087: Flags [P.], seq 31384:31548, ack 1, win 313, length 164
20:25:56.706792 IP lamp-s-1vcpu-1gb-nyc1-01.ssh > 198.96.85.163.26087: Flags [P.], seq 31548:31712, ack 1, win 313, length 164
20:25:56.706944 IP lamp-s-1vcpu-1gb-nyc1-01.ssh > 198.96.85.163.26087: Flags [P.], seq 31712:31876, ack 1, win 313, length 164
20:25:56.707093 IP lamp-s-1vcpu-1gb-nyc1-01.ssh > 198.96.85.163.26087: Flags [P.], seq 31876:32040, ack 1, win 313, length 164
20:25:56.707247 IP lamp-s-1vcpu-1gb-nyc1-01.ssh > 198.96.85.163.26087: Flags [P.], seq 32040:32204, ack 1, win 313, length 164
20:25:56.707402 IP lamp-s-1vcpu-1gb-nyc1-01.ssh > 198.96.85.163.26087: Flags [P.], seq 32204:32368, ack 1, win 313, length 164
20:25:56.707541 IP lamp-s-1vcpu-1gb-nyc1-01.ssh > 198.96.85.163.26087: Flags [P.], seq 32368:32532, ack 1, win 313, length 164
20:25:56.707691 IP lamp-s-1vcpu-1gb-nyc1-01.ssh > 198.96.85.163.26087: Flags [P.], seq 32532:32696, ack 1, win 313, length 164
20:25:56.707862 IP lamp-s-1vcpu-1gb-nyc1-01.ssh > 198.96.85.163.26087: Flags [P.], seq 32696:32860, ack 1, win 313, length 164
20:25:56.708039 IP lamp-s-1vcpu-1gb-nyc1-01.ssh > 198.96.85.163.26087: Flags [P.], seq 32860:33024, ack 1, win 313, length 164
20:25:56.708221 IP lamp-s-1vcpu-1gb-nyc1-01.ssh > 198.96.85.163.26087: Flags [P.], seq 33024:33188, ack 1, win 313, length 164
20:25:56.708383 IP lamp-s-1vcpu-1gb-nyc1-01.ssh > 198.96.85.163.26087: Flags [P.], seq 33188:33352, ack 1, win 313, length 164
20:25:56.708495 IP lamp-s-1vcpu-1gb-nyc1-01.ssh > 198.96.85.163.26087: Flags [P.], seq 33352:33516, ack 1, win 313, length 164
20:25:56.708595 IP lamp-s-1vcpu-1gb-nyc1-01.ssh > 198.96.85.163.26087: Flags [P.], seq 33516:33680, ack 1, win 313, length 164
20:25:56.708733 IP lamp-s-1vcpu-1gb-nyc1-01.ssh > 198.96.85.163.26087: Flags [P.], seq 33680:33844, ack 1, win 313, length 164
20:25:56.708840 IP lamp-s-1vcpu-1gb-nyc1-01.ssh > 198.96.85.163.26087: Flags [P.], seq 33844:34008, ack 1, win 313, length 164
20:25:56.708950 IP lamp-s-1vcpu-1gb-nyc1-01.ssh > 198.96.85.163.26087: Flags [P.], seq 34008:34172, ack 1, win 313, length 164
20:25:56.709048 IP lamp-s-1vcpu-1gb-nyc1-01.ssh > 198.96.85.163.26087: Flags [P.], seq 34172:34336, ack 1, win 313, length 164
20:25:56.709191 IP lamp-s-1vcpu-1gb-nyc1-01.ssh > 198.96.85.163.26087: Flags [P.], seq 34336:34500, ack 1, win 313, length 164
20:25:56.709294 IP lamp-s-1vcpu-1gb-nyc1-01.ssh > 198.96.85.163.26087: Flags [P.], seq 34500:34664, ack 1, win 313, length 164
20:25:56.709393 IP lamp-s-1vcpu-1gb-nyc1-01.ssh > 198.96.85.163.26087: Flags [P.], seq 34664:34828, ack 1, win 313, length 164
20:25:56.709516 IP lamp-s-1vcpu-1gb-nyc1-01.ssh > 198.96.85.163.26087: Flags [P.], seq 34828:34992, ack 1, win 313, length 164
20:25:56.709674 IP lamp-s-1vcpu-1gb-nyc1-01.ssh > 198.96.85.163.26087: Flags [P.], seq 34992:35156, ack 1, win 313, length 164
20:25:56.709812 IP lamp-s-1vcpu-1gb-nyc1-01.ssh > 198.96.85.163.26087: Flags [P.], seq 35156:35320, ack 1, win 313, length 164
20:25:56.709901 IP lamp-s-1vcpu-1gb-nyc1-01.ssh > 198.96.85.163.26087: Flags [P.], seq 35320:35484, ack 1, win 313, length 164
20:25:56.709977 IP lamp-s-1vcpu-1gb-nyc1-01.ssh > 198.96.85.163.26087: Flags [P.], seq 35484:35648, ack 1, win 313, length 164
20:25:56.710052 IP lamp-s-1vcpu-1gb-nyc1-01.ssh > 198.96.85.163.26087: Flags [P.], seq 35648:35812, ack 1, win 313, length 164
20:25:56.710126 IP lamp-s-1vcpu-1gb-nyc1-01.ssh > 198.96.85.163.26087: Flags [P.], seq 35812:35976, ack 1, win 313, length 164
20:25:56.710201 IP lamp-s-1vcpu-1gb-nyc1-01.ssh > 198.96.85.163.26087: Flags [P.], seq 35976:36140, ack 1, win 313, length 164
20:25:56.710308 IP lamp-s-1vcpu-1gb-nyc1-01.ssh > 198.96.85.163.26087: Flags [P.], seq 36140:36304, ack 1, win 313, length 164
20:25:56.710385 IP lamp-s-1vcpu-1gb-nyc1-01.ssh > 198.96.85.163.26087: Flags [P.], seq 36304:36468, ack 1, win 313, length 164
20:25:56.710460 IP lamp-s-1vcpu-1gb-nyc1-01.ssh > 198.96.85.163.26087: Flags [P.], seq 36468:36632, ack 1, win 313, length 164
20:25:56.710533 IP lamp-s-1vcpu-1gb-nyc1-01.ssh > 198.96.85.163.26087: Flags [P.], seq 36632:36796, ack 1, win 313, length 164
20:25:56.710605 IP lamp-s-1vcpu-1gb-nyc1-01.ssh > 198.96.85.163.26087: Flags [P.], seq 36796:36960, ack 1, win 313, length 164
20:25:56.710678 IP lamp-s-1vcpu-1gb-nyc1-01.ssh > 198.96.85.163.26087: Flags [P.], seq 36960:37124, ack 1, win 313, length 164
20:25:56.710752 IP lamp-s-1vcpu-1gb-nyc1-01.ssh > 198.96.85.163.26087: Flags [P.], seq 37124:37288, ack 1, win 313, length 164
20:25:56.710829 IP lamp-s-1vcpu-1gb-nyc1-01.ssh > 198.96.85.163.26087: Flags [P.], seq 37288:37452, ack 1, win 313, length 164
20:25:56.710905 IP lamp-s-1vcpu-1gb-nyc1-01.ssh > 198.96.85.163.26087: Flags [P.], seq 37452:37616, ack 1, win 313, length 164
20:25:56.710979 IP lamp-s-1vcpu-1gb-nyc1-01.ssh > 198.96.85.163.26087: Flags [P.], seq 37616:37780, ack 1, win 313, length 164
20:25:56.711052 IP lamp-s-1vcpu-1gb-nyc1-01.ssh > 198.96.85.163.26087: Flags [P.], seq 37780:37944, ack 1, win 313, length 164
20:25:56.711124 IP lamp-s-1vcpu-1gb-nyc1-01.ssh > 198.96.85.163.26087: Flags [P.], seq 37944:38108, ack 1, win 313, length 164
20:25:56.711208 IP lamp-s-1vcpu-1gb-nyc1-01.ssh > 198.96.85.163.26087: Flags [P.], seq 38108:38272, ack 1, win 313, length 164
20:25:56.711314 IP lamp-s-1vcpu-1gb-nyc1-01.ssh > 198.96.85.163.26087: Flags [P.], seq 38272:38436, ack 1, win 313, length 164
20:25:56.711465 IP lamp-s-1vcpu-1gb-nyc1-01.ssh > 198.96.85.163.26087: Flags [P.], seq 38436:38600, ack 1, win 313, length 164
20:25:56.711550 IP lamp-s-1vcpu-1gb-nyc1-01.ssh > 198.96.85.163.26087: Flags [P.], seq 38600:38764, ack 1, win 313, length 164
20:25:56.711676 IP lamp-s-1vcpu-1gb-nyc1-01.ssh > 198.96.85.163.26087: Flags [P.], seq 38764:38928, ack 1, win 313, length 164
20:25:56.711802 IP lamp-s-1vcpu-1gb-nyc1-01.ssh > 198.96.85.163.26087: Flags [P.], seq 38928:39092, ack 1, win 313, length 164
20:25:56.711886 IP lamp-s-1vcpu-1gb-nyc1-01.ssh > 198.96.85.163.26087: Flags [P.], seq 39092:39256, ack 1, win 313, length 164
20:25:56.711960 IP lamp-s-1vcpu-1gb-nyc1-01.ssh > 198.96.85.163.26087: Flags [P.], seq 39256:39420, ack 1, win 313, length 164
20:25:56.712034 IP lamp-s-1vcpu-1gb-nyc1-01.ssh > 198.96.85.163.26087: Flags [P.], seq 39420:39584, ack 1, win 313, length 164
20:25:56.712107 IP lamp-s-1vcpu-1gb-nyc1-01.ssh > 198.96.85.163.26087: Flags [P.], seq 39584:39748, ack 1, win 313, length 164
20:25:56.712235 IP lamp-s-1vcpu-1gb-nyc1-01.ssh > 198.96.85.163.26087: Flags [P.], seq 39748:39912, ack 1, win 313, length 164
20:25:56.712368 IP lamp-s-1vcpu-1gb-nyc1-01.ssh > 198.96.85.163.26087: Flags [P.], seq 39912:40076, ack 1, win 313, length 164
20:25:56.712494 IP lamp-s-1vcpu-1gb-nyc1-01.ssh > 198.96.85.163.26087: Flags [P.], seq 40076:40240, ack 1, win 313, length 164
20:25:56.712619 IP lamp-s-1vcpu-1gb-nyc1-01.ssh > 198.96.85.163.26087: Flags [P.], seq 40240:40404, ack 1, win 313, length 164
20:25:56.712725 IP lamp-s-1vcpu-1gb-nyc1-01.ssh > 198.96.85.163.26087: Flags [P.], seq 40404:40568, ack 1, win 313, length 164
20:25:56.712808 IP lamp-s-1vcpu-1gb-nyc1-01.ssh > 198.96.85.163.26087: Flags [P.], seq 40568:40732, ack 1, win 313, length 164
20:25:56.712883 IP lamp-s-1vcpu-1gb-nyc1-01.ssh > 198.96.85.163.26087: Flags [P.], seq 40732:40896, ack 1, win 313, length 164
20:25:56.712956 IP lamp-s-1vcpu-1gb-nyc1-01.ssh > 198.96.85.163.26087: Flags [P.], seq 40896:41060, ack 1, win 313, length 164
20:25:56.713030 IP lamp-s-1vcpu-1gb-nyc1-01.ssh > 198.96.85.163.26087: Flags [P.], seq 41060:41224, ack 1, win 313, length 164
20:25:56.713139 IP lamp-s-1vcpu-1gb-nyc1-01.ssh > 198.96.85.163.26087: Flags [P.], seq 41224:41388, ack 1, win 313, length 164
20:25:56.713239 IP lamp-s-1vcpu-1gb-nyc1-01.ssh > 198.96.85.163.26087: Flags [P.], seq 41388:41552, ack 1, win 313, length 164
20:25:56.713339 IP lamp-s-1vcpu-1gb-nyc1-01.ssh > 198.96.85.163.26087: Flags [P.], seq 41552:41716, ack 1, win 313, length 164
20:25:56.713419 IP lamp-s-1vcpu-1gb-nyc1-01.ssh > 198.96.85.163.26087: Flags [P.], seq 41716:41880, ack 1, win 313, length 164
20:25:56.713519 IP lamp-s-1vcpu-1gb-nyc1-01.ssh > 198.96.85.163.26087: Flags [P.], seq 41880:42044, ack 1, win 313, length 164
20:25:56.713619 IP lamp-s-1vcpu-1gb-nyc1-01.ssh > 198.96.85.163.26087: Flags [P.], seq 42044:42208, ack 1, win 313, length 164
20:25:56.713697 IP lamp-s-1vcpu-1gb-nyc1-01.ssh > 198.96.85.163.26087: Flags [P.], seq 42208:42372, ack 1, win 313, length 164
20:25:56.713774 IP lamp-s-1vcpu-1gb-nyc1-01.ssh > 198.96.85.163.26087: Flags [P.], seq 42372:42536, ack 1, win 313, length 164
20:25:56.713860 IP lamp-s-1vcpu-1gb-nyc1-01.ssh > 198.96.85.163.26087: Flags [P.], seq 42536:42700, ack 1, win 313, length 164
20:25:56.713957 IP lamp-s-1vcpu-1gb-nyc1-01.ssh > 198.96.85.163.26087: Flags [P.], seq 42700:42864, ack 1, win 313, length 164
20:25:56.714042 IP lamp-s-1vcpu-1gb-nyc1-01.ssh > 198.96.85.163.26087: Flags [P.], seq 42864:43028, ack 1, win 313, length 164
20:25:56.714130 IP lamp-s-1vcpu-1gb-nyc1-01.ssh > 198.96.85.163.26087: Flags [P.], seq 43028:43192, ack 1, win 313, length 164
20:25:56.714243 IP lamp-s-1vcpu-1gb-nyc1-01.ssh > 198.96.85.163.26087: Flags [P.], seq 43192:43356, ack 1, win 313, length 164
20:25:56.714348 IP lamp-s-1vcpu-1gb-nyc1-01.ssh > 198.96.85.163.26087: Flags [P.], seq 43356:43520, ack 1, win 313, length 164
20:25:56.714471 IP lamp-s-1vcpu-1gb-nyc1-01.ssh > 198.96.85.163.26087: Flags [P.], seq 43520:43684, ack 1, win 313, length 164
20:25:56.714597 IP lamp-s-1vcpu-1gb-nyc1-01.ssh > 198.96.85.163.26087: Flags [P.], seq 43684:43848, ack 1, win 313, length 164
20:25:56.714711 IP lamp-s-1vcpu-1gb-nyc1-01.ssh > 198.96.85.163.26087: Flags [P.], seq 43848:44012, ack 1, win 313, length 164
20:25:56.714793 IP lamp-s-1vcpu-1gb-nyc1-01.ssh > 198.96.85.163.26087: Flags [P.], seq 44012:44176, ack 1, win 313, length 164
20:25:56.714870 IP lamp-s-1vcpu-1gb-nyc1-01.ssh > 198.96.85.163.26087: Flags [P.], seq 44176:44340, ack 1, win 313, length 164
20:25:56.714951 IP lamp-s-1vcpu-1gb-nyc1-01.ssh > 198.96.85.163.26087: Flags [P.], seq 44340:44504, ack 1, win 313, length 164
20:25:56.715054 IP lamp-s-1vcpu-1gb-nyc1-01.ssh > 198.96.85.163.26087: Flags [P.], seq 44504:44668, ack 1, win 313, length 164
20:25:56.715132 IP lamp-s-1vcpu-1gb-nyc1-01.ssh > 198.96.85.163.26087: Flags [P.], seq 44668:44832, ack 1, win 313, length 164
20:25:56.715275 IP lamp-s-1vcpu-1gb-nyc1-01.ssh > 198.96.85.163.26087: Flags [P.], seq 44832:44996, ack 1, win 313, length 164
20:25:56.715394 IP lamp-s-1vcpu-1gb-nyc1-01.ssh > 198.96.85.163.26087: Flags [P.], seq 44996:45160, ack 1, win 313, length 164
20:25:56.715518 IP lamp-s-1vcpu-1gb-nyc1-01.ssh > 198.96.85.163.26087: Flags [P.], seq 45160:45324, ack 1, win 313, length 164
20:25:56.715653 IP lamp-s-1vcpu-1gb-nyc1-01.ssh > 198.96.85.163.26087: Flags [P.], seq 45324:45488, ack 1, win 313, length 164
20:25:56.715749 IP lamp-s-1vcpu-1gb-nyc1-01.ssh > 198.96.85.163.26087: Flags [P.], seq 45488:45652, ack 1, win 313, length 164
20:25:56.715828 IP lamp-s-1vcpu-1gb-nyc1-01.ssh > 198.96.85.163.26087: Flags [P.], seq 45652:45816, ack 1, win 313, length 164
20:25:56.715948 IP lamp-s-1vcpu-1gb-nyc1-01.ssh > 198.96.85.163.26087: Flags [P.], seq 45816:45980, ack 1, win 313, length 164
20:25:56.716078 IP lamp-s-1vcpu-1gb-nyc1-01.ssh > 198.96.85.163.26087: Flags [P.], seq 45980:46144, ack 1, win 313, length 164
20:25:56.716170 IP lamp-s-1vcpu-1gb-nyc1-01.ssh > 198.96.85.163.26087: Flags [P.], seq 46144:46308, ack 1, win 313, length 164
20:25:56.716247 IP lamp-s-1vcpu-1gb-nyc1-01.ssh > 198.96.85.163.26087: Flags [P.], seq 46308:46472, ack 1, win 313, length 164
20:25:56.716326 IP lamp-s-1vcpu-1gb-nyc1-01.ssh > 198.96.85.163.26087: Flags [P.], seq 46472:46636, ack 1, win 313, length 164
20:25:56.716428 IP lamp-s-1vcpu-1gb-nyc1-01.ssh > 198.96.85.163.26087: Flags [P.], seq 46636:46800, ack 1, win 313, length 164
20:25:56.716571 IP lamp-s-1vcpu-1gb-nyc1-01.ssh > 198.96.85.163.26087: Flags [P.], seq 46800:46964, ack 1, win 313, length 164
20:25:56.716662 IP lamp-s-1vcpu-1gb-nyc1-01.ssh > 198.96.85.163.26087: Flags [P.], seq 46964:47128, ack 1, win 313, length 164
20:25:56.716743 IP lamp-s-1vcpu-1gb-nyc1-01.ssh > 198.96.85.163.26087: Flags [P.], seq 47128:47292, ack 1, win 313, length 164
20:25:56.716820 IP lamp-s-1vcpu-1gb-nyc1-01.ssh > 198.96.85.163.26087: Flags [P.], seq 47292:47456, ack 1, win 313, length 164
20:25:56.716895 IP lamp-s-1vcpu-1gb-nyc1-01.ssh > 198.96.85.163.26087: Flags [P.], seq 47456:47620, ack 1, win 313, length 164
20:25:56.716969 IP lamp-s-1vcpu-1gb-nyc1-01.ssh > 198.96.85.163.26087: Flags [P.], seq 47620:47784, ack 1, win 313, length 164
20:25:56.717128 IP lamp-s-1vcpu-1gb-nyc1-01.ssh > 198.96.85.163.26087: Flags [P.], seq 47784:47948, ack 1, win 313, length 164
20:25:56.717260 IP lamp-s-1vcpu-1gb-nyc1-01.ssh > 198.96.85.163.26087: Flags [P.], seq 47948:48112, ack 1, win 313, length 164
20:25:56.717355 IP lamp-s-1vcpu-1gb-nyc1-01.ssh > 198.96.85.163.26087: Flags [P.], seq 48112:48276, ack 1, win 313, length 164
20:25:56.717434 IP lamp-s-1vcpu-1gb-nyc1-01.ssh > 198.96.85.163.26087: Flags [P.], seq 48276:48440, ack 1, win 313, length 164
20:25:56.717537 IP lamp-s-1vcpu-1gb-nyc1-01.ssh > 198.96.85.163.26087: Flags [P.], seq 48440:48604, ack 1, win 313, length 164
20:25:56.717667 IP lamp-s-1vcpu-1gb-nyc1-01.ssh > 198.96.85.163.26087: Flags [P.], seq 48604:48768, ack 1, win 313, length 164
20:25:56.717751 IP lamp-s-1vcpu-1gb-nyc1-01.ssh > 198.96.85.163.26087: Flags [P.], seq 48768:48932, ack 1, win 313, length 164
20:25:56.717827 IP lamp-s-1vcpu-1gb-nyc1-01.ssh > 198.96.85.163.26087: Flags [P.], seq 48932:49096, ack 1, win 313, length 164
20:25:56.717893 IP lamp-s-1vcpu-1gb-nyc1-01.ssh > 198.96.85.163.26087: Flags [P.], seq 49096:49260, ack 1, win 313, length 164
20:25:56.718004 IP lamp-s-1vcpu-1gb-nyc1-01.ssh > 198.96.85.163.26087: Flags [P.], seq 49260:49424, ack 1, win 313, length 164
20:25:56.718124 IP lamp-s-1vcpu-1gb-nyc1-01.ssh > 198.96.85.163.26087: Flags [P.], seq 49424:49588, ack 1, win 313, length 164
20:25:56.718239 IP lamp-s-1vcpu-1gb-nyc1-01.ssh > 198.96.85.163.26087: Flags [P.], seq 49588:49752, ack 1, win 313, length 164
20:25:56.718371 IP lamp-s-1vcpu-1gb-nyc1-01.ssh > 198.96.85.163.26087: Flags [P.], seq 49752:49916, ack 1, win 313, length 164
20:25:56.718468 IP lamp-s-1vcpu-1gb-nyc1-01.ssh > 198.96.85.163.26087: Flags [P.], seq 49916:50080, ack 1, win 313, length 164
20:25:56.718545 IP lamp-s-1vcpu-1gb-nyc1-01.ssh > 198.96.85.163.26087: Flags [P.], seq 50080:50244, ack 1, win 313, length 164
20:25:56.718621 IP lamp-s-1vcpu-1gb-nyc1-01.ssh > 198.96.85.163.26087: Flags [P.], seq 50244:50408, ack 1, win 313, length 164
20:25:56.718764 IP lamp-s-1vcpu-1gb-nyc1-01.ssh > 198.96.85.163.26087: Flags [P.], seq 50408:50572, ack 1, win 313, length 164
20:25:56.718863 IP lamp-s-1vcpu-1gb-nyc1-01.ssh > 198.96.85.163.26087: Flags [P.], seq 50572:50736, ack 1, win 313, length 164
20:25:56.718963 IP lamp-s-1vcpu-1gb-nyc1-01.ssh > 198.96.85.163.26087: Flags [P.], seq 50736:50900, ack 1, win 313, length 164
20:25:56.719074 IP lamp-s-1vcpu-1gb-nyc1-01.ssh > 198.96.85.163.26087: Flags [P.], seq 50900:51064, ack 1, win 313, length 164
20:25:56.719221 IP lamp-s-1vcpu-1gb-nyc1-01.ssh > 198.96.85.163.26087: Flags [P.], seq 51064:51228, ack 1, win 313, length 164
20:25:56.719309 IP lamp-s-1vcpu-1gb-nyc1-01.ssh > 198.96.85.163.26087: Flags [P.], seq 51228:51392, ack 1, win 313, length 164
20:25:56.719405 IP lamp-s-1vcpu-1gb-nyc1-01.ssh > 198.96.85.163.26087: Flags [P.], seq 51392:51556, ack 1, win 313, length 164
20:25:56.719495 IP lamp-s-1vcpu-1gb-nyc1-01.ssh > 198.96.85.163.26087: Flags [P.], seq 51556:51720, ack 1, win 313, length 164
20:25:56.719575 IP lamp-s-1vcpu-1gb-nyc1-01.ssh > 198.96.85.163.26087: Flags [P.], seq 51720:51884, ack 1, win 313, length 164
20:25:56.719653 IP lamp-s-1vcpu-1gb-nyc1-01.ssh > 198.96.85.163.26087: Flags [P.], seq 51884:52048, ack 1, win 313, length 164
20:25:56.719731 IP lamp-s-1vcpu-1gb-nyc1-01.ssh > 198.96.85.163.26087: Flags [P.], seq 52048:52212, ack 1, win 313, length 164
20:25:56.719806 IP lamp-s-1vcpu-1gb-nyc1-01.ssh > 198.96.85.163.26087: Flags [P.], seq 52212:52376, ack 1, win 313, length 164
20:25:56.719901 IP lamp-s-1vcpu-1gb-nyc1-01.ssh > 198.96.85.163.26087: Flags [P.], seq 52376:52540, ack 1, win 313, length 164
20:25:56.723456 IP 198.96.85.163.26087 > lamp-s-1vcpu-1gb-nyc1-01.ssh: Flags [.], ack 27940, win 2051, length 0
20:25:56.723516 IP lamp-s-1vcpu-1gb-nyc1-01.ssh > 198.96.85.163.26087: Flags [P.], seq 52540:52704, ack 1, win 313, length 164
20:25:56.723683 IP lamp-s-1vcpu-1gb-nyc1-01.ssh > 198.96.85.163.26087: Flags [P.], seq 52704:52980, ack 1, win 313, length 276
20:25:56.723766 IP lamp-s-1vcpu-1gb-nyc1-01.ssh > 198.96.85.163.26087: Flags [P.], seq 52980:53144, ack 1, win 313, length 164
20:25:56.723865 IP lamp-s-1vcpu-1gb-nyc1-01.ssh > 198.96.85.163.26087: Flags [P.], seq 53144:53308, ack 1, win 313, length 164
20:25:56.723944 IP lamp-s-1vcpu-1gb-nyc1-01.ssh > 198.96.85.163.26087: Flags [P.], seq 53308:53472, ack 1, win 313, length 164
20:25:56.724018 IP lamp-s-1vcpu-1gb-nyc1-01.ssh > 198.96.85.163.26087: Flags [P.], seq 53472:53636, ack 1, win 313, length 164
20:25:56.724094 IP lamp-s-1vcpu-1gb-nyc1-01.ssh > 198.96.85.163.26087: Flags [P.], seq 53636:53800, ack 1, win 313, length 164
20:25:56.724230 IP lamp-s-1vcpu-1gb-nyc1-01.ssh > 198.96.85.163.26087: Flags [P.], seq 53800:53964, ack 1, win 313, length 164
20:25:56.724363 IP lamp-s-1vcpu-1gb-nyc1-01.ssh > 198.96.85.163.26087: Flags [P.], seq 53964:54128, ack 1, win 313, length 164
20:25:56.724452 IP lamp-s-1vcpu-1gb-nyc1-01.ssh > 198.96.85.163.26087: Flags [P.], seq 54128:54292, ack 1, win 313, length 164
20:25:56.724551 IP lamp-s-1vcpu-1gb-nyc1-01.ssh > 198.96.85.163.26087: Flags [P.], seq 54292:54456, ack 1, win 313, length 164
20:25:56.724641 IP lamp-s-1vcpu-1gb-nyc1-01.ssh > 198.96.85.163.26087: Flags [P.], seq 54456:54620, ack 1, win 313, length 164
20:25:56.724717 IP lamp-s-1vcpu-1gb-nyc1-01.ssh > 198.96.85.163.26087: Flags [P.], seq 54620:54784, ack 1, win 313, length 164
20:25:56.724796 IP lamp-s-1vcpu-1gb-nyc1-01.ssh > 198.96.85.163.26087: Flags [P.], seq 54784:54948, ack 1, win 313, length 164
20:25:56.724874 IP lamp-s-1vcpu-1gb-nyc1-01.ssh > 198.96.85.163.26087: Flags [P.], seq 54948:55112, ack 1, win 313, length 164
20:25:56.724954 IP lamp-s-1vcpu-1gb-nyc1-01.ssh > 198.96.85.163.26087: Flags [P.], seq 55112:55276, ack 1, win 313, length 164
20:25:56.725032 IP lamp-s-1vcpu-1gb-nyc1-01.ssh > 198.96.85.163.26087: Flags [P.], seq 55276:55440, ack 1, win 313, length 164
20:25:56.725165 IP lamp-s-1vcpu-1gb-nyc1-01.ssh > 198.96.85.163.26087: Flags [P.], seq 55440:55604, ack 1, win 313, length 164
20:25:56.725279 IP lamp-s-1vcpu-1gb-nyc1-01.ssh > 198.96.85.163.26087: Flags [P.], seq 55604:55768, ack 1, win 313, length 164
20:25:56.725360 IP lamp-s-1vcpu-1gb-nyc1-01.ssh > 198.96.85.163.26087: Flags [P.], seq 55768:55932, ack 1, win 313, length 164
20:25:56.726824 IP 198.96.85.163.26087 > lamp-s-1vcpu-1gb-nyc1-01.ssh: Flags [.], ack 32040, win 2051, length 0
20:25:56.726878 IP lamp-s-1vcpu-1gb-nyc1-01.ssh > 198.96.85.163.26087: Flags [P.], seq 55932:56096, ack 1, win 313, length 164
20:25:56.727040 IP lamp-s-1vcpu-1gb-nyc1-01.ssh > 198.96.85.163.26087: Flags [P.], seq 56096:56372, ack 1, win 313, length 276
20:25:56.727133 IP lamp-s-1vcpu-1gb-nyc1-01.ssh > 198.96.85.163.26087: Flags [P.], seq 56372:56536, ack 1, win 313, length 164
20:25:56.727215 IP lamp-s-1vcpu-1gb-nyc1-01.ssh > 198.96.85.163.26087: Flags [P.], seq 56536:56700, ack 1, win 313, length 164
20:25:56.727293 IP lamp-s-1vcpu-1gb-nyc1-01.ssh > 198.96.85.163.26087: Flags [P.], seq 56700:56864, ack 1, win 313, length 164
20:25:56.727386 IP lamp-s-1vcpu-1gb-nyc1-01.ssh > 198.96.85.163.26087: Flags [P.], seq 56864:57028, ack 1, win 313, length 164
20:25:56.727493 IP lamp-s-1vcpu-1gb-nyc1-01.ssh > 198.96.85.163.26087: Flags [P.], seq 57028:57192, ack 1, win 313, length 164
20:25:56.727574 IP lamp-s-1vcpu-1gb-nyc1-01.ssh > 198.96.85.163.26087: Flags [P.], seq 57192:57356, ack 1, win 313, length 164
20:25:56.727650 IP lamp-s-1vcpu-1gb-nyc1-01.ssh > 198.96.85.163.26087: Flags [P.], seq 57356:57520, ack 1, win 313, length 164
20:25:56.727725 IP lamp-s-1vcpu-1gb-nyc1-01.ssh > 198.96.85.163.26087: Flags [P.], seq 57520:57684, ack 1, win 313, length 164
20:25:56.727814 IP lamp-s-1vcpu-1gb-nyc1-01.ssh > 198.96.85.163.26087: Flags [P.], seq 57684:57848, ack 1, win 313, length 164
20:25:56.727889 IP lamp-s-1vcpu-1gb-nyc1-01.ssh > 198.96.85.163.26087: Flags [P.], seq 57848:58012, ack 1, win 313, length 164
20:25:56.727963 IP lamp-s-1vcpu-1gb-nyc1-01.ssh > 198.96.85.163.26087: Flags [P.], seq 58012:58176, ack 1, win 313, length 164
20:25:56.728039 IP lamp-s-1vcpu-1gb-nyc1-01.ssh > 198.96.85.163.26087: Flags [P.], seq 58176:58340, ack 1, win 313, length 164
20:25:56.728116 IP lamp-s-1vcpu-1gb-nyc1-01.ssh > 198.96.85.163.26087: Flags [P.], seq 58340:58504, ack 1, win 313, length 164
20:25:56.728218 IP lamp-s-1vcpu-1gb-nyc1-01.ssh > 198.96.85.163.26087: Flags [P.], seq 58504:58668, ack 1, win 313, length 164
20:25:56.728323 IP lamp-s-1vcpu-1gb-nyc1-01.ssh > 198.96.85.163.26087: Flags [P.], seq 58668:58832, ack 1, win 313, length 164
20:25:56.728430 IP 198.96.85.163.26087 > lamp-s-1vcpu-1gb-nyc1-01.ssh: Flags [.], ack 34336, win 2051, length 0
20:25:56.728559 IP lamp-s-1vcpu-1gb-nyc1-01.ssh > 198.96.85.163.26087: Flags [P.], seq 58832:59108, ack 1, win 313, length 276
20:25:56.728635 IP 198.96.85.163.26087 > lamp-s-1vcpu-1gb-nyc1-01.ssh: Flags [.], ack 34992, win 2049, length 0
20:25:56.728718 IP lamp-s-1vcpu-1gb-nyc1-01.ssh > 198.96.85.163.26087: Flags [P.], seq 59108:59384, ack 1, win 313, length 276
20:25:56.728815 IP lamp-s-1vcpu-1gb-nyc1-01.ssh > 198.96.85.163.26087: Flags [P.], seq 59384:59548, ack 1, win 313, length 164
20:25:56.728900 IP lamp-s-1vcpu-1gb-nyc1-01.ssh > 198.96.85.163.26087: Flags [P.], seq 59548:59712, ack 1, win 313, length 164
20:25:56.728976 IP lamp-s-1vcpu-1gb-nyc1-01.ssh > 198.96.85.163.26087: Flags [P.], seq 59712:59876, ack 1, win 313, length 164
20:25:56.729052 IP lamp-s-1vcpu-1gb-nyc1-01.ssh > 198.96.85.163.26087: Flags [P.], seq 59876:60040, ack 1, win 313, length 164
20:25:56.729168 IP lamp-s-1vcpu-1gb-nyc1-01.ssh > 198.96.85.163.26087: Flags [P.], seq 60040:60204, ack 1, win 313, length 164
20:25:56.729279 IP lamp-s-1vcpu-1gb-nyc1-01.ssh > 198.96.85.163.26087: Flags [P.], seq 60204:60368, ack 1, win 313, length 164
20:25:56.729412 IP lamp-s-1vcpu-1gb-nyc1-01.ssh > 198.96.85.163.26087: Flags [P.], seq 60368:60532, ack 1, win 313, length 164
20:25:56.729499 IP lamp-s-1vcpu-1gb-nyc1-01.ssh > 198.96.85.163.26087: Flags [P.], seq 60532:60696, ack 1, win 313, length 164
20:25:56.729611 IP lamp-s-1vcpu-1gb-nyc1-01.ssh > 198.96.85.163.26087: Flags [P.], seq 60696:60860, ack 1, win 313, length 164
20:25:56.729708 IP lamp-s-1vcpu-1gb-nyc1-01.ssh > 198.96.85.163.26087: Flags [P.], seq 60860:61024, ack 1, win 313, length 164
20:25:56.729798 IP lamp-s-1vcpu-1gb-nyc1-01.ssh > 198.96.85.163.26087: Flags [P.], seq 61024:61188, ack 1, win 313, length 164
20:25:56.729884 IP lamp-s-1vcpu-1gb-nyc1-01.ssh > 198.96.85.163.26087: Flags [P.], seq 61188:61352, ack 1, win 313, length 164
20:25:56.729979 IP lamp-s-1vcpu-1gb-nyc1-01.ssh > 198.96.85.163.26087: Flags [P.], seq 61352:61516, ack 1, win 313, length 164
20:25:56.730061 IP lamp-s-1vcpu-1gb-nyc1-01.ssh > 198.96.85.163.26087: Flags [P.], seq 61516:61680, ack 1, win 313, length 164
20:25:56.730142 IP lamp-s-1vcpu-1gb-nyc1-01.ssh > 198.96.85.163.26087: Flags [P.], seq 61680:61844, ack 1, win 313, length 164
20:25:56.730242 IP lamp-s-1vcpu-1gb-nyc1-01.ssh > 198.96.85.163.26087: Flags [P.], seq 61844:62008, ack 1, win 313, length 164
20:25:56.730323 IP lamp-s-1vcpu-1gb-nyc1-01.ssh > 198.96.85.163.26087: Flags [P.], seq 62008:62172, ack 1, win 313, length 164
20:25:56.730416 IP lamp-s-1vcpu-1gb-nyc1-01.ssh > 198.96.85.163.26087: Flags [P.], seq 62172:62336, ack 1, win 313, length 164
20:25:56.730498 IP lamp-s-1vcpu-1gb-nyc1-01.ssh > 198.96.85.163.26087: Flags [P.], seq 62336:62500, ack 1, win 313, length 164
20:25:56.730590 IP lamp-s-1vcpu-1gb-nyc1-01.ssh > 198.96.85.163.26087: Flags [P.], seq 62500:62664, ack 1, win 313, length 164
20:25:56.730670 IP lamp-s-1vcpu-1gb-nyc1-01.ssh > 198.96.85.163.26087: Flags [P.], seq 62664:62828, ack 1, win 313, length 164
20:25:56.730746 IP lamp-s-1vcpu-1gb-nyc1-01.ssh > 198.96.85.163.26087: Flags [P.], seq 62828:62992, ack 1, win 313, length 164
20:25:56.730820 IP lamp-s-1vcpu-1gb-nyc1-01.ssh > 198.96.85.163.26087: Flags [P.], seq 62992:63156, ack 1, win 313, length 164
20:25:56.730893 IP lamp-s-1vcpu-1gb-nyc1-01.ssh > 198.96.85.163.26087: Flags [P.], seq 63156:63320, ack 1, win 313, length 164
20:25:56.730971 IP lamp-s-1vcpu-1gb-nyc1-01.ssh > 198.96.85.163.26087: Flags [P.], seq 63320:63484, ack 1, win 313, length 164
20:25:56.731078 IP lamp-s-1vcpu-1gb-nyc1-01.ssh > 198.96.85.163.26087: Flags [P.], seq 63484:63648, ack 1, win 313, length 164
20:25:56.731213 IP lamp-s-1vcpu-1gb-nyc1-01.ssh > 198.96.85.163.26087: Flags [P.], seq 63648:63812, ack 1, win 313, length 164
20:25:56.731316 IP lamp-s-1vcpu-1gb-nyc1-01.ssh > 198.96.85.163.26087: Flags [P.], seq 63812:63976, ack 1, win 313, length 164
20:25:56.731401 IP lamp-s-1vcpu-1gb-nyc1-01.ssh > 198.96.85.163.26087: Flags [P.], seq 63976:64140, ack 1, win 313, length 164
20:25:56.731476 IP lamp-s-1vcpu-1gb-nyc1-01.ssh > 198.96.85.163.26087: Flags [P.], seq 64140:64304, ack 1, win 313, length 164
20:25:56.731578 IP lamp-s-1vcpu-1gb-nyc1-01.ssh > 198.96.85.163.26087: Flags [P.], seq 64304:64468, ack 1, win 313, length 164
20:25:56.731673 IP lamp-s-1vcpu-1gb-nyc1-01.ssh > 198.96.85.163.26087: Flags [P.], seq 64468:64632, ack 1, win 313, length 164
20:25:56.731760 IP lamp-s-1vcpu-1gb-nyc1-01.ssh > 198.96.85.163.26087: Flags [P.], seq 64632:64796, ack 1, win 313, length 164
20:25:56.731847 IP lamp-s-1vcpu-1gb-nyc1-01.ssh > 198.96.85.163.26087: Flags [P.], seq 64796:64960, ack 1, win 313, length 164
20:25:56.731952 IP lamp-s-1vcpu-1gb-nyc1-01.ssh > 198.96.85.163.26087: Flags [P.], seq 64960:65124, ack 1, win 313, length 164
20:25:56.732094 IP lamp-s-1vcpu-1gb-nyc1-01.ssh > 198.96.85.163.26087: Flags [P.], seq 65124:65288, ack 1, win 313, length 164
20:25:56.732219 IP lamp-s-1vcpu-1gb-nyc1-01.ssh > 198.96.85.163.26087: Flags [P.], seq 65288:65452, ack 1, win 313, length 164
20:25:56.732332 IP lamp-s-1vcpu-1gb-nyc1-01.ssh > 198.96.85.163.26087: Flags [P.], seq 65452:65616, ack 1, win 313, length 164
20:25:56.732421 IP lamp-s-1vcpu-1gb-nyc1-01.ssh > 198.96.85.163.26087: Flags [P.], seq 65616:65780, ack 1, win 313, length 164
20:25:56.732499 IP lamp-s-1vcpu-1gb-nyc1-01.ssh > 198.96.85.163.26087: Flags [P.], seq 65780:65944, ack 1, win 313, length 164
20:25:56.732614 IP lamp-s-1vcpu-1gb-nyc1-01.ssh > 198.96.85.163.26087: Flags [P.], seq 65944:66108, ack 1, win 313, length 164
20:25:56.732744 IP lamp-s-1vcpu-1gb-nyc1-01.ssh > 198.96.85.163.26087: Flags [P.], seq 66108:66272, ack 1, win 313, length 164
20:25:56.732858 IP lamp-s-1vcpu-1gb-nyc1-01.ssh > 198.96.85.163.26087: Flags [P.], seq 66272:66436, ack 1, win 313, length 164
20:25:56.732948 IP lamp-s-1vcpu-1gb-nyc1-01.ssh > 198.96.85.163.26087: Flags [P.], seq 66436:66600, ack 1, win 313, length 164
20:25:56.733029 IP lamp-s-1vcpu-1gb-nyc1-01.ssh > 198.96.85.163.26087: Flags [P.], seq 66600:66764, ack 1, win 313, length 164
20:25:56.733200 IP lamp-s-1vcpu-1gb-nyc1-01.ssh > 198.96.85.163.26087: Flags [P.], seq 66764:66928, ack 1, win 313, length 164
20:25:56.733331 IP lamp-s-1vcpu-1gb-nyc1-01.ssh > 198.96.85.163.26087: Flags [P.], seq 66928:67092, ack 1, win 313, length 164
20:25:56.733416 IP lamp-s-1vcpu-1gb-nyc1-01.ssh > 198.96.85.163.26087: Flags [P.], seq 67092:67256, ack 1, win 313, length 164
20:25:56.733524 IP lamp-s-1vcpu-1gb-nyc1-01.ssh > 198.96.85.163.26087: Flags [P.], seq 67256:67420, ack 1, win 313, length 164
20:25:56.733656 IP lamp-s-1vcpu-1gb-nyc1-01.ssh > 198.96.85.163.26087: Flags [P.], seq 67420:67584, ack 1, win 313, length 164
20:25:56.733744 IP lamp-s-1vcpu-1gb-nyc1-01.ssh > 198.96.85.163.26087: Flags [P.], seq 67584:67748, ack 1, win 313, length 164
20:25:56.733821 IP lamp-s-1vcpu-1gb-nyc1-01.ssh > 198.96.85.163.26087: Flags [P.], seq 67748:67912, ack 1, win 313, length 164
20:25:56.733897 IP lamp-s-1vcpu-1gb-nyc1-01.ssh > 198.96.85.163.26087: Flags [P.], seq 67912:68076, ack 1, win 313, length 164
20:25:56.733973 IP lamp-s-1vcpu-1gb-nyc1-01.ssh > 198.96.85.163.26087: Flags [P.], seq 68076:68240, ack 1, win 313, length 164
20:25:56.734060 IP lamp-s-1vcpu-1gb-nyc1-01.ssh > 198.96.85.163.26087: Flags [P.], seq 68240:68404, ack 1, win 313, length 164
20:25:56.734202 IP lamp-s-1vcpu-1gb-nyc1-01.ssh > 198.96.85.163.26087: Flags [P.], seq 68404:68568, ack 1, win 313, length 164
20:25:56.734392 IP lamp-s-1vcpu-1gb-nyc1-01.ssh > 198.96.85.163.26087: Flags [P.], seq 68568:68732, ack 1, win 313, length 164
20:25:56.734517 IP lamp-s-1vcpu-1gb-nyc1-01.ssh > 198.96.85.163.26087: Flags [P.], seq 68732:68896, ack 1, win 313, length 164
20:25:56.734612 IP lamp-s-1vcpu-1gb-nyc1-01.ssh > 198.96.85.163.26087: Flags [P.], seq 68896:69060, ack 1, win 313, length 164
20:25:56.734715 IP lamp-s-1vcpu-1gb-nyc1-01.ssh > 198.96.85.163.26087: Flags [P.], seq 69060:69224, ack 1, win 313, length 164
20:25:56.734797 IP lamp-s-1vcpu-1gb-nyc1-01.ssh > 198.96.85.163.26087: Flags [P.], seq 69224:69388, ack 1, win 313, length 164
20:25:56.734898 IP lamp-s-1vcpu-1gb-nyc1-01.ssh > 198.96.85.163.26087: Flags [P.], seq 69388:69552, ack 1, win 313, length 164
20:25:56.735039 IP lamp-s-1vcpu-1gb-nyc1-01.ssh > 198.96.85.163.26087: Flags [P.], seq 69552:69716, ack 1, win 313, length 164
20:25:56.735199 IP lamp-s-1vcpu-1gb-nyc1-01.ssh > 198.96.85.163.26087: Flags [P.], seq 69716:69880, ack 1, win 313, length 164
20:25:56.735287 IP lamp-s-1vcpu-1gb-nyc1-01.ssh > 198.96.85.163.26087: Flags [P.], seq 69880:70044, ack 1, win 313, length 164
20:25:56.735368 IP lamp-s-1vcpu-1gb-nyc1-01.ssh > 198.96.85.163.26087: Flags [P.], seq 70044:70208, ack 1, win 313, length 164
20:25:56.735445 IP lamp-s-1vcpu-1gb-nyc1-01.ssh > 198.96.85.163.26087: Flags [P.], seq 70208:70372, ack 1, win 313, length 164
20:25:56.740127 IP 198.96.85.163.26087 > lamp-s-1vcpu-1gb-nyc1-01.ssh: Flags [.], ack 40240, win 2051, length 0
20:25:56.740213 IP lamp-s-1vcpu-1gb-nyc1-01.ssh > 198.96.85.163.26087: Flags [P.], seq 70372:70536, ack 1, win 313, length 164
20:25:56.740413 IP 198.96.85.163.26087 > lamp-s-1vcpu-1gb-nyc1-01.ssh: Flags [.], ack 43848, win 2051, length 0
20:25:56.740577 IP lamp-s-1vcpu-1gb-nyc1-01.ssh > 198.96.85.163.26087: Flags [P.], seq 70536:70924, ack 1, win 313, length 388
20:25:56.740698 IP lamp-s-1vcpu-1gb-nyc1-01.ssh > 198.96.85.163.26087: Flags [P.], seq 70924:71088, ack 1, win 313, length 164
20:25:56.740794 IP lamp-s-1vcpu-1gb-nyc1-01.ssh > 198.96.85.163.26087: Flags [P.], seq 71088:71252, ack 1, win 313, length 164
20:25:56.740892 IP lamp-s-1vcpu-1gb-nyc1-01.ssh > 198.96.85.163.26087: Flags [P.], seq 71252:71416, ack 1, win 313, length 164
20:25:56.741064 IP lamp-s-1vcpu-1gb-nyc1-01.ssh > 198.96.85.163.26087: Flags [P.], seq 71416:71580, ack 1, win 313, length 164
20:25:56.741198 IP 198.96.85.163.26087 > lamp-s-1vcpu-1gb-nyc1-01.ssh: Flags [.], ack 49096, win 2051, length 0
20:25:56.741324 IP lamp-s-1vcpu-1gb-nyc1-01.ssh > 198.96.85.163.26087: Flags [P.], seq 71580:71856, ack 1, win 313, length 276
20:25:56.741486 IP lamp-s-1vcpu-1gb-nyc1-01.ssh > 198.96.85.163.26087: Flags [P.], seq 71856:72020, ack 1, win 313, length 164
20:25:56.741623 IP lamp-s-1vcpu-1gb-nyc1-01.ssh > 198.96.85.163.26087: Flags [P.], seq 72020:72184, ack 1, win 313, length 164
20:25:56.741672 IP 198.96.85.163.26087 > lamp-s-1vcpu-1gb-nyc1-01.ssh: Flags [.], ack 52540, win 2051, length 0
20:25:56.741794 IP lamp-s-1vcpu-1gb-nyc1-01.ssh > 198.96.85.163.26087: Flags [P.], seq 72184:72460, ack 1, win 313, length 276
20:25:56.741907 IP lamp-s-1vcpu-1gb-nyc1-01.ssh > 198.96.85.163.26087: Flags [P.], seq 72460:72624, ack 1, win 313, length 164
20:25:56.742065 IP lamp-s-1vcpu-1gb-nyc1-01.ssh > 198.96.85.163.26087: Flags [P.], seq 72624:72788, ack 1, win 313, length 164
20:25:56.742180 IP lamp-s-1vcpu-1gb-nyc1-01.ssh > 198.96.85.163.26087: Flags [P.], seq 72788:72952, ack 1, win 313, length 164
20:25:56.742321 IP lamp-s-1vcpu-1gb-nyc1-01.ssh > 198.96.85.163.26087: Flags [P.], seq 72952:73116, ack 1, win 313, length 164
20:25:56.742478 IP lamp-s-1vcpu-1gb-nyc1-01.ssh > 198.96.85.163.26087: Flags [P.], seq 73116:73280, ack 1, win 313, length 164
20:25:56.742593 IP lamp-s-1vcpu-1gb-nyc1-01.ssh > 198.96.85.163.26087: Flags [P.], seq 73280:73444, ack 1, win 313, length 164
20:25:56.742683 IP lamp-s-1vcpu-1gb-nyc1-01.ssh > 198.96.85.163.26087: Flags [P.], seq 73444:73608, ack 1, win 313, length 164
20:25:56.742804 IP lamp-s-1vcpu-1gb-nyc1-01.ssh > 198.96.85.163.26087: Flags [P.], seq 73608:73772, ack 1, win 313, length 164
20:25:56.742914 IP lamp-s-1vcpu-1gb-nyc1-01.ssh > 198.96.85.163.26087: Flags [P.], seq 73772:73936, ack 1, win 313, length 164
20:25:56.743083 IP lamp-s-1vcpu-1gb-nyc1-01.ssh > 198.96.85.163.26087: Flags [P.], seq 73936:74100, ack 1, win 313, length 164
20:25:56.743185 IP lamp-s-1vcpu-1gb-nyc1-01.ssh > 198.96.85.163.26087: Flags [P.], seq 74100:74264, ack 1, win 313, length 164
20:25:56.743273 IP lamp-s-1vcpu-1gb-nyc1-01.ssh > 198.96.85.163.26087: Flags [P.], seq 74264:74428, ack 1, win 313, length 164
20:25:56.743397 IP lamp-s-1vcpu-1gb-nyc1-01.ssh > 198.96.85.163.26087: Flags [P.], seq 74428:74592, ack 1, win 313, length 164
20:25:56.743523 IP lamp-s-1vcpu-1gb-nyc1-01.ssh > 198.96.85.163.26087: Flags [P.], seq 74592:74756, ack 1, win 313, length 164
20:25:56.743618 IP lamp-s-1vcpu-1gb-nyc1-01.ssh > 198.96.85.163.26087: Flags [P.], seq 74756:74920, ack 1, win 313, length 164
20:25:56.743763 IP lamp-s-1vcpu-1gb-nyc1-01.ssh > 198.96.85.163.26087: Flags [P.], seq 74920:75084, ack 1, win 313, length 164
20:25:56.743911 IP lamp-s-1vcpu-1gb-nyc1-01.ssh > 198.96.85.163.26087: Flags [P.], seq 75084:75248, ack 1, win 313, length 164
20:25:56.744065 IP lamp-s-1vcpu-1gb-nyc1-01.ssh > 198.96.85.163.26087: Flags [P.], seq 75248:75412, ack 1, win 313, length 164
20:25:56.744213 IP lamp-s-1vcpu-1gb-nyc1-01.ssh > 198.96.85.163.26087: Flags [P.], seq 75412:75576, ack 1, win 313, length 164
20:25:56.744395 IP lamp-s-1vcpu-1gb-nyc1-01.ssh > 198.96.85.163.26087: Flags [P.], seq 75576:75740, ack 1, win 313, length 164
20:25:56.744562 IP lamp-s-1vcpu-1gb-nyc1-01.ssh > 198.96.85.163.26087: Flags [P.], seq 75740:75904, ack 1, win 313, length 164
20:25:56.744727 IP lamp-s-1vcpu-1gb-nyc1-01.ssh > 198.96.85.163.26087: Flags [P.], seq 75904:76068, ack 1, win 313, length 164
20:25:56.744895 IP lamp-s-1vcpu-1gb-nyc1-01.ssh > 198.96.85.163.26087: Flags [P.], seq 76068:76232, ack 1, win 313, length 164
20:25:56.745103 IP lamp-s-1vcpu-1gb-nyc1-01.ssh > 198.96.85.163.26087: Flags [P.], seq 76232:76396, ack 1, win 313, length 164
20:25:56.745257 IP 198.96.85.163.26087 > lamp-s-1vcpu-1gb-nyc1-01.ssh: Flags [.], ack 55932, win 2051, length 0
20:25:56.745447 IP lamp-s-1vcpu-1gb-nyc1-01.ssh > 198.96.85.163.26087: Flags [P.], seq 76396:76672, ack 1, win 313, length 276
20:25:56.745572 IP lamp-s-1vcpu-1gb-nyc1-01.ssh > 198.96.85.163.26087: Flags [P.], seq 76672:76836, ack 1, win 313, length 164
20:25:56.745673 IP lamp-s-1vcpu-1gb-nyc1-01.ssh > 198.96.85.163.26087: Flags [P.], seq 76836:77000, ack 1, win 313, length 164
20:25:56.745777 IP lamp-s-1vcpu-1gb-nyc1-01.ssh > 198.96.85.163.26087: Flags [P.], seq 77000:77164, ack 1, win 313, length 164
20:25:56.745881 IP lamp-s-1vcpu-1gb-nyc1-01.ssh > 198.96.85.163.26087: Flags [P.], seq 77164:77328, ack 1, win 313, length 164
20:25:56.746031 IP lamp-s-1vcpu-1gb-nyc1-01.ssh > 198.96.85.163.26087: Flags [P.], seq 77328:77492, ack 1, win 313, length 164
20:25:56.746185 IP lamp-s-1vcpu-1gb-nyc1-01.ssh > 198.96.85.163.26087: Flags [P.], seq 77492:77656, ack 1, win 313, length 164
20:25:56.746395 IP lamp-s-1vcpu-1gb-nyc1-01.ssh > 198.96.85.163.26087: Flags [P.], seq 77656:77820, ack 1, win 313, length 164
20:25:56.746541 IP lamp-s-1vcpu-1gb-nyc1-01.ssh > 198.96.85.163.26087: Flags [P.], seq 77820:77984, ack 1, win 313, length 164
20:25:56.746701 IP lamp-s-1vcpu-1gb-nyc1-01.ssh > 198.96.85.163.26087: Flags [P.], seq 77984:78148, ack 1, win 313, length 164
20:25:56.746849 IP lamp-s-1vcpu-1gb-nyc1-01.ssh > 198.96.85.163.26087: Flags [P.], seq 78148:78312, ack 1, win 313, length 164
20:25:56.747011 IP lamp-s-1vcpu-1gb-nyc1-01.ssh > 198.96.85.163.26087: Flags [P.], seq 78312:78476, ack 1, win 313, length 164
20:25:56.747158 IP lamp-s-1vcpu-1gb-nyc1-01.ssh > 198.96.85.163.26087: Flags [P.], seq 78476:78640, ack 1, win 313, length 164
20:25:56.747318 IP lamp-s-1vcpu-1gb-nyc1-01.ssh > 198.96.85.163.26087: Flags [P.], seq 78640:78804, ack 1, win 313, length 164
20:25:56.747462 IP lamp-s-1vcpu-1gb-nyc1-01.ssh > 198.96.85.163.26087: Flags [P.], seq 78804:78968, ack 1, win 313, length 164
20:25:56.747619 IP lamp-s-1vcpu-1gb-nyc1-01.ssh > 198.96.85.163.26087: Flags [P.], seq 78968:79132, ack 1, win 313, length 164
20:25:56.747774 IP lamp-s-1vcpu-1gb-nyc1-01.ssh > 198.96.85.163.26087: Flags [P.], seq 79132:79296, ack 1, win 313, length 164
20:25:56.747934 IP lamp-s-1vcpu-1gb-nyc1-01.ssh > 198.96.85.163.26087: Flags [P.], seq 79296:79460, ack 1, win 313, length 164
20:25:56.748092 IP lamp-s-1vcpu-1gb-nyc1-01.ssh > 198.96.85.163.26087: Flags [P.], seq 79460:79624, ack 1, win 313, length 164
20:25:56.748170 IP 198.96.85.163.26087 > lamp-s-1vcpu-1gb-nyc1-01.ssh: Flags [.], ack 58832, win 2051, length 0
20:25:56.748367 IP lamp-s-1vcpu-1gb-nyc1-01.ssh > 198.96.85.163.26087: Flags [P.], seq 79624:79900, ack 1, win 313, length 276
20:25:56.748530 IP lamp-s-1vcpu-1gb-nyc1-01.ssh > 198.96.85.163.26087: Flags [P.], seq 79900:80064, ack 1, win 313, length 164
20:25:56.748684 IP lamp-s-1vcpu-1gb-nyc1-01.ssh > 198.96.85.163.26087: Flags [P.], seq 80064:80228, ack 1, win 313, length 164
20:25:56.748828 IP lamp-s-1vcpu-1gb-nyc1-01.ssh > 198.96.85.163.26087: Flags [P.], seq 80228:80392, ack 1, win 313, length 164
20:25:56.748973 IP lamp-s-1vcpu-1gb-nyc1-01.ssh > 198.96.85.163.26087: Flags [P.], seq 80392:80556, ack 1, win 313, length 164
20:25:56.749116 IP lamp-s-1vcpu-1gb-nyc1-01.ssh > 198.96.85.163.26087: Flags [P.], seq 80556:80720, ack 1, win 313, length 164
20:25:56.749228 IP lamp-s-1vcpu-1gb-nyc1-01.ssh > 198.96.85.163.26087: Flags [P.], seq 80720:80884, ack 1, win 313, length 164
20:25:56.749333 IP lamp-s-1vcpu-1gb-nyc1-01.ssh > 198.96.85.163.26087: Flags [P.], seq 80884:81048, ack 1, win 313, length 164
20:25:56.749446 IP lamp-s-1vcpu-1gb-nyc1-01.ssh > 198.96.85.163.26087: Flags [P.], seq 81048:81212, ack 1, win 313, length 164
20:25:56.749590 IP lamp-s-1vcpu-1gb-nyc1-01.ssh > 198.96.85.163.26087: Flags [P.], seq 81212:81376, ack 1, win 313, length 164
20:25:56.749721 IP lamp-s-1vcpu-1gb-nyc1-01.ssh > 198.96.85.163.26087: Flags [P.], seq 81376:81540, ack 1, win 313, length 164
20:25:56.749841 IP lamp-s-1vcpu-1gb-nyc1-01.ssh > 198.96.85.163.26087: Flags [P.], seq 81540:81704, ack 1, win 313, length 164
20:25:56.749976 IP lamp-s-1vcpu-1gb-nyc1-01.ssh > 198.96.85.163.26087: Flags [P.], seq 81704:81868, ack 1, win 313, length 164
20:25:56.750145 IP lamp-s-1vcpu-1gb-nyc1-01.ssh > 198.96.85.163.26087: Flags [P.], seq 81868:82032, ack 1, win 313, length 164
20:25:56.750325 IP lamp-s-1vcpu-1gb-nyc1-01.ssh > 198.96.85.163.26087: Flags [P.], seq 82032:82196, ack 1, win 313, length 164
20:25:56.750448 IP lamp-s-1vcpu-1gb-nyc1-01.ssh > 198.96.85.163.26087: Flags [P.], seq 82196:82360, ack 1, win 313, length 164
20:25:56.750595 IP lamp-s-1vcpu-1gb-nyc1-01.ssh > 198.96.85.163.26087: Flags [P.], seq 82360:82524, ack 1, win 313, length 164
20:25:56.750750 IP lamp-s-1vcpu-1gb-nyc1-01.ssh > 198.96.85.163.26087: Flags [P.], seq 82524:82688, ack 1, win 313, length 164
20:25:56.750866 IP lamp-s-1vcpu-1gb-nyc1-01.ssh > 198.96.85.163.26087: Flags [P.], seq 82688:82852, ack 1, win 313, length 164
20:25:56.750980 IP lamp-s-1vcpu-1gb-nyc1-01.ssh > 198.96.85.163.26087: Flags [P.], seq 82852:83016, ack 1, win 313, length 164
20:25:56.751134 IP lamp-s-1vcpu-1gb-nyc1-01.ssh > 198.96.85.163.26087: Flags [P.], seq 83016:83180, ack 1, win 313, length 164
20:25:56.751237 IP lamp-s-1vcpu-1gb-nyc1-01.ssh > 198.96.85.163.26087: Flags [P.], seq 83180:83344, ack 1, win 313, length 164
20:25:56.751364 IP lamp-s-1vcpu-1gb-nyc1-01.ssh > 198.96.85.163.26087: Flags [P.], seq 83344:83508, ack 1, win 313, length 164
20:25:56.751497 IP lamp-s-1vcpu-1gb-nyc1-01.ssh > 198.96.85.163.26087: Flags [P.], seq 83508:83672, ack 1, win 313, length 164
20:25:56.751605 IP lamp-s-1vcpu-1gb-nyc1-01.ssh > 198.96.85.163.26087: Flags [P.], seq 83672:83836, ack 1, win 313, length 164
20:25:56.751738 IP lamp-s-1vcpu-1gb-nyc1-01.ssh > 198.96.85.163.26087: Flags [P.], seq 83836:84000, ack 1, win 313, length 164
20:25:56.751851 IP lamp-s-1vcpu-1gb-nyc1-01.ssh > 198.96.85.163.26087: Flags [P.], seq 84000:84164, ack 1, win 313, length 164
20:25:56.751988 IP lamp-s-1vcpu-1gb-nyc1-01.ssh > 198.96.85.163.26087: Flags [P.], seq 84164:84328, ack 1, win 313, length 164
20:25:56.752112 IP lamp-s-1vcpu-1gb-nyc1-01.ssh > 198.96.85.163.26087: Flags [P.], seq 84328:84492, ack 1, win 313, length 164
20:25:56.752248 IP lamp-s-1vcpu-1gb-nyc1-01.ssh > 198.96.85.163.26087: Flags [P.], seq 84492:84656, ack 1, win 313, length 164
20:25:56.752358 IP lamp-s-1vcpu-1gb-nyc1-01.ssh > 198.96.85.163.26087: Flags [P.], seq 84656:84820, ack 1, win 313, length 164
20:25:56.752488 IP lamp-s-1vcpu-1gb-nyc1-01.ssh > 198.96.85.163.26087: Flags [P.], seq 84820:84984, ack 1, win 313, length 164
20:25:56.752602 IP lamp-s-1vcpu-1gb-nyc1-01.ssh > 198.96.85.163.26087: Flags [P.], seq 84984:85148, ack 1, win 313, length 164
20:25:56.752707 IP lamp-s-1vcpu-1gb-nyc1-01.ssh > 198.96.85.163.26087: Flags [P.], seq 85148:85312, ack 1, win 313, length 164
20:25:56.752844 IP lamp-s-1vcpu-1gb-nyc1-01.ssh > 198.96.85.163.26087: Flags [P.], seq 85312:85476, ack 1, win 313, length 164
20:25:56.752932 IP lamp-s-1vcpu-1gb-nyc1-01.ssh > 198.96.85.163.26087: Flags [P.], seq 85476:85640, ack 1, win 313, length 164
20:25:56.753010 IP lamp-s-1vcpu-1gb-nyc1-01.ssh > 198.96.85.163.26087: Flags [P.], seq 85640:85804, ack 1, win 313, length 164
20:25:56.753134 IP lamp-s-1vcpu-1gb-nyc1-01.ssh > 198.96.85.163.26087: Flags [P.], seq 85804:85968, ack 1, win 313, length 164
20:25:56.753190 IP 198.96.85.163.26087 > lamp-s-1vcpu-1gb-nyc1-01.ssh: Flags [.], ack 63976, win 2051, length 0
20:25:56.753356 IP lamp-s-1vcpu-1gb-nyc1-01.ssh > 198.96.85.163.26087: Flags [P.], seq 85968:86244, ack 1, win 313, length 276
20:25:56.753469 IP lamp-s-1vcpu-1gb-nyc1-01.ssh > 198.96.85.163.26087: Flags [P.], seq 86244:86408, ack 1, win 313, length 164
20:25:56.753562 IP lamp-s-1vcpu-1gb-nyc1-01.ssh > 198.96.85.163.26087: Flags [P.], seq 86408:86572, ack 1, win 313, length 164
20:25:56.753648 IP lamp-s-1vcpu-1gb-nyc1-01.ssh > 198.96.85.163.26087: Flags [P.], seq 86572:86736, ack 1, win 313, length 164
20:25:56.753746 IP lamp-s-1vcpu-1gb-nyc1-01.ssh > 198.96.85.163.26087: Flags [P.], seq 86736:86900, ack 1, win 313, length 164
20:25:56.753840 IP 198.96.85.163.26087 > lamp-s-1vcpu-1gb-nyc1-01.ssh: Flags [.], ack 66764, win 2051, length 0
20:25:56.753856 IP lamp-s-1vcpu-1gb-nyc1-01.ssh > 198.96.85.163.26087: Flags [P.], seq 86900:87064, ack 1, win 313, length 164
20:25:56.754031 IP lamp-s-1vcpu-1gb-nyc1-01.ssh > 198.96.85.163.26087: Flags [P.], seq 87064:87340, ack 1, win 313, length 276
20:25:56.754176 IP lamp-s-1vcpu-1gb-nyc1-01.ssh > 198.96.85.163.26087: Flags [P.], seq 87340:87504, ack 1, win 313, length 164
20:25:56.754327 IP lamp-s-1vcpu-1gb-nyc1-01.ssh > 198.96.85.163.26087: Flags [P.], seq 87504:87668, ack 1, win 313, length 164
20:25:56.754419 IP lamp-s-1vcpu-1gb-nyc1-01.ssh > 198.96.85.163.26087: Flags [P.], seq 87668:87832, ack 1, win 313, length 164
20:25:56.754498 IP lamp-s-1vcpu-1gb-nyc1-01.ssh > 198.96.85.163.26087: Flags [P.], seq 87832:87996, ack 1, win 313, length 164
20:25:56.754573 IP lamp-s-1vcpu-1gb-nyc1-01.ssh > 198.96.85.163.26087: Flags [P.], seq 87996:88160, ack 1, win 313, length 164
20:25:56.754638 IP 198.96.85.163.26087 > lamp-s-1vcpu-1gb-nyc1-01.ssh: Flags [P.], seq 1:37, ack 66764, win 2051, length 36
20:25:56.754726 IP lamp-s-1vcpu-1gb-nyc1-01.ssh > 198.96.85.163.26087: Flags [P.], seq 88160:88452, ack 37, win 313, length 292
20:25:56.754809 IP lamp-s-1vcpu-1gb-nyc1-01.ssh > 198.96.85.163.26087: Flags [P.], seq 88452:88616, ack 37, win 313, length 164
20:25:56.754883 IP lamp-s-1vcpu-1gb-nyc1-01.ssh > 198.96.85.163.26087: Flags [P.], seq 88616:88780, ack 37, win 313, length 164
20:25:56.754970 IP lamp-s-1vcpu-1gb-nyc1-01.ssh > 198.96.85.163.26087: Flags [P.], seq 88780:88944, ack 37, win 313, length 164
20:25:56.755115 IP lamp-s-1vcpu-1gb-nyc1-01.ssh > 198.96.85.163.26087: Flags [P.], seq 88944:89108, ack 37, win 313, length 164
20:25:56.755270 IP lamp-s-1vcpu-1gb-nyc1-01.ssh > 198.96.85.163.26087: Flags [P.], seq 89108:89272, ack 37, win 313, length 164
20:25:56.755360 IP lamp-s-1vcpu-1gb-nyc1-01.ssh > 198.96.85.163.26087: Flags [P.], seq 89272:89436, ack 37, win 313, length 164
20:25:56.755437 IP lamp-s-1vcpu-1gb-nyc1-01.ssh > 198.96.85.163.26087: Flags [P.], seq 89436:89600, ack 37, win 313, length 164
20:25:56.755510 IP lamp-s-1vcpu-1gb-nyc1-01.ssh > 198.96.85.163.26087: Flags [P.], seq 89600:89764, ack 37, win 313, length 164
20:25:56.755582 IP 198.96.85.163.26087 > lamp-s-1vcpu-1gb-nyc1-01.ssh: Flags [.], ack 70372, win 2051, length 0
20:25:56.755668 IP lamp-s-1vcpu-1gb-nyc1-01.ssh > 198.96.85.163.26087: Flags [P.], seq 89764:90040, ack 37, win 313, length 276
20:25:56.755751 IP lamp-s-1vcpu-1gb-nyc1-01.ssh > 198.96.85.163.26087: Flags [P.], seq 90040:90204, ack 37, win 313, length 164
20:25:56.755826 IP lamp-s-1vcpu-1gb-nyc1-01.ssh > 198.96.85.163.26087: Flags [P.], seq 90204:90368, ack 37, win 313, length 164
20:25:56.755901 IP lamp-s-1vcpu-1gb-nyc1-01.ssh > 198.96.85.163.26087: Flags [P.], seq 90368:90532, ack 37, win 313, length 164
20:25:56.756018 IP lamp-s-1vcpu-1gb-nyc1-01.ssh > 198.96.85.163.26087: Flags [P.], seq 90532:90696, ack 37, win 313, length 164
20:25:56.756111 IP lamp-s-1vcpu-1gb-nyc1-01.ssh > 198.96.85.163.26087: Flags [P.], seq 90696:90860, ack 37, win 313, length 164
20:25:56.756197 IP lamp-s-1vcpu-1gb-nyc1-01.ssh > 198.96.85.163.26087: Flags [P.], seq 90860:91024, ack 37, win 313, length 164
20:25:56.756272 IP lamp-s-1vcpu-1gb-nyc1-01.ssh > 198.96.85.163.26087: Flags [P.], seq 91024:91188, ack 37, win 313, length 164
20:25:56.756347 IP lamp-s-1vcpu-1gb-nyc1-01.ssh > 198.96.85.163.26087: Flags [P.], seq 91188:91352, ack 37, win 313, length 164
20:25:56.756448 IP lamp-s-1vcpu-1gb-nyc1-01.ssh > 198.96.85.163.26087: Flags [P.], seq 91352:91516, ack 37, win 313, length 164
20:25:56.756543 IP lamp-s-1vcpu-1gb-nyc1-01.ssh > 198.96.85.163.26087: Flags [P.], seq 91516:91680, ack 37, win 313, length 164
20:25:56.756663 IP lamp-s-1vcpu-1gb-nyc1-01.ssh > 198.96.85.163.26087: Flags [P.], seq 91680:91844, ack 37, win 313, length 164
20:25:56.756749 IP lamp-s-1vcpu-1gb-nyc1-01.ssh > 198.96.85.163.26087: Flags [P.], seq 91844:92008, ack 37, win 313, length 164
20:25:56.756825 IP lamp-s-1vcpu-1gb-nyc1-01.ssh > 198.96.85.163.26087: Flags [P.], seq 92008:92172, ack 37, win 313, length 164
20:25:56.756898 IP lamp-s-1vcpu-1gb-nyc1-01.ssh > 198.96.85.163.26087: Flags [P.], seq 92172:92336, ack 37, win 313, length 164
20:25:56.756996 IP lamp-s-1vcpu-1gb-nyc1-01.ssh > 198.96.85.163.26087: Flags [P.], seq 92336:92500, ack 37, win 313, length 164
20:25:56.757154 IP lamp-s-1vcpu-1gb-nyc1-01.ssh > 198.96.85.163.26087: Flags [P.], seq 92500:92664, ack 37, win 313, length 164
20:25:56.757272 IP lamp-s-1vcpu-1gb-nyc1-01.ssh > 198.96.85.163.26087: Flags [P.], seq 92664:92828, ack 37, win 313, length 164
20:25:56.757357 IP lamp-s-1vcpu-1gb-nyc1-01.ssh > 198.96.85.163.26087: Flags [P.], seq 92828:92992, ack 37, win 313, length 164
20:25:56.757449 IP lamp-s-1vcpu-1gb-nyc1-01.ssh > 198.96.85.163.26087: Flags [P.], seq 92992:93156, ack 37, win 313, length 164
20:25:56.757558 IP lamp-s-1vcpu-1gb-nyc1-01.ssh > 198.96.85.163.26087: Flags [P.], seq 93156:93320, ack 37, win 313, length 164
20:25:56.757647 IP lamp-s-1vcpu-1gb-nyc1-01.ssh > 198.96.85.163.26087: Flags [P.], seq 93320:93484, ack 37, win 313, length 164
20:25:56.757735 IP lamp-s-1vcpu-1gb-nyc1-01.ssh > 198.96.85.163.26087: Flags [P.], seq 93484:93648, ack 37, win 313, length 164
20:25:56.757838 IP lamp-s-1vcpu-1gb-nyc1-01.ssh > 198.96.85.163.26087: Flags [P.], seq 93648:93812, ack 37, win 313, length 164
20:25:56.757935 IP lamp-s-1vcpu-1gb-nyc1-01.ssh > 198.96.85.163.26087: Flags [P.], seq 93812:93976, ack 37, win 313, length 164
20:25:56.758073 IP lamp-s-1vcpu-1gb-nyc1-01.ssh > 198.96.85.163.26087: Flags [P.], seq 93976:94140, ack 37, win 313, length 164
20:25:56.758167 IP lamp-s-1vcpu-1gb-nyc1-01.ssh > 198.96.85.163.26087: Flags [P.], seq 94140:94304, ack 37, win 313, length 164
20:25:56.758330 IP lamp-s-1vcpu-1gb-nyc1-01.ssh > 198.96.85.163.26087: Flags [P.], seq 94304:94468, ack 37, win 313, length 164
20:25:56.758447 IP lamp-s-1vcpu-1gb-nyc1-01.ssh > 198.96.85.163.26087: Flags [P.], seq 94468:94632, ack 37, win 313, length 164
20:25:56.758530 IP lamp-s-1vcpu-1gb-nyc1-01.ssh > 198.96.85.163.26087: Flags [P.], seq 94632:94796, ack 37, win 313, length 164
20:25:56.758607 IP lamp-s-1vcpu-1gb-nyc1-01.ssh > 198.96.85.163.26087: Flags [P.], seq 94796:94960, ack 37, win 313, length 164
20:25:56.758684 IP lamp-s-1vcpu-1gb-nyc1-01.ssh > 198.96.85.163.26087: Flags [P.], seq 94960:95124, ack 37, win 313, length 164
20:25:56.758759 IP lamp-s-1vcpu-1gb-nyc1-01.ssh > 198.96.85.163.26087: Flags [P.], seq 95124:95288, ack 37, win 313, length 164
20:25:56.758833 IP lamp-s-1vcpu-1gb-nyc1-01.ssh > 198.96.85.163.26087: Flags [P.], seq 95288:95452, ack 37, win 313, length 164
20:25:56.758908 IP lamp-s-1vcpu-1gb-nyc1-01.ssh > 198.96.85.163.26087: Flags [P.], seq 95452:95616, ack 37, win 313, length 164
20:25:56.759029 IP lamp-s-1vcpu-1gb-nyc1-01.ssh > 198.96.85.163.26087: Flags [P.], seq 95616:95780, ack 37, win 313, length 164
20:25:56.759169 IP lamp-s-1vcpu-1gb-nyc1-01.ssh > 198.96.85.163.26087: Flags [P.], seq 95780:95944, ack 37, win 313, length 164
20:25:56.759267 IP lamp-s-1vcpu-1gb-nyc1-01.ssh > 198.96.85.163.26087: Flags [P.], seq 95944:96108, ack 37, win 313, length 164
20:25:56.759345 IP lamp-s-1vcpu-1gb-nyc1-01.ssh > 198.96.85.163.26087: Flags [P.], seq 96108:96272, ack 37, win 313, length 164
20:25:56.759420 IP lamp-s-1vcpu-1gb-nyc1-01.ssh > 198.96.85.163.26087: Flags [P.], seq 96272:96436, ack 37, win 313, length 164
20:25:56.759494 IP lamp-s-1vcpu-1gb-nyc1-01.ssh > 198.96.85.163.26087: Flags [P.], seq 96436:96600, ack 37, win 313, length 164
20:25:56.759568 IP lamp-s-1vcpu-1gb-nyc1-01.ssh > 198.96.85.163.26087: Flags [P.], seq 96600:96764, ack 37, win 313, length 164
20:25:56.759642 IP lamp-s-1vcpu-1gb-nyc1-01.ssh > 198.96.85.163.26087: Flags [P.], seq 96764:96928, ack 37, win 313, length 164
20:25:56.759752 IP lamp-s-1vcpu-1gb-nyc1-01.ssh > 198.96.85.163.26087: Flags [P.], seq 96928:97092, ack 37, win 313, length 164
20:25:56.759844 IP lamp-s-1vcpu-1gb-nyc1-01.ssh > 198.96.85.163.26087: Flags [P.], seq 97092:97256, ack 37, win 313, length 164
20:25:56.759924 IP lamp-s-1vcpu-1gb-nyc1-01.ssh > 198.96.85.163.26087: Flags [P.], seq 97256:97420, ack 37, win 313, length 164
20:25:56.760054 IP lamp-s-1vcpu-1gb-nyc1-01.ssh > 198.96.85.163.26087: Flags [P.], seq 97420:97584, ack 37, win 313, length 164
20:25:56.760140 IP lamp-s-1vcpu-1gb-nyc1-01.ssh > 198.96.85.163.26087: Flags [P.], seq 97584:97748, ack 37, win 313, length 164
20:25:56.760222 IP lamp-s-1vcpu-1gb-nyc1-01.ssh > 198.96.85.163.26087: Flags [P.], seq 97748:97912, ack 37, win 313, length 164
20:25:56.760296 IP lamp-s-1vcpu-1gb-nyc1-01.ssh > 198.96.85.163.26087: Flags [P.], seq 97912:98076, ack 37, win 313, length 164
20:25:56.760371 IP lamp-s-1vcpu-1gb-nyc1-01.ssh > 198.96.85.163.26087: Flags [P.], seq 98076:98240, ack 37, win 313, length 164
20:25:56.760449 IP lamp-s-1vcpu-1gb-nyc1-01.ssh > 198.96.85.163.26087: Flags [P.], seq 98240:98404, ack 37, win 313, length 164
20:25:56.760527 IP lamp-s-1vcpu-1gb-nyc1-01.ssh > 198.96.85.163.26087: Flags [P.], seq 98404:98568, ack 37, win 313, length 164
20:25:56.760604 IP lamp-s-1vcpu-1gb-nyc1-01.ssh > 198.96.85.163.26087: Flags [P.], seq 98568:98732, ack 37, win 313, length 164
20:25:56.760679 IP lamp-s-1vcpu-1gb-nyc1-01.ssh > 198.96.85.163.26087: Flags [P.], seq 98732:98896, ack 37, win 313, length 164
20:25:56.760759 IP lamp-s-1vcpu-1gb-nyc1-01.ssh > 198.96.85.163.26087: Flags [P.], seq 98896:99060, ack 37, win 313, length 164
20:25:56.760836 IP lamp-s-1vcpu-1gb-nyc1-01.ssh > 198.96.85.163.26087: Flags [P.], seq 99060:99224, ack 37, win 313, length 164
20:25:56.760968 IP lamp-s-1vcpu-1gb-nyc1-01.ssh > 198.96.85.163.26087: Flags [P.], seq 99224:99388, ack 37, win 313, length 164
20:25:56.761066 IP lamp-s-1vcpu-1gb-nyc1-01.ssh > 198.96.85.163.26087: Flags [P.], seq 99388:99552, ack 37, win 313, length 164
20:25:56.761138 IP 198.96.85.163.26087 > lamp-s-1vcpu-1gb-nyc1-01.ssh: Flags [.], ack 72184, win 2051, length 0
20:25:56.761294 IP lamp-s-1vcpu-1gb-nyc1-01.ssh > 198.96.85.163.26087: Flags [P.], seq 99552:99828, ack 37, win 313, length 276
20:25:56.761389 IP lamp-s-1vcpu-1gb-nyc1-01.ssh > 198.96.85.163.26087: Flags [P.], seq 99828:99992, ack 37, win 313, length 164
20:25:56.761468 IP lamp-s-1vcpu-1gb-nyc1-01.ssh > 198.96.85.163.26087: Flags [P.], seq 99992:100156, ack 37, win 313, length 164
20:25:56.761544 IP lamp-s-1vcpu-1gb-nyc1-01.ssh > 198.96.85.163.26087: Flags [P.], seq 100156:100320, ack 37, win 313, length 164
20:25:56.761621 IP lamp-s-1vcpu-1gb-nyc1-01.ssh > 198.96.85.163.26087: Flags [P.], seq 100320:100492, ack 37, win 313, length 172
20:25:56.761695 IP lamp-s-1vcpu-1gb-nyc1-01.ssh > 198.96.85.163.26087: Flags [P.], seq 100492:100664, ack 37, win 313, length 172
20:25:56.761768 IP lamp-s-1vcpu-1gb-nyc1-01.ssh > 198.96.85.163.26087: Flags [P.], seq 100664:100836, ack 37, win 313, length 172
20:25:56.761861 IP lamp-s-1vcpu-1gb-nyc1-01.ssh > 198.96.85.163.26087: Flags [P.], seq 100836:101008, ack 37, win 313, length 172
20:25:56.761963 IP lamp-s-1vcpu-1gb-nyc1-01.ssh > 198.96.85.163.26087: Flags [P.], seq 101008:101180, ack 37, win 313, length 172
20:25:56.762048 IP lamp-s-1vcpu-1gb-nyc1-01.ssh > 198.96.85.163.26087: Flags [P.], seq 101180:101352, ack 37, win 313, length 172
20:25:56.762126 IP lamp-s-1vcpu-1gb-nyc1-01.ssh > 198.96.85.163.26087: Flags [P.], seq 101352:101524, ack 37, win 313, length 172
20:25:56.762203 IP lamp-s-1vcpu-1gb-nyc1-01.ssh > 198.96.85.163.26087: Flags [P.], seq 101524:101696, ack 37, win 313, length 172
20:25:56.762310 IP lamp-s-1vcpu-1gb-nyc1-01.ssh > 198.96.85.163.26087: Flags [P.], seq 101696:101868, ack 37, win 313, length 172
20:25:56.762393 IP lamp-s-1vcpu-1gb-nyc1-01.ssh > 198.96.85.163.26087: Flags [P.], seq 101868:102040, ack 37, win 313, length 172
20:25:56.762480 IP lamp-s-1vcpu-1gb-nyc1-01.ssh > 198.96.85.163.26087: Flags [P.], seq 102040:102212, ack 37, win 313, length 172
20:25:56.762573 IP lamp-s-1vcpu-1gb-nyc1-01.ssh > 198.96.85.163.26087: Flags [P.], seq 102212:102384, ack 37, win 313, length 172
20:25:56.762653 IP lamp-s-1vcpu-1gb-nyc1-01.ssh > 198.96.85.163.26087: Flags [P.], seq 102384:102556, ack 37, win 313, length 172
20:25:56.762732 IP lamp-s-1vcpu-1gb-nyc1-01.ssh > 198.96.85.163.26087: Flags [P.], seq 102556:102728, ack 37, win 313, length 172
20:25:56.762808 IP lamp-s-1vcpu-1gb-nyc1-01.ssh > 198.96.85.163.26087: Flags [P.], seq 102728:102900, ack 37, win 313, length 172
20:25:56.762891 IP lamp-s-1vcpu-1gb-nyc1-01.ssh > 198.96.85.163.26087: Flags [P.], seq 102900:103072, ack 37, win 313, length 172
20:25:56.762965 IP lamp-s-1vcpu-1gb-nyc1-01.ssh > 198.96.85.163.26087: Flags [P.], seq 103072:103244, ack 37, win 313, length 172
20:25:56.763052 IP lamp-s-1vcpu-1gb-nyc1-01.ssh > 198.96.85.163.26087: Flags [P.], seq 103244:103416, ack 37, win 313, length 172
20:25:56.763151 IP lamp-s-1vcpu-1gb-nyc1-01.ssh > 198.96.85.163.26087: Flags [P.], seq 103416:103588, ack 37, win 313, length 172
20:25:56.763226 IP lamp-s-1vcpu-1gb-nyc1-01.ssh > 198.96.85.163.26087: Flags [P.], seq 103588:103760, ack 37, win 313, length 172
20:25:56.763337 IP lamp-s-1vcpu-1gb-nyc1-01.ssh > 198.96.85.163.26087: Flags [P.], seq 103760:103932, ack 37, win 313, length 172
20:25:56.763447 IP lamp-s-1vcpu-1gb-nyc1-01.ssh > 198.96.85.163.26087: Flags [P.], seq 103932:104104, ack 37, win 313, length 172
20:25:56.763579 IP lamp-s-1vcpu-1gb-nyc1-01.ssh > 198.96.85.163.26087: Flags [P.], seq 104104:104276, ack 37, win 313, length 172
20:25:56.763691 IP lamp-s-1vcpu-1gb-nyc1-01.ssh > 198.96.85.163.26087: Flags [P.], seq 104276:104448, ack 37, win 313, length 172
20:25:56.763773 IP lamp-s-1vcpu-1gb-nyc1-01.ssh > 198.96.85.163.26087: Flags [P.], seq 104448:104620, ack 37, win 313, length 172
20:25:56.763848 IP lamp-s-1vcpu-1gb-nyc1-01.ssh > 198.96.85.163.26087: Flags [P.], seq 104620:104792, ack 37, win 313, length 172
20:25:56.763938 IP lamp-s-1vcpu-1gb-nyc1-01.ssh > 198.96.85.163.26087: Flags [P.], seq 104792:104964, ack 37, win 313, length 172
20:25:56.764037 IP lamp-s-1vcpu-1gb-nyc1-01.ssh > 198.96.85.163.26087: Flags [P.], seq 104964:105136, ack 37, win 313, length 172
20:25:56.764119 IP lamp-s-1vcpu-1gb-nyc1-01.ssh > 198.96.85.163.26087: Flags [P.], seq 105136:105308, ack 37, win 313, length 172
20:25:56.764219 IP lamp-s-1vcpu-1gb-nyc1-01.ssh > 198.96.85.163.26087: Flags [P.], seq 105308:105480, ack 37, win 313, length 172
20:25:56.764282 IP 198.96.85.163.26087 > lamp-s-1vcpu-1gb-nyc1-01.ssh: Flags [.], ack 75412, win 2051, length 0
20:25:56.764387 IP lamp-s-1vcpu-1gb-nyc1-01.ssh > 198.96.85.163.26087: Flags [P.], seq 105480:105764, ack 37, win 313, length 284
20:25:56.764473 IP lamp-s-1vcpu-1gb-nyc1-01.ssh > 198.96.85.163.26087: Flags [P.], seq 105764:105936, ack 37, win 313, length 172
20:25:56.764549 IP lamp-s-1vcpu-1gb-nyc1-01.ssh > 198.96.85.163.26087: Flags [P.], seq 105936:106108, ack 37, win 313, length 172
20:25:56.764624 IP lamp-s-1vcpu-1gb-nyc1-01.ssh > 198.96.85.163.26087: Flags [P.], seq 106108:106280, ack 37, win 313, length 172
20:25:56.764698 IP lamp-s-1vcpu-1gb-nyc1-01.ssh > 198.96.85.163.26087: Flags [P.], seq 106280:106452, ack 37, win 313, length 172
20:25:56.764772 IP lamp-s-1vcpu-1gb-nyc1-01.ssh > 198.96.85.163.26087: Flags [P.], seq 106452:106624, ack 37, win 313, length 172
20:25:56.764847 IP lamp-s-1vcpu-1gb-nyc1-01.ssh > 198.96.85.163.26087: Flags [P.], seq 106624:106796, ack 37, win 313, length 172
20:25:56.764925 IP lamp-s-1vcpu-1gb-nyc1-01.ssh > 198.96.85.163.26087: Flags [P.], seq 106796:106968, ack 37, win 313, length 172
20:25:56.765038 IP lamp-s-1vcpu-1gb-nyc1-01.ssh > 198.96.85.163.26087: Flags [P.], seq 106968:107140, ack 37, win 313, length 172
20:25:56.765137 IP 198.96.85.163.26087 > lamp-s-1vcpu-1gb-nyc1-01.ssh: Flags [.], ack 76396, win 2047, length 0
20:25:56.765259 IP lamp-s-1vcpu-1gb-nyc1-01.ssh > 198.96.85.163.26087: Flags [P.], seq 107140:107424, ack 37, win 313, length 284
20:25:56.765365 IP lamp-s-1vcpu-1gb-nyc1-01.ssh > 198.96.85.163.26087: Flags [P.], seq 107424:107596, ack 37, win 313, length 172
20:25:56.765455 IP lamp-s-1vcpu-1gb-nyc1-01.ssh > 198.96.85.163.26087: Flags [P.], seq 107596:107768, ack 37, win 313, length 172
20:25:56.765530 IP lamp-s-1vcpu-1gb-nyc1-01.ssh > 198.96.85.163.26087: Flags [P.], seq 107768:107940, ack 37, win 313, length 172
20:25:56.765609 IP lamp-s-1vcpu-1gb-nyc1-01.ssh > 198.96.85.163.26087: Flags [P.], seq 107940:108112, ack 37, win 313, length 172
20:25:56.765682 IP lamp-s-1vcpu-1gb-nyc1-01.ssh > 198.96.85.163.26087: Flags [P.], seq 108112:108284, ack 37, win 313, length 172
20:25:56.765756 IP lamp-s-1vcpu-1gb-nyc1-01.ssh > 198.96.85.163.26087: Flags [P.], seq 108284:108456, ack 37, win 313, length 172
20:25:56.765831 IP lamp-s-1vcpu-1gb-nyc1-01.ssh > 198.96.85.163.26087: Flags [P.], seq 108456:108628, ack 37, win 313, length 172
20:25:56.765925 IP lamp-s-1vcpu-1gb-nyc1-01.ssh > 198.96.85.163.26087: Flags [P.], seq 108628:108800, ack 37, win 313, length 172
20:25:56.766019 IP lamp-s-1vcpu-1gb-nyc1-01.ssh > 198.96.85.163.26087: Flags [P.], seq 108800:108972, ack 37, win 313, length 172
20:25:56.766098 IP lamp-s-1vcpu-1gb-nyc1-01.ssh > 198.96.85.163.26087: Flags [P.], seq 108972:109144, ack 37, win 313, length 172
20:25:56.766173 IP lamp-s-1vcpu-1gb-nyc1-01.ssh > 198.96.85.163.26087: Flags [P.], seq 109144:109316, ack 37, win 313, length 172
20:25:56.766281 IP lamp-s-1vcpu-1gb-nyc1-01.ssh > 198.96.85.163.26087: Flags [P.], seq 109316:109488, ack 37, win 313, length 172
20:25:56.766361 IP lamp-s-1vcpu-1gb-nyc1-01.ssh > 198.96.85.163.26087: Flags [P.], seq 109488:109660, ack 37, win 313, length 172
20:25:56.766435 IP lamp-s-1vcpu-1gb-nyc1-01.ssh > 198.96.85.163.26087: Flags [P.], seq 109660:109832, ack 37, win 313, length 172
20:25:56.766510 IP lamp-s-1vcpu-1gb-nyc1-01.ssh > 198.96.85.163.26087: Flags [P.], seq 109832:110004, ack 37, win 313, length 172
20:25:56.766586 IP lamp-s-1vcpu-1gb-nyc1-01.ssh > 198.96.85.163.26087: Flags [P.], seq 110004:110176, ack 37, win 313, length 172
20:25:56.766664 IP lamp-s-1vcpu-1gb-nyc1-01.ssh > 198.96.85.163.26087: Flags [P.], seq 110176:110348, ack 37, win 313, length 172
20:25:56.766743 IP lamp-s-1vcpu-1gb-nyc1-01.ssh > 198.96.85.163.26087: Flags [P.], seq 110348:110520, ack 37, win 313, length 172
20:25:56.766818 IP lamp-s-1vcpu-1gb-nyc1-01.ssh > 198.96.85.163.26087: Flags [P.], seq 110520:110692, ack 37, win 313, length 172
20:25:56.766874 IP 198.96.85.163.26087 > lamp-s-1vcpu-1gb-nyc1-01.ssh: Flags [.], ack 77820, win 2051, length 0
20:25:56.766961 IP lamp-s-1vcpu-1gb-nyc1-01.ssh > 198.96.85.163.26087: Flags [P.], seq 110692:110976, ack 37, win 313, length 284
20:25:56.766982 IP 198.96.85.163.26087 > lamp-s-1vcpu-1gb-nyc1-01.ssh: Flags [.], ack 78476, win 2049, length 0
20:25:56.766989 IP 198.96.85.163.26087 > lamp-s-1vcpu-1gb-nyc1-01.ssh: Flags [.], ack 79132, win 2051, length 0
20:25:56.767106 IP lamp-s-1vcpu-1gb-nyc1-01.ssh > 198.96.85.163.26087: Flags [P.], seq 110976:111372, ack 37, win 313, length 396
20:25:56.767212 IP lamp-s-1vcpu-1gb-nyc1-01.ssh > 198.96.85.163.26087: Flags [P.], seq 111372:111544, ack 37, win 313, length 172
20:25:56.767310 IP lamp-s-1vcpu-1gb-nyc1-01.ssh > 198.96.85.163.26087: Flags [P.], seq 111544:111716, ack 37, win 313, length 172
20:25:56.767405 IP 198.96.85.163.26087 > lamp-s-1vcpu-1gb-nyc1-01.ssh: Flags [P.], seq 37:73, ack 79132, win 2051, length 36
20:25:56.767414 IP 198.96.85.163.26087 > lamp-s-1vcpu-1gb-nyc1-01.ssh: Flags [.], ack 79624, win 2049, length 0
20:25:56.767419 IP lamp-s-1vcpu-1gb-nyc1-01.ssh > 198.96.85.163.26087: Flags [P.], seq 111716:111888, ack 37, win 313, length 172
^C
682 packets captured
687 packets received by filter
5 packets dropped by kernel
